HR Project Manager,Taste of Asia Group Limited,,False,"San Po Kong, Wong Tai Sin District",Information & Communication Technology,,2024-06-30 14:00,76935290,https://hk.jobsdb.com/job/76935290,San Po Kong,Wong Tai Sin,Kowloon,0,0
"Data Analyst (BI, Data Modelling) - HK Listed MNC",Charterhouse Limited,1,False,Central and Western District,Science & Technology,,2024-06-28 18:00,76895833,https://hk.jobsdb.com/job/76895833,,Central and Western,Hong Kong,0,0
Business Analyst,Soleil Jobs Company,,False,"Ngau Tau Kok, Kwun Tong District",Banking & Financial Services,,2024-06-21 18:00,76747338,https://hk.jobsdb.com/job/76747338,Ngau Tau Kok,Kwun Tong,Kowloon,0,0
Assistant Business Planning Manager (Management Accounting/Analytics) - CSF7,HKT,6,False,"Quarry Bay, Eastern District",Accounting,,2024-06-28 18:00,76912226,https://hk.jobsdb.com/job/76912226,Quarry Bay,Eastern,Hong Kong,0,0
Administrative & Project Assistant,Masterpiece Valuation Advisory Limited,2,False,"Sheung Wan, Central and Western District",Administration & Office Support,,2024-06-29 18:00,76929730,https://hk.jobsdb.com/job/76929730,Sheung Wan,Central and Western,Hong Kong,0,0
Project Manager 〜 Government Up45k,KOS International Limited,3,False,Central and Western District,Information & Communication Technology,"Bouns, Medical, AL, MPF",2024-06-28 18:00,76910056,https://hk.jobsdb.com/job/76910056,,Central and Western,Hong Kong,0,0
Business Analyst,Master Concept (Hong Kong) Limited,3,False,"Kwun Tong, Kwun Tong District",Information & Communication Technology,,2024-06-20 18:00,76717410,https://hk.jobsdb.com/job/76717410,Kwun Tong,Kwun Tong,Kowloon,0,0
Senior Data Analyst,Hutchison Ports Limited,5,False,"Tsing Yi, Kwai Tsing District",Consulting & Strategy,,2024-06-25 18:00,76813382,https://hk.jobsdb.com/job/76813382,Tsing Yi,Kwai Tsing,New Territories,0,0
Insurance - Analyst / Senior Analyst (18-21k) [Non-Sales],WallStone Partners & Company Limited,,False,"Quarry Bay, Eastern District",Insurance & Superannuation,"$18,000 - $21,000 per month",2024-06-28 18:00,76910221,https://hk.jobsdb.com/job/76910221,Quarry Bay,Eastern,Hong Kong,18000,21000
Senior E-commerce Executive (China Market),Strawberry Cosmetics (Services) Limited,2,True,"Kwun Tong, Kwun Tong District",Marketing & Communications,,2024-06-28 18:00,76900422,https://hk.jobsdb.com/job/76900422,Kwun Tong,Kwun Tong,Kowloon,0,0
Assistant Information Technology Manager / Project Manager,Hong Kong Baptist University,7,False,"Kowloon Tong, Kowloon City District",Education & Training,,2024-06-26 18:00,76840363,https://hk.jobsdb.com/job/76840363,Kowloon Tong,Kowloon City,Kowloon,0,0
Consultant Trainee / Asset Management Consultant (Welcome Fresh Graduates),**Private,5,False,"Causeway Bay, Wan Chai District",Insurance & Superannuation,"$29,999 - $44,999 per month",2024-06-27 18:00,76873006,https://hk.jobsdb.com/job/76873006,Causeway Bay,Wan Chai,Hong Kong,29999,44999
IT Project Manager / Business Analyst,IO TECH SOLUTIONS LIMITED,5,False,Hong Kong,Information & Communication Technology,,2024-06-21 18:00,76760469,https://hk.jobsdb.com/job/76760469,,,Hong Kong,0,0
Systems Analyst (Cloud Infra Architect) (Ref: 2400002I),MTR Corporation Limited,5,False,"Kowloon Bay, Kwun Tong District",Information & Communication Technology,,2024-06-28 18:00,76896796,https://hk.jobsdb.com/job/76896796,Kowloon Bay,Kwun Tong,Kowloon,0,0
Insurance Claims Handler / Loss Adjuster,Toplis & Harding (Hong Kong) Limited,1,False,"Kwun Tong, Kwun Tong District",Insurance & Superannuation,,2024-06-27 18:00,76873982,https://hk.jobsdb.com/job/76873982,Kwun Tong,Kwun Tong,Kowloon,0,0
Senior Financial Analyst,Hang Lung Properties Limited,,False,"Central, Central and Western District",Accounting,,2024-06-27 18:00,72762416,https://hk.jobsdb.com/job/72762416,Central,Central and Western,Hong Kong,0,0
Business Analyst,Shiji Information Technology (Hong Kong) Limited,2,False,"Kwun Tong, Kwun Tong District",Information & Communication Technology,"$20,000 - $25,000 per month",2024-06-14 18:00,74488505,https://hk.jobsdb.com/job/74488505,Kwun Tong,Kwun Tong,Kowloon,20000,25000
ERP Specialist (System Analyst/Business Analyst),Zabin Industries (Hong Kong) Ltd,5,True,"Lai Chi Kok, Sham Shui Po District",Information & Communication Technology,,2024-06-21 18:00,76748546,https://hk.jobsdb.com/job/76748546,Lai Chi Kok,Sham Shui Po,Kowloon,0,0
Data Analyst - (Data Platform Management),Bank of China (Hong Kong) Limited,2,True,Hong Kong,Information & Communication Technology,,2024-06-25 18:00,76816918,https://hk.jobsdb.com/job/76816918,,,Hong Kong,0,0
Business Planning Analyst at YesStyle.com Limited,Jobsdb - SmartHire,,False,"Kwai Hing, Kwai Tsing District",Information & Communication Technology,,2024-06-26 18:00,76845172,https://hk.jobsdb.com/job/76845172,Kwai Hing,Kwai Tsing,New Territories,0,0
Insurance Group - Business Analyst - Agency Project - $60k,Gravitas Recruitment Group (Hong Kong) Limited,4,False,Central and Western District,Information & Communication Technology,$45k - $60k p.a.,2024-06-14 18:00,76576999,https://hk.jobsdb.com/job/76576999,,Central and Western,Hong Kong,45000,60000
Senior Information Technology Manager - Project Management & Business Analysis,"Nanyang Commercial Bank, Limited",1,True,"Central, Central and Western District",Information & Communication Technology,,2024-06-27 18:00,76581239,https://hk.jobsdb.com/job/76581239,Central,Central and Western,Hong Kong,0,0
"Business Analyst Trainee  (5-day work, 15-20K) (IANG/Fresh Graduate Welcomed)",Fran & Wen Profit,,True,"Kwun Tong, Kwun Tong District",Banking & Financial Services,,2024-06-21 18:00,76747176,https://hk.jobsdb.com/job/76747176,Kwun Tong,Kwun Tong,Kowloon,0,0
Programmer,Global Smart Development Limited,2,False,"Lai Chi Kok, Sham Shui Po District",Information & Communication Technology,,2024-06-29 18:00,76913258,https://hk.jobsdb.com/job/76913258,Lai Chi Kok,Sham Shui Po,Kowloon,0,0
Mobile Banking (FinTech): Senior BA / BA - Major Bank,IT Solutions Ltd.,,True,Hong Kong,Information & Communication Technology,,2024-06-29 18:00,76928081,https://hk.jobsdb.com/job/76928081,,,Hong Kong,0,0
IT Manager - Infrastructure & Service Management,SF Supply Chain (Hong Kong) Limited,8,False,"Tsing Yi, Kwai Tsing District",Information & Communication Technology,,2024-06-29 18:00,76912934,https://hk.jobsdb.com/job/76912934,Tsing Yi,Kwai Tsing,New Territories,0,0
Business Analyst Trainee,Hung Hing Printing Group Ltd,,False,Sha Tin District,Information & Communication Technology,,2024-06-24 18:00,76773453,https://hk.jobsdb.com/job/76773453,,Sha Tin,New Territories,0,0
Data Analyst - Supply Chain,AS Watson Retail (HK) Limited,3,True,"Whampoa Garden, Kowloon City District","Manufacturing, Transport & Logistics",,2024-06-24 18:00,76779686,https://hk.jobsdb.com/job/76779686,Whampoa Garden,Kowloon City,Kowloon,0,0
Program Manager / Senior Project Manager - Infrastructure,Arcadis,1,True,"Kwun Tong, Kwun Tong District",Information & Communication Technology,,2024-06-28 18:00,76897093,https://hk.jobsdb.com/job/76897093,Kwun Tong,Kwun Tong,Kowloon,0,0
Assistant Project Manager (E&M),South-East Asia Investment & Agency Co Ltd,6,False,"Wan Chai, Wan Chai District",Construction,,2024-06-28 18:00,76894344,https://hk.jobsdb.com/job/76894344,Wan Chai,Wan Chai,Hong Kong,0,0
IT Business Analyst,ALDI Services Asia Limited,1,False,"Kwun Tong, Kwun Tong District",Information & Communication Technology,,2024-06-20 18:00,76703279,https://hk.jobsdb.com/job/76703279,Kwun Tong,Kwun Tong,Kowloon,0,0
Project Manager,NCSI (HK) Limited,8,False,"Tai Koo, Eastern District",Information & Communication Technology,,2024-06-26 18:00,76847333,https://hk.jobsdb.com/job/76847333,Tai Koo,Eastern,Hong Kong,0,0
Assistant Quality Assurance Officer,World-Link Logistics (Asia) Holding Limited,,False,Tsuen Wan District,"Manufacturing, Transport & Logistics",,2024-06-27 18:00,76861379,https://hk.jobsdb.com/job/76861379,,Tsuen Wan,New Territories,0,0
Analyst Programmer/ Programmer (Web/ Mobile),A&A Limited,3,False,Kwun Tong District,Information & Communication Technology,,2024-06-27 18:00,76866845,https://hk.jobsdb.com/job/76866845,,Kwun Tong,Kowloon,0,0
Assistant Business Analyst / IT Development Group / (WFH Policy) (Ref: GISS),Yusen Logistics Global Management Limited,1,False,"Kwai Hing, Kwai Tsing District",Information & Communication Technology,,2024-06-20 18:00,76058768,https://hk.jobsdb.com/job/76058768,Kwai Hing,Kwai Tsing,New Territories,0,0
Business Analyst (International Wealth Management - System Service Team),KGI Hong Kong Limited,1,False,Wan Chai District,Information & Communication Technology,,2024-06-19 18:00,76687493,https://hk.jobsdb.com/job/76687493,,Wan Chai,Hong Kong,0,0
Business Analyst / Senior Business Analyst,SML (Hong Kong) Limited,3,True,Kwun Tong District,Information & Communication Technology,,2024-06-20 18:00,76717319,https://hk.jobsdb.com/job/76717319,,Kwun Tong,Kowloon,0,0
"Officer to Assistant Manager, Product Compliance, CUD",Industrial and Commercial Bank of China (Asia) Limited,,False,"Central, Central and Western District",Banking & Financial Services,,2024-06-27 18:00,76858298,https://hk.jobsdb.com/job/76858298,Central,Central and Western,Hong Kong,0,0
Business Analyst (Loyalty program),PERSOLKELLY Hong Kong Limited,2,False,Hong Kong Island,Marketing & Communications,"$25,000 - $30,000 per month",2024-06-20 18:00,76709791,https://hk.jobsdb.com/job/76709791,,Hong Kong Island,Hong Kong,25000,30000
Quality Assurance(Customer Services) Officer (Fresh graduates are welcome),MediConCen Limited,,True,"San Po Kong, Wong Tai Sin District",Administration & Office Support,,2024-06-28 18:00,76910097,https://hk.jobsdb.com/job/76910097,San Po Kong,Wong Tai Sin,Kowloon,0,0
IT Business Analyst,JFE Consulting Limited,,False,Hong Kong,Information & Communication Technology,,2024-06-19 18:00,76678895,https://hk.jobsdb.com/job/76678895,,,Hong Kong,0,0
IT Business Analyst / Project Consultant (OS),Ringus Solution Enterprise Limited,1,False,"Mong Kok, Yau Tsim Mong District",Information & Communication Technology,,2024-06-22 18:00,76750904,https://hk.jobsdb.com/job/76750904,Mong Kok,Yau Tsim Mong,Kowloon,0,0
"Assistant Manager/ Manager, Regtech Projects",Shanghai Commercial Bank Ltd,3,False,"North Point, Eastern District",Banking & Financial Services,,2024-06-28 18:00,74665180,https://hk.jobsdb.com/job/74665180,North Point,Eastern,Hong Kong,0,0
Business Analyst,Green Tomato Limited,1,False,"Kowloon Bay, Kwun Tong District",Information & Communication Technology,,2024-06-18 18:00,75341607,https://hk.jobsdb.com/job/75341607,Kowloon Bay,Kwun Tong,Kowloon,0,0
System Analyst,Hip Hing Construction Co Ltd,2,False,"Kowloon Bay, Kwun Tong District",Information & Communication Technology,,2024-06-26 18:00,76589105,https://hk.jobsdb.com/job/76589105,Kowloon Bay,Kwun Tong,Kowloon,0,0
System Analyst (Ref.: IT-SA),Po Leung Kuk,5,False,"Causeway Bay, Wan Chai District",Information & Communication Technology,,2024-06-25 18:00,76802250,https://hk.jobsdb.com/job/76802250,Causeway Bay,Wan Chai,Hong Kong,0,0
Payment & SWIFT System Projects: Senior BA / BA - Major Bank,IT Solutions Ltd.,,True,Hong Kong,Information & Communication Technology,,2024-06-27 18:00,76860317,https://hk.jobsdb.com/job/76860317,,,Hong Kong,0,0
Business Analyst,Ricacorp Properties Limited,1,False,"Wan Chai, Wan Chai District",Information & Communication Technology,,2024-06-18 18:00,76657026,https://hk.jobsdb.com/job/76657026,Wan Chai,Wan Chai,Hong Kong,0,0
"ITO - Business Analyst (contract 12 months, renewable)",Resource Solutions Consulting Hong Kong Limited,8,False,"Quarry Bay, Eastern District",Information & Communication Technology,,2024-06-13 18:00,76568408,https://hk.jobsdb.com/job/76568408,Quarry Bay,Eastern,Hong Kong,0,0
財富管理經理 / 高級財富管理經理,China Life Insurance (Overseas) Company Limited,,False,"Hung Hom, Kowloon City District",Banking & Financial Services,"$40,000 - $60,000 per month",2024-06-27 18:00,76761733,https://hk.jobsdb.com/job/76761733,Hung Hom,Kowloon City,Kowloon,40000,60000
Commercial Assistant Finance Manager / Finance Analyst,"The Dairy Farm Company, Limited",3,True,Hong Kong,Accounting,,2024-06-26 18:00,76825663,https://hk.jobsdb.com/job/76825663,,,Hong Kong,0,0
Business Analyst / Senior Business Analyst,Automated Systems (HK) Ltd,2,False,Hong Kong,Information & Communication Technology,,2024-06-13 18:00,73528485,https://hk.jobsdb.com/job/73528485,,,Hong Kong,0,0
Assistant Commercial Officer,Hong Kong Aircraft Engineering Co Ltd,1,True,"Tung Chung, Islands District",Sales,,2024-06-27 18:00,76870343,https://hk.jobsdb.com/job/76870343,Tung Chung,Islands,New Territories,0,0
Assistant / Financial Analyst,Hutchison Telecommunications (Hong Kong) Limited,2,False,"Tsing Yi, Kwai Tsing District",Accounting,,2024-06-28 18:00,76541989,https://hk.jobsdb.com/job/76541989,Tsing Yi,Kwai Tsing,New Territories,0,0
"Business Analyst, Financial Digital Transformation",Company Confidential,5,False,Hong Kong,Information & Communication Technology,,2024-06-20 18:00,76693741,https://hk.jobsdb.com/job/76693741,,,Hong Kong,0,0
Commercial Assistant Finance Manager / Finance Analyst,DFI Development (HK) Limited,3,True,"Quarry Bay, Eastern District",Banking & Financial Services,,2024-06-25 18:00,76817894,https://hk.jobsdb.com/job/76817894,Quarry Bay,Eastern,Hong Kong,0,0
Mobile Consultant,HKT Consumer Business Group,,False,Hong Kong,Call Centre & Customer Service,,2024-06-27 18:00,76880910,https://hk.jobsdb.com/job/76880910,,,Hong Kong,0,0
Project Manager (Quant Trading) - Prominent Global Crypto Exchange Firm,Pinpoint Asia,6,False,"Admiralty, Central and Western District",Information & Communication Technology,"$60,000 - $75,000 per month",2024-06-27 18:00,76418870,https://hk.jobsdb.com/job/76418870,Admiralty,Central and Western,Hong Kong,60000,75000
Digital Transformation Project Manager - Leading Financial Institution,Pinpoint Asia,6,False,"Admiralty, Central and Western District",Information & Communication Technology,"$40,000 - $60,000 per month",2024-06-27 18:00,76880657,https://hk.jobsdb.com/job/76880657,Admiralty,Central and Western,Hong Kong,40000,60000
Senior Finance Analyst (FP&A) (Science Park),Johnson Electric Industrial Manufactory Limited,2,False,"Science Park, Tai Po District",Accounting,,2024-06-26 18:00,76830192,https://hk.jobsdb.com/job/76830192,Science Park,Tai Po,New Territories,0,0
"Project Manager-Call Centre Revamp Project-up to HKD 75,000/month + bonus",Techforce Group Limited,8,False,Central and Western District,Information & Communication Technology,"$65,000 - $80,000 per month",2024-06-28 18:00,76895301,https://hk.jobsdb.com/job/76895301,,Central and Western,Hong Kong,65000,80000
"IT Business Analyst (Testing Focus) (Up to $28,000, Contract based)",TSS,2,False,"Kowloon Tong, Kowloon City District",Information & Communication Technology,"$24,000 - $30,000 per month",2024-06-20 18:00,76702043,https://hk.jobsdb.com/job/76702043,Kowloon Tong,Kowloon City,Kowloon,24000,30000
Major Bank: BA / Senior BA (Wealth Management System),IT Solutions Ltd.,2,True,Hong Kong,Information & Communication Technology,"$30,000 - $45,000 per month",2024-06-22 18:00,76761104,https://hk.jobsdb.com/job/76761104,,,Hong Kong,30000,45000
"AVP to SVP, Financial Technology Department",Industrial and Commercial Bank of China (Asia) Limited,5,False,"Kwun Tong, Kwun Tong District",Information & Communication Technology,,2024-06-28 18:00,76886262,https://hk.jobsdb.com/job/76886262,Kwun Tong,Kwun Tong,Kowloon,0,0
Finance Analyst (Digital),Hong Kong Aero Engine Services Ltd,3,False,"Tseung Kwan O Industrial Estate, Sai Kung District",Accounting,,2024-06-24 18:00,76776639,https://hk.jobsdb.com/job/76776639,Tseung Kwan O Industrial Estate,Sai Kung,New Territories,0,0
Business Analyst,SmarTone Telecommunications Limited,,False,"Ngau Tau Kok, Kwun Tong District",Information & Communication Technology,,2024-06-21 18:00,76749184,https://hk.jobsdb.com/job/76749184,Ngau Tau Kok,Kwun Tong,Kowloon,0,0
"System Analyst/ Analyst Programmer / Business Analyst (up to76K+, Fresh welcome)",Seamatch Asia Limited,2,True,"Central, Central and Western District",Information & Communication Technology,,2024-06-21 18:00,76734201,https://hk.jobsdb.com/job/76734201,Central,Central and Western,Hong Kong,0,0
Equities Sales - Equities Department,CMB International Capital Corporation Limited,5,False,"Central, Central and Western District",Banking & Financial Services,,2024-06-28 18:00,76905883,https://hk.jobsdb.com/job/76905883,Central,Central and Western,Hong Kong,0,0
Business Analyst,SK Hong Kong Limited,2,True,"Tsim Sha Tsui, Yau Tsim Mong District",Information & Communication Technology,,2024-06-12 18:00,76527574,https://hk.jobsdb.com/job/76527574,Tsim Sha Tsui,Yau Tsim Mong,Kowloon,0,0
Manager - Rewards,CITIC Pacific Limited,8,False,"Admiralty, Central and Western District",Human Resources & Recruitment,,2024-06-28 18:00,76906778,https://hk.jobsdb.com/job/76906778,Admiralty,Central and Western,Hong Kong,0,0
Business Intelligence Engineer,Taste of Asia Group Limited,1,False,"Diamond Hill, Wong Tai Sin District",Information & Communication Technology,,2024-06-27 18:00,76876725,https://hk.jobsdb.com/job/76876725,Diamond Hill,Wong Tai Sin,Kowloon,0,0
"Consumer Bank, Compliance Business Control Senior Analyst, AVP",Citibank (Hong Kong) Limited,6,True,"Kowloon City, Kowloon City District",Banking & Financial Services,,2024-06-22 18:00,76758787,https://hk.jobsdb.com/job/76758787,Kowloon City,Kowloon City,Kowloon,0,0
Senior Manager/Manager - Policy Admin Project Management,China Life Insurance (Overseas) Company Limited,8,False,"Wan Chai, Wan Chai District",Information & Communication Technology,,2024-06-28 18:00,76912360,https://hk.jobsdb.com/job/76912360,Wan Chai,Wan Chai,Hong Kong,0,0
Business Analyst (Up to 30K!!!!),JFE Consulting Limited,2,False,Yau Tsim Mong District,Accounting,"$25,000 - $30,000 per month",2024-06-12 18:00,76535758,https://hk.jobsdb.com/job/76535758,,Yau Tsim Mong,Kowloon,25000,30000
Business Development Director - SME Business IT Advisory (Part-Time/Contract),Pine Inanna,,False,"Central, Central and Western District",Sales,"$50,000 - $55,000 per month",2024-06-30 00:00,76932813,https://hk.jobsdb.com/job/76932813,Central,Central and Western,Hong Kong,50000,55000
Analyst Programmer,Kintetsu World Express (HK) Limited,2,False,Kwun Tong District,Information & Communication Technology,,2024-06-27 18:00,76867674,https://hk.jobsdb.com/job/76867674,,Kwun Tong,Kowloon,0,0
System Analyst,TAL Apparel Limited,4,False,Yau Tsim Mong District,Information & Communication Technology,,2024-06-26 18:00,76845053,https://hk.jobsdb.com/job/76845053,,Yau Tsim Mong,Kowloon,0,0
Business Analyst (Finacial Services),Be Myjob Company Limited,5,False,Central and Western District,Information & Communication Technology,,2024-06-12 18:00,76525799,https://hk.jobsdb.com/job/76525799,,Central and Western,Hong Kong,0,0
Business Analyst,AT Global Services Limited,3,False,"Wan Chai, Wan Chai District",Information & Communication Technology,,2024-06-12 18:00,76541714,https://hk.jobsdb.com/job/76541714,Wan Chai,Wan Chai,Hong Kong,0,0
"System Analyst (Algo Trading) - MNC Fintech, up to 65k perm (Ref_4010)",TalentQuest HR Limited,3,True,Central and Western District,Information & Communication Technology,,2024-06-29 18:00,76929593,https://hk.jobsdb.com/job/76929593,,Central and Western,Hong Kong,0,0
"Senior Analyst, IT Finance",AXA Hong Kong,2,False,"Wong Chuk Hang, Southern District",Accounting,,2024-06-25 18:00,76814520,https://hk.jobsdb.com/job/76814520,Wong Chuk Hang,Southern,Hong Kong,0,0
"Assistant Manager (IT Planning and Management, PMO) - Agency Contractor",Chiyu Banking Corp Ltd,2,False,"Central, Central and Western District",Information & Communication Technology,,2024-06-29 18:00,76913453,https://hk.jobsdb.com/job/76913453,Central,Central and Western,Hong Kong,0,0
Sr. Analyst /Business Intelligence Engineer/Software Engineer/Asst. IT Manager,P & A Consultant Limited,3,True,Yau Tsim Mong District,Information & Communication Technology,"$25,000 - $35,000 per month",2024-06-21 18:00,76747454,https://hk.jobsdb.com/job/76747454,,Yau Tsim Mong,Kowloon,25000,35000
Project Manager (BI) - Multi-Projects,Bakehouse,2,False,"Chai Wan, Eastern District",Consulting & Strategy,,2024-06-27 18:00,76848125,https://hk.jobsdb.com/job/76848125,Chai Wan,Eastern,Hong Kong,0,0
IT Analyst (Application Development),Hong Kong Air Cargo Terminals Ltd,3,False,"Airport Area, Islands District",Information & Communication Technology,,2024-06-28 18:00,74479152,https://hk.jobsdb.com/job/74479152,Airport Area,Islands,New Territories,0,0
System Analyst (VTE346/J19),VTECH Corporate Services Ltd,2,False,Tai Po District,Information & Communication Technology,,2024-06-27 18:00,76861908,https://hk.jobsdb.com/job/76861908,,Tai Po,New Territories,0,0
Data Analyst,ORI Capital Limited,,False,"Wan Chai, Wan Chai District",Information & Communication Technology,,2024-06-25 18:00,76818095,https://hk.jobsdb.com/job/76818095,Wan Chai,Wan Chai,Hong Kong,0,0
"Business Analyst, Inhouse, Up to $40k",Premier Hunter,,False,"Causeway Bay, Wan Chai District",Information & Communication Technology,,2024-06-17 18:00,76605965,https://hk.jobsdb.com/job/76605965,Causeway Bay,Wan Chai,Hong Kong,0,0
"Business Analyst, Life Insurance (Ref: BA/HL)",Crossings Executive Search,3,False,Kwun Tong District,Information & Communication Technology,,2024-06-12 18:00,76525559,https://hk.jobsdb.com/job/76525559,,Kwun Tong,Kowloon,0,0
Marketing Analyst,DFI Development (HK) Limited,1,False,"Quarry Bay, Eastern District",Marketing & Communications,,2024-06-27 18:00,76446420,https://hk.jobsdb.com/job/76446420,Quarry Bay,Eastern,Hong Kong,0,0
Senior Manager - Business Transformation & Strategy,AS Watson Retail (HK) Limited,8,True,"Whampoa Garden, Kowloon City District",Consulting & Strategy,,2024-06-28 18:00,76907516,https://hk.jobsdb.com/job/76907516,Whampoa Garden,Kowloon City,Kowloon,0,0
Project Manager (Infrastructure / Application Project),Optimum Solutions (Hong Kong) Limited,,False,"Central, Central and Western District",Information & Communication Technology,,2024-06-28 18:00,76900390,https://hk.jobsdb.com/job/76900390,Central,Central and Western,Hong Kong,0,0
Senior Internal Control Analyst,Arrow Asia Pac Ltd,5,True,"Science Park, Tai Po District",Accounting,,2024-06-27 18:00,76882338,https://hk.jobsdb.com/job/76882338,Science Park,Tai Po,New Territories,0,0
Assistant Manager - Digital Transformation (Ref: JD-AMDT),Public Bank (Hong Kong) Ltd,3,False,Hong Kong,Information & Communication Technology,,2024-06-28 18:00,75434391,https://hk.jobsdb.com/job/75434391,,,Hong Kong,0,0
IT Support,Cathay Securities (Hong Kong) Limited,2,False,Central and Western District,Information & Communication Technology,,2024-06-27 18:00,76872688,https://hk.jobsdb.com/job/76872688,,Central and Western,Hong Kong,0,0
"Project Manager / Business analyst (Vancouver, perm, up to 50k)",Linkers International Limited,3,False,"Mong Kok, Yau Tsim Mong District",Information & Communication Technology,"$33,500 - $50,000 per month",2024-06-19 18:00,76689721,https://hk.jobsdb.com/job/76689721,Mong Kok,Yau Tsim Mong,Kowloon,33500,50000
IT Technician / IT Officer,St. Paul's Co-Educational College,,False,Central and Western District,Information & Communication Technology,,2024-06-29 18:00,76929734,https://hk.jobsdb.com/job/76929734,,Central and Western,Hong Kong,0,0
Project Manager,The Hong Kong Polytechnic University,,False,"Hung Hom, Kowloon City District",Education & Training,,2024-06-27 18:00,76867353,https://hk.jobsdb.com/job/76867353,Hung Hom,Kowloon City,Kowloon,0,0
Senior Data Analyst / Supervisor,Simatelex Manufactory Co Ltd,5,False,"Wong Chuk Hang, Southern District","Manufacturing, Transport & Logistics",,2024-06-24 18:00,75509925,https://hk.jobsdb.com/job/75509925,Wong Chuk Hang,Southern,Hong Kong,0,0
Associate - Structured Finance Modelling and Analytics,中証鵬元國際評級有限公司,,False,Central and Western District,Banking & Financial Services,,2024-06-28 18:00,76910175,https://hk.jobsdb.com/job/76910175,,Central and Western,Hong Kong,0,0
(Assistant)BA -Production support/defects handling/Incident management ($20-28k),Manpower Services (Hong Kong) Limited,1,False,"Wong Chuk Hang, Southern District",Information & Communication Technology,,2024-06-25 18:00,76814458,https://hk.jobsdb.com/job/76814458,Wong Chuk Hang,Southern,Hong Kong,0,0
BUSINESS EXECUTIVE,Wharf Real Estate Investment Company Limited,3,False,"Tsim Sha Tsui, Yau Tsim Mong District",Information & Communication Technology,,2024-06-28 18:00,76905348,https://hk.jobsdb.com/job/76905348,Tsim Sha Tsui,Yau Tsim Mong,Kowloon,0,0
Programmer / GIS Programmer,Esri China (Hong Kong) Ltd,,False,"Lai Chi Kok, Sham Shui Po District",Information & Communication Technology,,2024-06-29 18:00,76912994,https://hk.jobsdb.com/job/76912994,Lai Chi Kok,Sham Shui Po,Kowloon,0,0
Analyst Programmer / Programmer (Decision Support Services Team),TradeLink Technologies Ltd,,True,"Hung Hom, Kowloon City District",Information & Communication Technology,,2024-06-27 18:00,76860320,https://hk.jobsdb.com/job/76860320,Hung Hom,Kowloon City,Kowloon,0,0
"Associate Director, Insight & Data Analyst",Sony Music Entertainment Asia Inc.,,False,"Hung Hom, Kowloon City District",Information & Communication Technology,,2024-06-26 18:00,76829232,https://hk.jobsdb.com/job/76829232,Hung Hom,Kowloon City,Kowloon,0,0
(Senior) IT Officer,Toshiba Hong Kong Ltd,2,True,Sha Tin District,Information & Communication Technology,,2024-06-28 18:00,76908306,https://hk.jobsdb.com/job/76908306,,Sha Tin,New Territories,0,0
