Senior IT Analyst (Application Development),Hong Kong Air Cargo Terminals Ltd,2,True,"Airport Area, Islands District",Information & Communication Technology,,2024-06-28 18:00,74478586,https://hk.jobsdb.com/job/74478586,Airport Area,Islands,New Territories,0,0
Business Analyst - Trading system / Govt projects,Morgan Half International (Hong Kong) Limited,1,False,Hong Kong,Information & Communication Technology,,2024-06-09 18:00,76468652,https://hk.jobsdb.com/job/76468652,,,Hong Kong,0,0
"VP, Team Lead, Customer Proposition Analytics, Data Chapter",DBS Bank (Hong Kong) Limited,1,False,"Tsim Sha Tsui, Yau Tsim Mong District",Information & Communication Technology,,2024-06-28 18:00,76903980,https://hk.jobsdb.com/job/76903980,Tsim Sha Tsui,Yau Tsim Mong,Kowloon,0,0
Digital Workplace Product Manager,Cathay Pacific Airways Ltd,1,False,"Tung Chung, Islands District",Information & Communication Technology,,2024-06-29 18:00,76913174,https://hk.jobsdb.com/job/76913174,Tung Chung,Islands,New Territories,0,0
Assistant Product Manager,Hong Kong Broadband Network Limited (HKBN),3,False,"Kwai Chung, Kwai Tsing District",Information & Communication Technology,,2024-06-28 18:00,76906390,https://hk.jobsdb.com/job/76906390,Kwai Chung,Kwai Tsing,New Territories,0,0
System Analyst (Ref: JDB/DS/SA),Computer And Technologies Solutions Limited,3,False,"Pok Fu Lam, Southern District",Information & Communication Technology,,2024-06-25 18:00,76507837,https://hk.jobsdb.com/job/76507837,Pok Fu Lam,Southern,Hong Kong,0,0
Business Analyst (Up to 30K!!!!),JFE Consulting Limited,2,False,Yau Tsim Mong District,Accounting,"$25,000 - $30,000 per month",2024-06-04 18:00,76353532,https://hk.jobsdb.com/job/76353532,,Yau Tsim Mong,Kowloon,25000,30000
Assistant Online Business Manager (Digital product/Web/App),AS Watson Retail (HK) Limited,6,True,"Whampoa Garden, Kowloon City District",Information & Communication Technology,,2024-06-25 18:00,76807054,https://hk.jobsdb.com/job/76807054,Whampoa Garden,Kowloon City,Kowloon,0,0
Business Analyst,Tai Hing Worldwide Development Ltd,2,False,"Fo Tan, Sha Tin District",Information & Communication Technology,,2024-06-04 18:00,75696481,https://hk.jobsdb.com/job/75696481,Fo Tan,Sha Tin,New Territories,0,0
Project Manager,Yew Chung College of Early Childhood Education Limited,5,False,"Aberdeen, Southern District",Education & Training,,2024-06-26 18:00,76841779,https://hk.jobsdb.com/job/76841779,Aberdeen,Southern,Hong Kong,0,0
"Business Analyst, Application System Team (5 days)",Delken Group Limited,5,True,"Kwun Tong, Kwun Tong District",Information & Communication Technology,,2024-06-04 18:00,76339435,https://hk.jobsdb.com/job/76339435,Kwun Tong,Kwun Tong,Kowloon,0,0
Business Solution Executive (Fresh graduate will be considered),DKSH Hong Kong Limited,,True,Southern District,Information & Communication Technology,,2024-06-25 18:00,76815420,https://hk.jobsdb.com/job/76815420,,Southern,Hong Kong,0,0
Finance Compliance Analyst - International Firm,Michael Page International (HK) Ltd,3,False,Islands District,Accounting,,2024-06-25 18:00,76819026,https://hk.jobsdb.com/job/76819026,,Islands,New Territories,0,0
Business Analyst,Stylevana,1,True,"Kwai Hing, Kwai Tsing District",Information & Communication Technology,,2024-06-17 18:00,76605199,https://hk.jobsdb.com/job/76605199,Kwai Hing,Kwai Tsing,New Territories,0,0
System Analyst,Esri China (Hong Kong) Ltd,5,False,"Lai Chi Kok, Sham Shui Po District",Information & Communication Technology,,2024-06-25 18:00,76811400,https://hk.jobsdb.com/job/76811400,Lai Chi Kok,Sham Shui Po,Kowloon,0,0
"Business Analyst, Well-Known, Large Scale F&B Group",Hays Hong Kong Limited,2,False,Islands District,Information & Communication Technology,35000,2024-06-04 18:00,76357372,https://hk.jobsdb.com/job/76357372,,Islands,New Territories,0,0
Financial Analyst (Property),Wheelock Properties (Hong Kong) Limited 會德豐地產 (香港) 有限公司,6,False,Southern District,Banking & Financial Services,,2024-06-25 18:00,76813841,https://hk.jobsdb.com/job/76813841,,Southern,Hong Kong,0,0
"Business Analyst, Service Transformation",Otis Elevator Co (HK) Limited,,False,"Kowloon Bay, Kwun Tong District",Information & Communication Technology,,2024-06-06 18:00,76415571,https://hk.jobsdb.com/job/76415571,Kowloon Bay,Kwun Tong,Kowloon,0,0
Actuarial Analyst - Valuation,YF Life Insurance International Limited,,False,Wan Chai District,Insurance & Superannuation,,2024-06-29 18:00,76913325,https://hk.jobsdb.com/job/76913325,,Wan Chai,Hong Kong,0,0
Senior Actuarial Analyst - Local Insurer,Hays Hong Kong Limited,1,False,"Kwun Tong, Kwun Tong District",Insurance & Superannuation,$25000.0 - $45000.0 p.m.,2024-06-28 18:00,76900746,https://hk.jobsdb.com/job/76900746,Kwun Tong,Kwun Tong,Kowloon,25000,45000
Transformation and Technology Specialist,The Hong Kong Institute Of Bankers,3,False,"Sheung Wan, Central and Western District",Information & Communication Technology,,2024-06-24 18:00,76155925,https://hk.jobsdb.com/job/76155925,Sheung Wan,Central and Western,Hong Kong,0,0
Accenture Song - Digital Business Analyst,Accenture Company Limited,2,False,"Tai Koo, Eastern District",Information & Communication Technology,"$30,000 - $45,000 per month",2024-06-03 18:00,76318446,https://hk.jobsdb.com/job/76318446,Tai Koo,Eastern,Hong Kong,30000,45000
"Project Manager (Java, Gov't exp, over $75K)",CL Technical Services Ltd.,3,False,"Central, Central and Western District",Information & Communication Technology,"$75,000 - $80,000 per month",2024-06-26 18:00,76841717,https://hk.jobsdb.com/job/76841717,Central,Central and Western,Hong Kong,75000,80000
Project Manager - Subscription and Payment Integration,Viu,5,False,"Kowloon Bay, Kwun Tong District",Information & Communication Technology,,2024-06-25 18:00,76801938,https://hk.jobsdb.com/job/76801938,Kowloon Bay,Kwun Tong,Kowloon,0,0
"Regional IT (Senior) Business Analyst, APAC",L'Occitane (Far East) Limited,5,False,Eastern District,Information & Communication Technology,,2024-06-17 18:00,76621087,https://hk.jobsdb.com/job/76621087,,Eastern,Hong Kong,0,0
Senior Digital Strategy and Transformation Manager (Retail Business System and,Bank of China (Hong Kong) Limited,1,False,Hong Kong,Information & Communication Technology,,2024-06-27 18:00,76850999,https://hk.jobsdb.com/job/76850999,,,Hong Kong,0,0
Assistant Business Analyst,Postlogistics (Hong Kong) PTE Limited,,True,"Ngau Tau Kok, Kwun Tong District","Manufacturing, Transport & Logistics",,2024-06-03 18:00,76329352,https://hk.jobsdb.com/job/76329352,Ngau Tau Kok,Kwun Tong,Kowloon,0,0
"Business Analyst, Corporate Solutions",Hong Kong Aircraft Engineering Co Ltd,6,False,"Airport Area, Islands District",Information & Communication Technology,,2024-06-03 18:00,75636165,https://hk.jobsdb.com/job/75636165,Airport Area,Islands,New Territories,0,0
Assistant Manager - Core Administration System (IT),Generali Life (Hong Kong) Limited,8,False,"Tai Koo, Eastern District",Information & Communication Technology,,2024-06-28 18:00,76899344,https://hk.jobsdb.com/job/76899344,Tai Koo,Eastern,Hong Kong,0,0
Technical Project Manager - Assistant Vice President - Program Delivery(R001909),Hong Kong Exchanges & Clearing Ltd,8,False,Hong Kong,Information & Communication Technology,,2024-06-26 18:00,76838894,https://hk.jobsdb.com/job/76838894,,,Hong Kong,0,0
Youth Worker (Business Analyst),Company Confidential,,False,Hong Kong,Information & Communication Technology,,2024-06-18 18:00,76639874,https://hk.jobsdb.com/job/76639874,,,Hong Kong,0,0
"Service Delivery Manager / Project Manager (SDLC, software, perm, up to 50k)",Linkers International Limited,6,True,"Mong Kok, Yau Tsim Mong District",Information & Communication Technology,"$40,000 - $55,000 per month",2024-06-26 18:00,76836155,https://hk.jobsdb.com/job/76836155,Mong Kok,Yau Tsim Mong,Kowloon,40000,55000
"Operations Business Solutions, Senior Analyst",AIA Hong Kong,3,False,"Kai Tak, Kowloon City District",Information & Communication Technology,,2024-06-18 18:00,76634775,https://hk.jobsdb.com/job/76634775,Kai Tak,Kowloon City,Kowloon,0,0
Product Manager / Assistant Product Manager (Data Center and Cloud Services),HGC Global Communications Limited,5,False,"Tsing Yi, Kwai Tsing District",Information & Communication Technology,,2024-06-27 18:00,76860474,https://hk.jobsdb.com/job/76860474,Tsing Yi,Kwai Tsing,New Territories,0,0
Business Analyst - Tier 1 Global Insurer (Multiple Roles),JNL Consulting Limited,,False,"Central, Central and Western District",Banking & Financial Services,,2024-06-02 18:00,76304581,https://hk.jobsdb.com/job/76304581,Central,Central and Western,Hong Kong,0,0
"Manager, Project Delivery",Standard Chartered Bank,,True,Kwun Tong District,Banking & Financial Services,,2024-06-24 18:00,76767970,https://hk.jobsdb.com/job/76767970,,Kwun Tong,Kowloon,0,0
Assistant Product Management Manager (Deposit Product),Chiyu Banking Corp Ltd,3,False,"Central, Central and Western District",Banking & Financial Services,,2024-06-29 18:00,76913321,https://hk.jobsdb.com/job/76913321,Central,Central and Western,Hong Kong,0,0
(Up to 55K-75K!) System Analyst/ Analyst Programmer / Business Analyst,Seamatch Asia Limited,2,True,"Central, Central and Western District",Information & Communication Technology,"$55,000 - $75,000 per month",2024-06-17 18:00,76602502,https://hk.jobsdb.com/job/76602502,Central,Central and Western,Hong Kong,55000,75000
System Analyst - (IBM Maximo),DXC Technology Enterprise Services (Hong Kong) Limited,,False,"Airport Area, Islands District",Information & Communication Technology,,2024-06-25 18:00,76816233,https://hk.jobsdb.com/job/76816233,Airport Area,Islands,New Territories,0,0
Oracle System Analyst,PERSOLKELLY Hong Kong Limited,3,False,"Kowloon Bay, Kwun Tong District",Information & Communication Technology,,2024-06-26 18:00,76819910,https://hk.jobsdb.com/job/76819910,Kowloon Bay,Kwun Tong,Kowloon,0,0
"Property Valuation, Assistant Manager/ Senior Valuer",Masterpiece Valuation Advisory Limited,2,False,"Sheung Wan, Central and Western District",Information & Communication Technology,,2024-06-29 18:00,76929761,https://hk.jobsdb.com/job/76929761,Sheung Wan,Central and Western,Hong Kong,0,0
"IT PM (Digital)/Technology Manager (1 year Contract role, bank)",PERSOLKELLY Hong Kong Limited,6,False,"Central, Central and Western District",Information & Communication Technology,"$50,000 - $60,000 per month",2024-06-24 18:00,76774128,https://hk.jobsdb.com/job/76774128,Central,Central and Western,Hong Kong,50000,60000
Financial Risk Analyst - MT program,Links international,,False,Central and Western District,Banking & Financial Services,$15k - $20k p.m.,2024-06-28 18:00,76909837,https://hk.jobsdb.com/job/76909837,,Central and Western,Hong Kong,15000,20000
BUSINESS ANALYST,Fung Ying Seen Koon,3,False,"Fanling, North District",Information & Communication Technology,,2024-06-01 18:00,76301927,https://hk.jobsdb.com/job/76301927,Fanling,North,New Territories,0,0
Revenue Management Analyst (Ref:. C801),Jebsen Beverage Company Limited,3,False,"Causeway Bay, Wan Chai District",Banking & Financial Services,,2024-06-21 18:00,76734464,https://hk.jobsdb.com/job/76734464,Causeway Bay,Wan Chai,Hong Kong,0,0
"Senior Manager, Human Resources",Plaza Premium Lounge Management Limited,5,False,"Airport Area, Islands District",Human Resources & Recruitment,,2024-06-27 18:00,76861503,https://hk.jobsdb.com/job/76861503,Airport Area,Islands,New Territories,0,0
"(Senior) Project Officer, Life Operations",Hong Kong Life Insurance Limited,2,False,"Sheung Wan, Central and Western District",Insurance & Superannuation,,2024-06-28 18:00,76895556,https://hk.jobsdb.com/job/76895556,Sheung Wan,Central and Western,Hong Kong,0,0
"Credit Analyst, Fintech, 40k",Michael Page International (HK) Ltd,3,False,Central and Western District,Banking & Financial Services,$30k - $40k p.m.,2024-06-26 18:00,76832967,https://hk.jobsdb.com/job/76832967,,Central and Western,Hong Kong,30000,40000
"Senior Analyst - Manager, Valuations (ESG)",Jones Lang LaSalle Ltd,2,False,"Tai Koo, Eastern District",Information & Communication Technology,,2024-06-25 18:00,76811403,https://hk.jobsdb.com/job/76811403,Tai Koo,Eastern,Hong Kong,0,0
Major Bank: IT BA / Senior BA (Derivatives / Interest Rate),IT Solutions Ltd.,2,False,"Central, Central and Western District",Banking & Financial Services,,2024-06-22 18:00,76761114,https://hk.jobsdb.com/job/76761114,Central,Central and Western,Hong Kong,0,0
Project Manager (12 months contract),Standard Chartered Bank,,True,Kwun Tong District,Banking & Financial Services,,2024-06-24 18:00,76769090,https://hk.jobsdb.com/job/76769090,,Kwun Tong,Kowloon,0,0
Senior Engineer - Digital Solutions (2-Year Contract),CLP Power Hong Kong Limited 中華電力有限公司,5,False,Yau Tsim Mong District,Engineering,,2024-06-28 18:00,76893959,https://hk.jobsdb.com/job/76893959,,Yau Tsim Mong,Kowloon,0,0
"Project Manager (Bank, Fintech)",Captiare Limited,6,True,"Tsim Sha Tsui, Yau Tsim Mong District",Information & Communication Technology,"5 days work, MPF, Medical",2024-06-25 18:00,76818692,https://hk.jobsdb.com/job/76818692,Tsim Sha Tsui,Yau Tsim Mong,Kowloon,0,0
Senior Digital Product Specialist (21 Months' Contract) (本項職位空缺只備英文版本),CLP Power Hong Kong Limited 中華電力有限公司,5,True,"Sham Shui Po, Sham Shui Po District",Marketing & Communications,,2024-06-28 18:00,76905183,https://hk.jobsdb.com/job/76905183,Sham Shui Po,Sham Shui Po,Kowloon,0,0
Technical Business Analyst,AS Watson Retail (HK) Limited,2,True,"Fo Tan, Sha Tin District",Information & Communication Technology,,2024-05-31 18:00,73559875,https://hk.jobsdb.com/job/73559875,Fo Tan,Sha Tin,New Territories,0,0
"System Analyst / Lead Consultant, Application",NCSI (HK) Limited,6,False,"Tai Koo, Eastern District",Information & Communication Technology,,2024-06-26 18:00,76847292,https://hk.jobsdb.com/job/76847292,Tai Koo,Eastern,Hong Kong,0,0
(Senior) Digital Business Analyst,AXA Hong Kong,2,False,Central and Western District,Information & Communication Technology,discretionary bonus,2024-06-15 18:00,76593485,https://hk.jobsdb.com/job/76593485,,Central and Western,Hong Kong,0,0
"Manager, Business Solution",Delken Group Limited,8,False,Sha Tin District,Information & Communication Technology,,2024-06-25 18:00,76809040,https://hk.jobsdb.com/job/76809040,,Sha Tin,New Territories,0,0
Business Analyst (International Wealth Management - System Service Team),KGI Hong Kong Limited,5,False,Wan Chai District,Information & Communication Technology,,2024-05-31 18:00,76286424,https://hk.jobsdb.com/job/76286424,,Wan Chai,Hong Kong,0,0
Senior Credit Analyst (Ref: JD-SCA),Public Bank (Hong Kong) Ltd,5,True,Hong Kong,Banking & Financial Services,,2024-06-28 18:00,74480589,https://hk.jobsdb.com/job/74480589,,,Hong Kong,0,0
Business Analyst,Hong Kong Applied Science and Technology Research Institute Company Limited,4,False,Hong Kong,Information & Communication Technology,,2024-05-31 18:00,75766846,https://hk.jobsdb.com/job/75766846,,,Hong Kong,0,0
Assistant Manager - RPA/ Automations,Rise Associates Asia Limited,5,False,Hong Kong Island,Information & Communication Technology,"$45,000 - $58,000 per month",2024-06-26 18:00,76835672,https://hk.jobsdb.com/job/76835672,,Hong Kong Island,Hong Kong,45000,58000
Assistant Manager Cargo Digital,Cathay Pacific Airways Ltd,5,False,"Lantau Island, Islands District","Manufacturing, Transport & Logistics",,2024-06-25 18:00,76804708,https://hk.jobsdb.com/job/76804708,Lantau Island,Islands,New Territories,0,0
Assistant Project Manager / Senior Project Officer (Oh!爸媽 Ohpama.com),Sing Tao Management Services Limited,2,False,"Tseung Kwan O, Sai Kung District",Marketing & Communications,,2024-06-27 18:00,76870387,https://hk.jobsdb.com/job/76870387,Tseung Kwan O,Sai Kung,New Territories,0,0
Contract Systems Analyst (49444),CLTS HK,2,False,"Wan Chai, Wan Chai District",Information & Communication Technology,,2024-06-25 18:00,76811611,https://hk.jobsdb.com/job/76811611,Wan Chai,Wan Chai,Hong Kong,0,0
Business Analyst (HK$30K - $50K) (Ref. No.: 26808),Global Executive Consultants Ltd.,3,False,Central and Western District,Information & Communication Technology,"$35,000 - $50,000 per month",2024-05-31 18:00,76287163,https://hk.jobsdb.com/job/76287163,,Central and Western,Hong Kong,35000,50000
Assistant Project Implementation Manager (Supply Chain Industry),Arvato Hong Kong Limited,5,True,Tuen Mun District,"Manufacturing, Transport & Logistics",,2024-06-27 18:00,76857890,https://hk.jobsdb.com/job/76857890,,Tuen Mun,New Territories,0,0
SPORTS SCIENCE TECHNICIAN (database/software systems management) (SIC),Hong Kong Sports Institute Ltd,,False,Sha Tin District,Human Resources & Recruitment,,2024-06-28 18:00,76894823,https://hk.jobsdb.com/job/76894823,,Sha Tin,New Territories,0,0
Data and Reporting Analyst (D365 CRM),C & R Holdings Limited,1,False,Kwun Tong District,Information & Communication Technology,,2024-06-21 18:00,76749920,https://hk.jobsdb.com/job/76749920,,Kwun Tong,Kowloon,0,0
Project Manager (Ref. No.: HKRITA-PM),HK Research Institute of Textiles & Apparel Ltd,5,False,Sha Tin District,Engineering,,2024-06-28 18:00,76896946,https://hk.jobsdb.com/job/76896946,,Sha Tin,New Territories,0,0
"Senior Sales Executive, Wholesales, Asia Pacific (1-year contract)",PVH Asia Limited,5,True,"Hung Hom, Kowloon City District",Sales,,2024-06-28 18:00,76912111,https://hk.jobsdb.com/job/76912111,Hung Hom,Kowloon City,Kowloon,0,0
Project Manager/ Assistant Project Manager (ERP / SAP FICO),Emperor Watch & Jewellery (HK) Company Limited,1,False,"Wan Chai, Wan Chai District",Information & Communication Technology,,2024-06-25 18:00,76805390,https://hk.jobsdb.com/job/76805390,Wan Chai,Wan Chai,Hong Kong,0,0
"Analyst, OTC - Derivatives Structured Product, Business Operation",BOC International Holdings Ltd,1,False,"Sheung Wan, Central and Western District",Banking & Financial Services,,2024-06-19 18:00,76668864,https://hk.jobsdb.com/job/76668864,Sheung Wan,Central and Western,Hong Kong,0,0
"Actuarial Analyst, Asia-Pacific Actuarial Group (Hong Kong)","Allied World Assurance Company, Ltd",2,False,Eastern District,Insurance & Superannuation,,2024-06-28 18:00,76901456,https://hk.jobsdb.com/job/76901456,,Eastern,Hong Kong,0,0
Credit Analyst - Corporate Banking / Commercial Banking,Asia Progress Executive Limited,5,True,Wan Chai District,Banking & Financial Services,,2024-06-28 18:00,76910777,https://hk.jobsdb.com/job/76910777,,Wan Chai,Hong Kong,0,0
FP&A - Luxury Retail Business Finance (Immediately Available Preferred),BDO Financial Services Limited,2,False,"Quarry Bay, Eastern District",Accounting,,2024-06-27 18:00,76859975,https://hk.jobsdb.com/job/76859975,Quarry Bay,Eastern,Hong Kong,0,0
Assistant Financial Analyst,Asia Airfreight Terminal Co Ltd,,True,"Airport Area, Islands District",Accounting,,2024-06-24 18:00,76787593,https://hk.jobsdb.com/job/76787593,Airport Area,Islands,New Territories,0,0
"VP, Team Lead, Customer Proposition Analytics, Data Chapter",DBS Bank (Hong Kong) Limited,,False,Hong Kong,Banking & Financial Services,,2024-06-28 18:00,76910430,https://hk.jobsdb.com/job/76910430,,,Hong Kong,0,0
"Analyst , Futures & Options/Exchange Traded Derivatives, Business Operations",BOC International Holdings Ltd,2,False,"Sheung Wan, Central and Western District",Banking & Financial Services,,2024-06-19 18:00,76671270,https://hk.jobsdb.com/job/76671270,Sheung Wan,Central and Western,Hong Kong,0,0
System Analyst (Private Banking Team),Company Confidential,6,False,Hong Kong,Information & Communication Technology,,2024-06-25 18:00,76795653,https://hk.jobsdb.com/job/76795653,,,Hong Kong,0,0
System Analyst,Hong Kong Life Insurance Limited,7,False,"Sheung Wan, Central and Western District",Information & Communication Technology,,2024-06-25 18:00,76816482,https://hk.jobsdb.com/job/76816482,Sheung Wan,Central and Western,Hong Kong,0,0
BI Specialist / Senior Data Analyst (Five day work weeks),Excel Technology International (Hong Kong) Limited,3,False,Hong Kong,Information & Communication Technology,,2024-06-24 18:00,76768377,https://hk.jobsdb.com/job/76768377,,,Hong Kong,0,0
Oracle System Analyst (VCO260/J22),VTECH Corporate Services Ltd,5,False,Tai Po District,Information & Communication Technology,,2024-06-25 18:00,76802649,https://hk.jobsdb.com/job/76802649,,Tai Po,New Territories,0,0
Analyst - Market Research at S.F. Express (Hong Kong) Limited,Jobsdb - SmartHire,5,True,"Tsing Yi, Kwai Tsing District",Marketing & Communications,,2024-06-25 18:00,76538977,https://hk.jobsdb.com/job/76538977,Tsing Yi,Kwai Tsing,New Territories,0,0
System Architect / POS Project Manager for Restaurant Systems,Taste of Asia Group Limited,,False,"Wong Tai Sin, Wong Tai Sin District",Information & Communication Technology,,2024-06-27 18:00,76874879,https://hk.jobsdb.com/job/76874879,Wong Tai Sin,Wong Tai Sin,Kowloon,0,0
Major Bank - Junior IT Business Analysts - (Welcome Fresh Grad),IT Solutions Ltd.,,True,Hong Kong,Information & Communication Technology,,2024-06-22 18:00,76760946,https://hk.jobsdb.com/job/76760946,,,Hong Kong,0,0
Digital Solution Specialist - Chatbot,WallStone Partners & Company Limited,3,True,Hong Kong Island,Information & Communication Technology,,2024-06-26 18:00,76837219,https://hk.jobsdb.com/job/76837219,,Hong Kong Island,Hong Kong,0,0
Data Governance & Risk Management Analyst (Permanent / 2-Yr Contract),CLP Power Hong Kong Limited 中華電力有限公司,2,True,"Sham Shui Po, Sham Shui Po District",Accounting,,2024-06-20 18:00,76690601,https://hk.jobsdb.com/job/76690601,Sham Shui Po,Sham Shui Po,Kowloon,0,0
Project Manager,SinoPac Securities (Asia) Limited,3,False,"Causeway Bay, Wan Chai District",Information & Communication Technology,,2024-06-24 18:00,76772788,https://hk.jobsdb.com/job/76772788,Causeway Bay,Wan Chai,Hong Kong,0,0
Quality Assurance(QA) Tester,Chief Group Limited,,False,"Sheung Wan, Central and Western District",Information & Communication Technology,,2024-06-25 18:00,76158040,https://hk.jobsdb.com/job/76158040,Sheung Wan,Central and Western,Hong Kong,0,0
"Analyst - Payment Investigation, Technology & Operations",DBS Bank (Hong Kong) Limited,,False,Hong Kong,Information & Communication Technology,,2024-06-24 18:00,76794912,https://hk.jobsdb.com/job/76794912,,,Hong Kong,0,0
Business Analyst,Ricacorp Properties Limited,1,False,"Wan Chai, Wan Chai District",Information & Communication Technology,,2024-06-04 18:00,76345244,https://hk.jobsdb.com/job/76345244,Wan Chai,Wan Chai,Hong Kong,0,0
"Senior Consultant (MNC management consulting firm,PB focus)",Links international,3,False,Islands District,Information & Communication Technology,$50k - $60k p.m.,2024-06-24 18:00,76783311,https://hk.jobsdb.com/job/76783311,,Islands,New Territories,50000,60000
IT Business Analyst - Agency Contractor,Chiyu Banking Corp Ltd,3,False,"Central, Central and Western District",Information & Communication Technology,,2024-06-15 18:00,76593498,https://hk.jobsdb.com/job/76593498,Central,Central and Western,Hong Kong,0,0
"First Vice President, Business Planning Team",Fubon Bank (Hong Kong) Limited,1,False,"North Point, Eastern District",Information & Communication Technology,,2024-06-27 18:00,76867726,https://hk.jobsdb.com/job/76867726,North Point,Eastern,Hong Kong,0,0
Senior Digital Delivery Analyst - Insurance ,Ambition,5,True,Central and Western District,Information & Communication Technology,,2024-06-21 18:00,76742044,https://hk.jobsdb.com/job/76742044,,Central and Western,Hong Kong,0,0
Assistant Manager - Policy Admin Project Management,China Life Insurance (Overseas) Company Limited,5,False,"Wan Chai, Wan Chai District",Insurance & Superannuation,,2024-06-25 18:00,76806707,https://hk.jobsdb.com/job/76806707,Wan Chai,Wan Chai,Hong Kong,0,0
Trade & Supply Chain Application L2 support,Optimum Solutions (Hong Kong) Limited,5,False,"Central, Central and Western District",Information & Communication Technology,,2024-06-26 18:00,76844310,https://hk.jobsdb.com/job/76844310,Central,Central and Western,Hong Kong,0,0
(Senior) Digital Strategy and Transformation Manager,Bank of China (Hong Kong) Limited,3,False,Hong Kong,Banking & Financial Services,,2024-06-28 18:00,76904173,https://hk.jobsdb.com/job/76904173,,,Hong Kong,0,0
Associate - Project Management (IT),FundPark Limited,1,False,Kwun Tong District,Information & Communication Technology,,2024-06-25 18:00,76812097,https://hk.jobsdb.com/job/76812097,,Kwun Tong,Kowloon,0,0
"Officer, OTC Bilateral, ETD/DC and Prime Brokerage Margining Settlement Analyst",Citibank (Hong Kong) Limited,2,False,"Kowloon City, Kowloon City District",Call Centre & Customer Service,,2024-06-28 18:00,76890737,https://hk.jobsdb.com/job/76890737,Kowloon City,Kowloon City,Kowloon,0,0
Java System Analyst - Government Project,Morgan Half International (Hong Kong) Limited,5,False,"Kwun Tong, Kwun Tong District",Information & Communication Technology,"$38,000 - $45,000 per month",2024-06-28 18:00,76887168,https://hk.jobsdb.com/job/76887168,Kwun Tong,Kwun Tong,Kowloon,38000,45000
Business Analyst - Trading system,Morgan Half International (Hong Kong) Limited,1,False,Hong Kong,Information & Communication Technology,,2024-06-02 18:00,76304538,https://hk.jobsdb.com/job/76304538,,,Hong Kong,0,0
QA Officer,Joint Electronic Teller Services Limited (“JETCO”),2,False,"Ngau Tau Kok, Kwun Tong District",Science & Technology,,2024-06-26 18:00,76451225,https://hk.jobsdb.com/job/76451225,Ngau Tau Kok,Kwun Tong,Kowloon,0,0
Assistant Project Manager/Project Manager/Senior Project Manager,Turner & Townsend Limited,1,False,Hong Kong,Construction,,2024-06-28 18:00,76908511,https://hk.jobsdb.com/job/76908511,,,Hong Kong,0,0
Digital Product Specialist,Plotio Financial Group Limited,2,False,"Tsim Sha Tsui, Yau Tsim Mong District",Marketing & Communications,,2024-06-27 18:00,76445515,https://hk.jobsdb.com/job/76445515,Tsim Sha Tsui,Yau Tsim Mong,Kowloon,0,0
