Business Analyst - Banking / Financial (HK$30K - $45K)  (Ref. No.: 26929),Global Executive Consultants Ltd.,3,False,"Central, Central and Western District",Information & Communication Technology,"$30,000 - $45,000 per month",2024-06-12 18:00,76541310,https://hk.jobsdb.com/job/76541310,Central,Central and Western,Hong Kong,30000,45000
(Senior) Risk Management Manager(Payment Business),Bank of China (Hong Kong) Limited,5,False,"Sheung Wan, Central and Western District",Banking & Financial Services,,2024-06-27 18:00,76868727,https://hk.jobsdb.com/job/76868727,Sheung Wan,Central and Western,Hong Kong,0,0
Data Analyst - Sales Controlling,Super Dry China Limited,1,False,"Kwun Tong, Kwun Tong District",Information & Communication Technology,,2024-06-28 18:00,76895206,https://hk.jobsdb.com/job/76895206,Kwun Tong,Kwun Tong,Kowloon,0,0
"Museum Business and Planning Analyst, M+ Museum (Ref. R5234)",West Kowloon Cultural District Authority,4,False,"Tsim Sha Tsui, Yau Tsim Mong District",Administration & Office Support,,2024-06-20 18:00,76711590,https://hk.jobsdb.com/job/76711590,Tsim Sha Tsui,Yau Tsim Mong,Kowloon,0,0
System / Business Analyst,Cargo Services Far East Ltd,5,False,"Kwai Chung, Kwai Tsing District",Information & Communication Technology,,2024-06-12 18:00,76537740,https://hk.jobsdb.com/job/76537740,Kwai Chung,Kwai Tsing,New Territories,0,0
Assistant Product Manager /Senior Product Executive (IT products and solution),Sen Spirit Technology Limited,3,True,Kwun Tong District,Information & Communication Technology,,2024-06-28 18:00,74214880,https://hk.jobsdb.com/job/74214880,,Kwun Tong,Kowloon,0,0
IT Project Assistant Manager / Supervisor,Tachibana Sales (H.K.) Ltd,2,True,"Kowloon Bay, Kwun Tong District",Information & Communication Technology,"$20,000 - $30,000 per month",2024-06-25 18:00,76004128,https://hk.jobsdb.com/job/76004128,Kowloon Bay,Kwun Tong,Kowloon,20000,30000
Product Designer / Business Analyst (IoT Solutions),IQAX Limited,2,False,Sha Tin District,Information & Communication Technology,,2024-06-19 18:00,76686194,https://hk.jobsdb.com/job/76686194,,Sha Tin,New Territories,0,0
International Trader in the Pulp and Paper Industry (m/f/d) - South-East Asia,Europcell Hong Kong Limited,3,False,Sha Tin District,Sales,,2024-06-27 18:00,76851920,https://hk.jobsdb.com/job/76851920,,Sha Tin,New Territories,0,0
IT Analyst ,Morgan Mckinley Limited,2,False,Central and Western District,Information & Communication Technology,$32k - $36k p.m.,2024-06-25 18:00,76803598,https://hk.jobsdb.com/job/76803598,,Central and Western,Hong Kong,32000,36000
FP&A Analyst,Formia Limited,4,False,"Whampoa Garden, Kowloon City District",Accounting,,2024-06-26 18:00,76820195,https://hk.jobsdb.com/job/76820195,Whampoa Garden,Kowloon City,Kowloon,0,0
Project Manager,Infosys Technologies (China) Company Limited,,False,Hong Kong,Information & Communication Technology,,2024-06-27 18:00,76851285,https://hk.jobsdb.com/job/76851285,,,Hong Kong,0,0
Assistant Manager - Business Analysis,Generali Life (Hong Kong) Limited,5,False,"Tai Koo, Eastern District",Information & Communication Technology,,2024-06-21 18:00,76278062,https://hk.jobsdb.com/job/76278062,Tai Koo,Eastern,Hong Kong,0,0
BI Analyst at Excel Technology International (Hong Kong) Limited,Jobsdb - SmartHire,,False,"Quarry Bay, Eastern District",Information & Communication Technology,,2024-06-25 18:00,76571123,https://hk.jobsdb.com/job/76571123,Quarry Bay,Eastern,Hong Kong,0,0
Customer Relationship Manager,Hang Seng Bank Ltd,,False,Hong Kong,Banking & Financial Services,,2024-06-28 18:00,76903501,https://hk.jobsdb.com/job/76903501,,,Hong Kong,0,0
Research Analyst (Traditional Finance & Crypto Assets),MicroBit Capital Management Limited,1,False,"Central, Central and Western District",Banking & Financial Services,,2024-06-28 18:00,76899953,https://hk.jobsdb.com/job/76899953,Central,Central and Western,Hong Kong,0,0
ANALYST PROGRAMMER / SENIOR PROGRAMMER / PROGRAMMER,Henderson Land Development Company Limited,1,False,"Central, Central and Western District",Information & Communication Technology,,2024-06-28 18:00,74650456,https://hk.jobsdb.com/job/74650456,Central,Central and Western,Hong Kong,0,0
Assistant Project Manager (Front-End),Octopus Holdings Limited,6,True,"Kowloon Bay, Kwun Tong District",Information & Communication Technology,,2024-06-27 18:00,76867188,https://hk.jobsdb.com/job/76867188,Kowloon Bay,Kwun Tong,Kowloon,0,0
Senior Market Analyst,PCCW Global Limited,,False,Hong Kong,Banking & Financial Services,,2024-06-26 18:00,76841668,https://hk.jobsdb.com/job/76841668,,,Hong Kong,0,0
Regional Logistics Project Manager,Richemont Asia Pacific Limited,,False,"Central, Central and Western District","Manufacturing, Transport & Logistics",,2024-06-28 18:00,76907049,https://hk.jobsdb.com/job/76907049,Central,Central and Western,Hong Kong,0,0
Project Executive/ Associate Business Analyst,Million Tech Development Ltd,1,False,"Lai Chi Kok, Sham Shui Po District",Information & Communication Technology,,2024-06-13 18:00,76564083,https://hk.jobsdb.com/job/76564083,Lai Chi Kok,Sham Shui Po,Kowloon,0,0
IT Business Analyst,JFE Consulting Limited,,False,Hong Kong,Information & Communication Technology,,2024-06-13 18:00,76564296,https://hk.jobsdb.com/job/76564296,,,Hong Kong,0,0
Analyst Programmer (Fresh graduates are welcome),ParaDM Company Limited,3,False,"Kwun Tong, Kwun Tong District",Information & Communication Technology,,2024-06-26 18:00,74860503,https://hk.jobsdb.com/job/74860503,Kwun Tong,Kwun Tong,Kowloon,0,0
"Senior Officer, IT",Airport Authority,3,False,"Airport Area, Islands District",Information & Communication Technology,,2024-06-24 18:00,76792378,https://hk.jobsdb.com/job/76792378,Airport Area,Islands,New Territories,0,0
Business Analyst,Hearts on Fire Company Hong Kong Limited,1,True,"Kwai Chung, Kwai Tsing District","Manufacturing, Transport & Logistics",,2024-06-11 18:00,76513040,https://hk.jobsdb.com/job/76513040,Kwai Chung,Kwai Tsing,New Territories,0,0
Assistant Business Analyst / Business Analyst,Hong Kong Life Insurance Limited,3,True,"Sheung Wan, Central and Western District",Information & Communication Technology,,2024-06-11 18:00,76507212,https://hk.jobsdb.com/job/76507212,Sheung Wan,Central and Western,Hong Kong,0,0
IT Application Manager/ IT Project Manager,Rise Associates Asia Limited,8,False,Hong Kong,Information & Communication Technology,,2024-06-25 18:00,76805965,https://hk.jobsdb.com/job/76805965,,,Hong Kong,0,0
Digital Transformation Manager,"Topcast Aviation Supplies Co., Ltd.",5,False,Sha Tin District,Information & Communication Technology,,2024-06-27 18:00,76864760,https://hk.jobsdb.com/job/76864760,,Sha Tin,New Territories,0,0
Full-Time Editor / Senior Editor / Publishing Officer for ELT Publications,Classroom Publications Ltd,,False,Kwun Tong District,"Advertising, Arts & Media",,2024-06-28 18:00,76909213,https://hk.jobsdb.com/job/76909213,,Kwun Tong,Kowloon,0,0
"AVP, Business Finance (Banking)",BDO Financial Services Limited,5,False,"Quarry Bay, Eastern District",Banking & Financial Services,"$55,000 - $65,000 per month",2024-06-25 18:00,76811109,https://hk.jobsdb.com/job/76811109,Quarry Bay,Eastern,Hong Kong,55000,65000
Assistant Project Manager/ Business analyst (IT/ Application),A&A Limited,3,False,"Kwun Tong, Kwun Tong District",Information & Communication Technology,,2024-06-11 18:00,76498338,https://hk.jobsdb.com/job/76498338,Kwun Tong,Kwun Tong,Kowloon,0,0
ESG Consultant - 2024 Graduate Position,Avista Risk Advisory Limited,,False,"Wan Chai, Wan Chai District",Consulting & Strategy,,2024-06-27 18:00,76862626,https://hk.jobsdb.com/job/76862626,Wan Chai,Wan Chai,Hong Kong,0,0
Business Analyst (Ref: JDB/HRM/BA),Computer And Technologies Resources Limited,3,False,"Pok Fu Lam, Southern District",Information & Communication Technology,,2024-06-20 18:00,76250432,https://hk.jobsdb.com/job/76250432,Pok Fu Lam,Southern,Hong Kong,0,0
IT Project Manager (Major Bank),Cornerstone Global Partners,5,False,"Central, Central and Western District",Information & Communication Technology,"$45,000 - $65,000 per month",2024-06-25 18:00,76803376,https://hk.jobsdb.com/job/76803376,Central,Central and Western,Hong Kong,45000,65000
IT Business Analyst,FUJIFILM BI,2,False,"Ngau Tau Kok, Kwun Tong District",Information & Communication Technology,,2024-06-18 18:00,76651791,https://hk.jobsdb.com/job/76651791,Ngau Tau Kok,Kwun Tong,Kowloon,0,0
"Project Executive, Platform Development (Contract)",Hong Kong Trade Development Council,,True,"Wan Chai, Wan Chai District",Information & Communication Technology,,2024-06-25 18:00,76817477,https://hk.jobsdb.com/job/76817477,Wan Chai,Wan Chai,Hong Kong,0,0
"Data Analyst, Digital Business",Maxim's Caterers Limited,1,False,"Lai Chi Kok, Sham Shui Po District",Information & Communication Technology,,2024-06-20 18:00,76703092,https://hk.jobsdb.com/job/76703092,Lai Chi Kok,Sham Shui Po,Kowloon,0,0
Business Analysis Manager,Company Confidential,,False,Hong Kong,Information & Communication Technology,,2024-06-21 18:00,76728541,https://hk.jobsdb.com/job/76728541,,,Hong Kong,0,0
Assistant Business Analyst (Fresh Graduates are welcome)(1),Global Technology Integrator Ltd - GTI,1,False,"Ngau Tau Kok, Kwun Tong District",Information & Communication Technology,,2024-06-19 18:00,76686010,https://hk.jobsdb.com/job/76686010,Ngau Tau Kok,Kwun Tong,Kowloon,0,0
FX / Precious Metal: IT Business Analysts - Major Bank,IT Solutions Ltd.,,True,Hong Kong,Banking & Financial Services,,2024-06-22 18:00,76761121,https://hk.jobsdb.com/job/76761121,,,Hong Kong,0,0
Senior System Analyst (Channel Services),China CITIC Bank International Limited,8,False,"Quarry Bay, Eastern District",Information & Communication Technology,,2024-06-28 18:00,76495883,https://hk.jobsdb.com/job/76495883,Quarry Bay,Eastern,Hong Kong,0,0
"Vice President, Data Steward",Shanghai Commercial Bank Ltd,1,False,"Mong Kok, Yau Tsim Mong District",Banking & Financial Services,,2024-06-28 18:00,74793915,https://hk.jobsdb.com/job/74793915,Mong Kok,Yau Tsim Mong,Kowloon,0,0
IT Officer,Frontier Financial Group Limited,,False,"Central, Central and Western District",Information & Communication Technology,,2024-06-27 18:00,76866368,https://hk.jobsdb.com/job/76866368,Central,Central and Western,Hong Kong,0,0
Contract Systems Analyst - IT Enterprise Architecture,CLTS HK,5,False,"Prince Edward, Yau Tsim Mong District",Information & Communication Technology,,2024-06-26 18:00,76824775,https://hk.jobsdb.com/job/76824775,Prince Edward,Yau Tsim Mong,Kowloon,0,0
IT Project Manager/Business Analyst - Financial Services,IO TECH SOLUTIONS LIMITED,5,False,Hong Kong,Information & Communication Technology,,2024-06-19 18:00,76691201,https://hk.jobsdb.com/job/76691201,,,Hong Kong,0,0
Wealth Management Trainee,Jobsdb - SmartHire,,False,Central and Western District,Banking & Financial Services,,2024-06-27 18:00,76870897,https://hk.jobsdb.com/job/76870897,,Central and Western,Hong Kong,0,0
Assistant Product Manager,Ingram Micro (China) Limited,3,False,"Kowloon Bay, Kwun Tong District",Information & Communication Technology,,2024-06-28 18:00,76912049,https://hk.jobsdb.com/job/76912049,Kowloon Bay,Kwun Tong,Kowloon,0,0
Assistant Head of Corporate Banking Department,Industrial and Commercial Bank of China (Asia) Limited,1,True,"Central, Central and Western District",Banking & Financial Services,,2024-06-28 18:00,76886256,https://hk.jobsdb.com/job/76886256,Central,Central and Western,Hong Kong,0,0
System Analyst (Core Banking),Chong Hing Bank Ltd,4,False,"Kowloon Bay, Kwun Tong District",Information & Communication Technology,,2024-06-25 18:00,76815833,https://hk.jobsdb.com/job/76815833,Kowloon Bay,Kwun Tong,Kowloon,0,0
System Analyst/ Analyst Programmer/ Programmer (Java),ASK IT LIMITED,,False,"Causeway Bay, Wan Chai District",Information & Communication Technology,,2024-06-28 18:00,76905163,https://hk.jobsdb.com/job/76905163,Causeway Bay,Wan Chai,Hong Kong,0,0
Associate Business Analyst (Software Development and Implementation),Million Tech Development Ltd,1,True,"Lai Chi Kok, Sham Shui Po District",Information & Communication Technology,,2024-06-12 18:00,76539340,https://hk.jobsdb.com/job/76539340,Lai Chi Kok,Sham Shui Po,Kowloon,0,0
Project Analyst,Hays Hong Kong Limited,3,False,Central and Western District,Information & Communication Technology,HKD30-60k per month,2024-06-11 18:00,76501589,https://hk.jobsdb.com/job/76501589,,Central and Western,Hong Kong,30000,60000
System Analyst (UiPath),Hongkong Land Group Limited,5,True,"Central, Central and Western District",Information & Communication Technology,,2024-06-26 18:00,76837026,https://hk.jobsdb.com/job/76837026,Central,Central and Western,Hong Kong,0,0
"System Analyst, Technology Enablement (MJ001640)",KPMG,2,False,"Aberdeen, Southern District",Information & Communication Technology,,2024-06-28 18:00,72756346,https://hk.jobsdb.com/job/72756346,Aberdeen,Southern,Hong Kong,0,0
System Developer (IT) at Dealer Send Logistics Limited,Jobsdb - SmartHire,,True,Tsuen Wan District,Information & Communication Technology,,2024-06-27 18:00,76860828,https://hk.jobsdb.com/job/76860828,,Tsuen Wan,New Territories,0,0
Project Associate / Project Assistant,The Hong Kong Polytechnic University,,False,"Hung Hom, Kowloon City District",Administration & Office Support,,2024-06-28 18:00,76903190,https://hk.jobsdb.com/job/76903190,Hung Hom,Kowloon City,Kowloon,0,0
"Analyst, Corporate Finance",BaoQiao Partners Capital Limited,1,True,"Admiralty, Central and Western District",Banking & Financial Services,,2024-06-25 18:00,76803628,https://hk.jobsdb.com/job/76803628,Admiralty,Central and Western,Hong Kong,0,0
"Assistant Manager, Business Analysis and Operation Support",Ocean Park Corporation,5,False,"Wong Chuk Hang, Southern District",Information & Communication Technology,,2024-06-20 18:00,76690154,https://hk.jobsdb.com/job/76690154,Wong Chuk Hang,Southern,Hong Kong,0,0
Presales Consultant (Infrastructure),Amidas Hong Kong Limited,,False,"Lai Chi Kok, Sham Shui Po District",Information & Communication Technology,,2024-06-28 18:00,76903093,https://hk.jobsdb.com/job/76903093,Lai Chi Kok,Sham Shui Po,Kowloon,0,0
Jewellery Sales Advisor / Senior Advisor 珠寶銷售顧問 及 高級銷售顧問,King Fook Holdings Ltd,,True,"Central, Central and Western District",Retail & Consumer Products,,2024-06-28 18:00,76910483,https://hk.jobsdb.com/job/76910483,Central,Central and Western,Hong Kong,0,0
.Net System Analyst/ Team Lead (Retail project; Perm Up to 53k),Linkers International Limited,8,False,"Hung Hom, Kowloon City District",Information & Communication Technology,,2024-06-28 18:00,76906405,https://hk.jobsdb.com/job/76906405,Hung Hom,Kowloon City,Kowloon,0,0
ERP Consultant,YONYOU (HONGKONG) COMPANY LIMITED,,False,"Wan Chai, Wan Chai District",Information & Communication Technology,,2024-06-28 18:00,76912625,https://hk.jobsdb.com/job/76912625,Wan Chai,Wan Chai,Hong Kong,0,0
Project Coordinator / Business Analyst,K2 Ares Consulting Limited,,False,"Kwun Tong, Kwun Tong District",Information & Communication Technology,,2024-06-11 18:00,76501424,https://hk.jobsdb.com/job/76501424,Kwun Tong,Kwun Tong,Kowloon,0,0
Operations Analyst - System Implementation & Improvement Projects | Euro MNC,Six People Map,7,False,"Tuen Mun, Tuen Mun District",Information & Communication Technology,,2024-06-11 18:00,76494850,https://hk.jobsdb.com/job/76494850,Tuen Mun,Tuen Mun,New Territories,0,0
Project Manager,PCCW Global Limited,3,False,Hong Kong,Information & Communication Technology,,2024-06-26 18:00,76841550,https://hk.jobsdb.com/job/76841550,,,Hong Kong,0,0
System Analyst (DevOps),Computer Recruitment Consultants Ltd,3,False,"Tsing Yi, Kwai Tsing District",Information & Communication Technology,,2024-06-29 18:00,76929811,https://hk.jobsdb.com/job/76929811,Tsing Yi,Kwai Tsing,New Territories,0,0
Manager of Media Solutions Divisions at CJ ENM Hong Kong Limited,Jobsdb - SmartHire,3,True,"Quarry Bay, Eastern District","Advertising, Arts & Media",,2024-06-27 18:00,76866109,https://hk.jobsdb.com/job/76866109,Quarry Bay,Eastern,Hong Kong,0,0
"Business Analysis Manager (up to HK$62,000)",Headshot Recruitment Limited,7,False,Hong Kong,Information & Communication Technology,,2024-06-21 18:00,76739027,https://hk.jobsdb.com/job/76739027,,,Hong Kong,0,0
"Operations Business Solutions, Consultant (Claims)",AIA Hong Kong,7,False,"Kai Tak, Kowloon City District",Information & Communication Technology,,2024-06-24 18:00,76775623,https://hk.jobsdb.com/job/76775623,Kai Tak,Kowloon City,Kowloon,0,0
Business Analyst - Banking ,Ambition,,False,Central and Western District,Information & Communication Technology,,2024-06-11 18:00,76498166,https://hk.jobsdb.com/job/76498166,,Central and Western,Hong Kong,0,0
System Analyst,ParaDM Company Limited,5,True,"Kwun Tong, Kwun Tong District",Information & Communication Technology,,2024-06-26 18:00,74860574,https://hk.jobsdb.com/job/74860574,Kwun Tong,Kwun Tong,Kowloon,0,0
IT Business Analyst - 5-day work,Centaline Securities Limited,2,True,"Tsim Sha Tsui, Yau Tsim Mong District",Information & Communication Technology,,2024-06-07 18:00,76434732,https://hk.jobsdb.com/job/76434732,Tsim Sha Tsui,Yau Tsim Mong,Kowloon,0,0
Project Manager,New Media Group Publishing Limited,2,False,"Kwun Tong, Kwun Tong District",Information & Communication Technology,,2024-06-26 18:00,76195838,https://hk.jobsdb.com/job/76195838,Kwun Tong,Kwun Tong,Kowloon,0,0
Business Development/Operations Specialist - Fin-tech & Financial Services,Up Way China Bullion Limited,2,False,Tsuen Wan District,Banking & Financial Services,,2024-06-25 18:00,76810260,https://hk.jobsdb.com/job/76810260,,Tsuen Wan,New Territories,0,0
Business Analyst,The Career Works Limited,2,False,"Whampoa Garden, Kowloon City District",Information & Communication Technology,,2024-06-07 18:00,76433820,https://hk.jobsdb.com/job/76433820,Whampoa Garden,Kowloon City,Kowloon,0,0
Business Analyst - Tech solution house MNC,PERSOLKELLY Hong Kong Limited,2,False,Kowloon,Information & Communication Technology,"$22,000 - $25,000 per month",2024-06-07 18:00,76444293,https://hk.jobsdb.com/job/76444293,,,Kowloon,22000,25000
Assistant e-Banking Manager,Chiyu Banking Corp Ltd,2,False,"Central, Central and Western District",Banking & Financial Services,,2024-06-29 18:00,76913334,https://hk.jobsdb.com/job/76913334,Central,Central and Western,Hong Kong,0,0
Project Manager (insurance),Leadership Solutions Limited,3,False,Wan Chai District,Information & Communication Technology,,2024-06-25 18:00,76811227,https://hk.jobsdb.com/job/76811227,,Wan Chai,Hong Kong,0,0
Project Executive,The Great Eagle Co Ltd,1,False,"Mong Kok, Yau Tsim Mong District",Information & Communication Technology,,2024-06-28 18:00,76885851,https://hk.jobsdb.com/job/76885851,Mong Kok,Yau Tsim Mong,Kowloon,0,0
Revenue Management Analyst,Company Confidential,3,False,Hong Kong,Accounting,,2024-06-22 18:00,76754696,https://hk.jobsdb.com/job/76754696,,,Hong Kong,0,0
"Business analyst (Perm role, digital project, 25k-35k)",Linkers International Limited,2,False,"Kwun Tong, Kwun Tong District",Information & Communication Technology,"$25,000 - $35,000 per month",2024-06-06 18:00,76413858,https://hk.jobsdb.com/job/76413858,Kwun Tong,Kwun Tong,Kowloon,25000,35000
Assistant Project Manager / Project Manager (Software development),Automated Systems (HK) Ltd,3,False,Hong Kong,Information & Communication Technology,,2024-06-24 18:00,74705260,https://hk.jobsdb.com/job/74705260,,,Hong Kong,0,0
Assistant Business Analyst / Business Analyst,AAStocks.com Limited,1,False,"Kwun Tong, Kwun Tong District",Information & Communication Technology,,2024-06-11 18:00,76513235,https://hk.jobsdb.com/job/76513235,Kwun Tong,Kwun Tong,Kowloon,0,0
Business Analyst (Digital Platform) / Digital Forwarding Team (WFH Policy),Yusen Logistics Global Management Limited,2,False,"Kwai Hing, Kwai Tsing District",Information & Communication Technology,,2024-06-06 18:00,73052436,https://hk.jobsdb.com/job/73052436,Kwai Hing,Kwai Tsing,New Territories,0,0
"Business Analyst (AM Level, Regional Operation System)",Robert Walters (HK) Ltd,5,False,Central and Western District,Information & Communication Technology,$35k - $40k p.m.,2024-06-18 18:00,76645270,https://hk.jobsdb.com/job/76645270,,Central and Western,Hong Kong,35000,40000
Solution Analyst,NTT DATA Hong Kong Limited,1,False,"Tai Koo, Eastern District",Information & Communication Technology,,2024-06-24 18:00,76787806,https://hk.jobsdb.com/job/76787806,Tai Koo,Eastern,Hong Kong,0,0
System Analyst (Data or Payment or Treasury & Settlement),Chong Hing Bank Ltd,4,False,"Kowloon Bay, Kwun Tong District",Information & Communication Technology,,2024-06-25 18:00,76815280,https://hk.jobsdb.com/job/76815280,Kowloon Bay,Kwun Tong,Kowloon,0,0
(UP to 50K) Business Analyst (Banking and Government),Seamatch Asia Limited,1,True,"Central, Central and Western District",Information & Communication Technology,,2024-06-19 18:00,76685437,https://hk.jobsdb.com/job/76685437,Central,Central and Western,Hong Kong,0,0
"Senior System Analyst(Goverment Project, Data Management)",PERSOLKELLY Hong Kong Limited,,False,"Wan Chai, Wan Chai District",Information & Communication Technology,,2024-06-30 16:00,76936001,https://hk.jobsdb.com/job/76936001,Wan Chai,Wan Chai,Hong Kong,0,0
Senior CRM Analyst (Regional),AS Watson Retail (HK) Limited,3,True,"Whampoa Garden, Kowloon City District",Marketing & Communications,,2024-06-25 18:00,76792915,https://hk.jobsdb.com/job/76792915,Whampoa Garden,Kowloon City,Kowloon,0,0
Contract Senior Systems Analyst (50082),CLTS HK,2,False,"Wan Chai, Wan Chai District",Information & Communication Technology,,2024-06-25 18:00,76811632,https://hk.jobsdb.com/job/76811632,Wan Chai,Wan Chai,Hong Kong,0,0
"Project Manager  - up to 65K, banking",Ambition,5,False,Central and Western District,Banking & Financial Services,$60k - $65k p.m.,2024-06-27 18:00,76863485,https://hk.jobsdb.com/job/76863485,,Central and Western,Hong Kong,60000,65000
Business Analyst / Senior Business Analyst - Sales Planning & Data analysis,Hop Lun (HK) Ltd,,False,"Cheung Sha Wan, Sham Shui Po District",Information & Communication Technology,,2024-06-19 18:00,76670142,https://hk.jobsdb.com/job/76670142,Cheung Sha Wan,Sham Shui Po,Kowloon,0,0
Business Analyst / Junior Business Analyst (Finance Team),Manulife (International) Limited,,False,"Ngau Tau Kok, Kwun Tong District",Insurance & Superannuation,,2024-06-17 18:00,76610963,https://hk.jobsdb.com/job/76610963,Ngau Tau Kok,Kwun Tong,Kowloon,0,0
Business Analyst - Global MNC - Salesforce CRM,TEKsystems,5,False,"Central, Central and Western District",Information & Communication Technology,"$55,000 - $65,000 per month",2024-06-17 18:00,76609678,https://hk.jobsdb.com/job/76609678,Central,Central and Western,Hong Kong,55000,65000
Lead Project Manager (Financial Service),Captar Partners Limited,8,False,Central and Western District,Information & Communication Technology,HKD 1100000 - 1600000 per annum,2024-06-28 18:00,76886899,https://hk.jobsdb.com/job/76886899,,Central and Western,Hong Kong,1100000,1600000
Business Management Trainee 財富管理培訓生,AIA International Limited,,False,"Causeway Bay, Wan Chai District",Banking & Financial Services,"$39,000 - $58,000 per month",2024-06-27 18:00,76868160,https://hk.jobsdb.com/job/76868160,Causeway Bay,Wan Chai,Hong Kong,39000,58000
Storage Engineer,Amidas Hong Kong Limited,,False,"Lai Chi Kok, Sham Shui Po District",Information & Communication Technology,,2024-06-28 18:00,76904021,https://hk.jobsdb.com/job/76904021,Lai Chi Kok,Sham Shui Po,Kowloon,0,0
Business Analyst,AT Global Services Limited,3,False,"Wan Chai, Wan Chai District",Information & Communication Technology,,2024-06-05 18:00,76387220,https://hk.jobsdb.com/job/76387220,Wan Chai,Wan Chai,Hong Kong,0,0
"Research Analyst, Euromoney",Euromoney Institutional Investor (Jersey) Limited,5,False,Hong Kong,Banking & Financial Services,,2024-06-27 18:00,76274408,https://hk.jobsdb.com/job/76274408,,,Hong Kong,0,0
"Corporate Finance, Investment Banking Analyst",Zhongtai Financial International Limited,2,False,"Central, Central and Western District",Banking & Financial Services,,2024-06-27 18:00,76859113,https://hk.jobsdb.com/job/76859113,Central,Central and Western,Hong Kong,0,0
Business Analyst / Project Manager ( 20K-  55K ),Osmium Consulting Group Limited,2,False,"Tsim Sha Tsui, Yau Tsim Mong District",Information & Communication Technology,,2024-06-05 18:00,76376675,https://hk.jobsdb.com/job/76376675,Tsim Sha Tsui,Yau Tsim Mong,Kowloon,0,0
Business Analyst,Casetagram Limited,5,False,"Ngau Tau Kok, Kwun Tong District",Retail & Consumer Products,,2024-06-05 18:00,76372751,https://hk.jobsdb.com/job/76372751,Ngau Tau Kok,Kwun Tong,Kowloon,0,0
Business Analyst - Finance Team,Michael Page International (HK) Ltd,3,False,Central and Western District,Accounting,,2024-06-17 18:00,76621784,https://hk.jobsdb.com/job/76621784,,Central and Western,Hong Kong,0,0
SAP FI CO Consultant,Nexus Global Pty Limited,1,True,"Quarry Bay, Eastern District",Information & Communication Technology,,2024-06-26 18:00,76849227,https://hk.jobsdb.com/job/76849227,Quarry Bay,Eastern,Hong Kong,0,0
Assistant Merchandise Planning Analyst,G2000 (Apparel) Ltd,1,True,"Kwai Fong, Kwai Tsing District",Retail & Consumer Products,,2024-06-25 18:00,76814225,https://hk.jobsdb.com/job/76814225,Kwai Fong,Kwai Tsing,New Territories,0,0
"IT Business Analyst (Large Corporate, 35K, PERM)",Recruit Logic Limited,3,False,"Tsim Sha Tsui, Yau Tsim Mong District",Information & Communication Technology,,2024-06-17 18:00,76612428,https://hk.jobsdb.com/job/76612428,Tsim Sha Tsui,Yau Tsim Mong,Kowloon,0,0
PMO Director - IT Transformation & ERP Focus,**Private,8,False,"Cheung Sha Wan, Sham Shui Po District",Information & Communication Technology,,2024-06-28 18:00,76894008,https://hk.jobsdb.com/job/76894008,Cheung Sha Wan,Sham Shui Po,Kowloon,0,0
