"Senior Sales Executive, Wholesales, Asia Pacific (1-year contract)",PVH Asia Limited,5,TRUE,"Hung Hom, Kowloon City District",Sales,,2024-06-28 18:00,76912111,https://hk.jobsdb.com/job/76912111
Project Manager/ Assistant Project Manager (ERP / SAP FICO),Emperor Watch & Jewellery (HK) Company Limited,1,FALSE,"Wan Chai, Wan Chai District",Information & Communication Technology,,2024-06-25 18:00,76805390,https://hk.jobsdb.com/job/76805390
"Analyst, OTC - Derivatives Structured Product, Business Operation",BOC International Holdings Ltd,1,FALSE,"Sheung Wan, Central and Western District",Banking & Financial Services,,2024-06-19 18:00,76668864,https://hk.jobsdb.com/job/76668864
"Actuarial Analyst, Asia-Pacific Actuarial Group (Hong Kong)","Allied World Assurance Company, Ltd",2,FALSE,Eastern District,Insurance & Superannuation,,2024-06-28 18:00,76901456,https://hk.jobsdb.com/job/76901456
Credit Analyst - Corporate Banking / Commercial Banking,Asia Progress Executive Limited,5,TRUE,Wan Chai District,Banking & Financial Services,,2024-06-28 18:00,76910777,https://hk.jobsdb.com/job/76910777
FP&A - Luxury Retail Business Finance (Immediately Available Preferred),BDO Financial Services Limited,2,FALSE,"Quarry Bay, Eastern District",Accounting,,2024-06-27 18:00,76859975,https://hk.jobsdb.com/job/76859975
Assistant Financial Analyst,Asia Airfreight Terminal Co Ltd,,TRUE,"Airport Area, Islands District",Accounting,,2024-06-24 18:00,76787593,https://hk.jobsdb.com/job/76787593
"VP, Team Lead, Customer Proposition Analytics, Data Chapter",DBS Bank (Hong Kong) Limited,,FALSE,Hong Kong,Banking & Financial Services,,2024-06-28 18:00,76910430,https://hk.jobsdb.com/job/76910430
"Analyst , Futures & Options/Exchange Traded Derivatives, Business Operations",BOC International Holdings Ltd,2,FALSE,"Sheung Wan, Central and Western District",Banking & Financial Services,,2024-06-19 18:00,76671270,https://hk.jobsdb.com/job/76671270
System Analyst (Private Banking Team),Company Confidential,6,FALSE,Hong Kong,Information & Communication Technology,,2024-06-25 18:00,76795653,https://hk.jobsdb.com/job/76795653
System Analyst,Hong Kong Life Insurance Limited,7,FALSE,"Sheung Wan, Central and Western District",Information & Communication Technology,,2024-06-25 18:00,76816482,https://hk.jobsdb.com/job/76816482
BI Specialist / Senior Data Analyst (Five day work weeks),Excel Technology International (Hong Kong) Limited,3,FALSE,Hong Kong,Information & Communication Technology,,2024-06-24 18:00,76768377,https://hk.jobsdb.com/job/76768377
Oracle System Analyst (VCO260/J22),VTECH Corporate Services Ltd,5,FALSE,Tai Po District,Information & Communication Technology,,2024-06-25 18:00,76802649,https://hk.jobsdb.com/job/76802649
Analyst - Market Research at S.F. Express (Hong Kong) Limited,Jobsdb - SmartHire,5,TRUE,"Tsing Yi, Kwai Tsing District",Marketing & Communications,,2024-06-25 18:00,76538977,https://hk.jobsdb.com/job/76538977
System Architect / POS Project Manager for Restaurant Systems,Taste of Asia Group Limited,,FALSE,"Wong Tai Sin, Wong Tai Sin District",Information & Communication Technology,,2024-06-27 18:00,76874879,https://hk.jobsdb.com/job/76874879
Major Bank - Junior IT Business Analysts - (Welcome Fresh Grad),IT Solutions Ltd.,,TRUE,Hong Kong,Information & Communication Technology,,2024-06-22 18:00,76760946,https://hk.jobsdb.com/job/76760946
Digital Solution Specialist - Chatbot,WallStone Partners & Company Limited,3,TRUE,Hong Kong Island,Information & Communication Technology,,2024-06-26 18:00,76837219,https://hk.jobsdb.com/job/76837219
Data Governance & Risk Management Analyst (Permanent / 2-Yr Contract),CLP Power Hong Kong Limited 中華電力有限公司,2,TRUE,"Sham Shui Po, Sham Shui Po District",Accounting,,2024-06-20 18:00,76690601,https://hk.jobsdb.com/job/76690601
Project Manager,SinoPac Securities (Asia) Limited,3,FALSE,"Causeway Bay, Wan Chai District",Information & Communication Technology,,2024-06-24 18:00,76772788,https://hk.jobsdb.com/job/76772788
Quality Assurance(QA) Tester,Chief Group Limited,,FALSE,"Sheung Wan, Central and Western District",Information & Communication Technology,,2024-06-25 18:00,76158040,https://hk.jobsdb.com/job/76158040
"Analyst - Payment Investigation, Technology & Operations",DBS Bank (Hong Kong) Limited,,FALSE,Hong Kong,Information & Communication Technology,,2024-06-24 18:00,76794912,https://hk.jobsdb.com/job/76794912
Business Analyst,Ricacorp Properties Limited,1,FALSE,"Wan Chai, Wan Chai District",Information & Communication Technology,,2024-06-04 18:00,76345244,https://hk.jobsdb.com/job/76345244
"Senior Consultant (MNC management consulting firm,PB focus)",Links international,3,FALSE,Islands District,Information & Communication Technology,$50k - $60k p.m.,2024-06-24 18:00,76783311,https://hk.jobsdb.com/job/76783311
IT Business Analyst - Agency Contractor,Chiyu Banking Corp Ltd,3,FALSE,"Central, Central and Western District",Information & Communication Technology,,2024-06-15 18:00,76593498,https://hk.jobsdb.com/job/76593498
"First Vice President, Business Planning Team",Fubon Bank (Hong Kong) Limited,1,FALSE,"North Point, Eastern District",Information & Communication Technology,,2024-06-27 18:00,76867726,https://hk.jobsdb.com/job/76867726
Senior Digital Delivery Analyst - Insurance ,Ambition,5,TRUE,Central and Western District,Information & Communication Technology,,2024-06-21 18:00,76742044,https://hk.jobsdb.com/job/76742044
Assistant Manager - Policy Admin Project Management,China Life Insurance (Overseas) Company Limited,5,FALSE,"Wan Chai, Wan Chai District",Insurance & Superannuation,,2024-06-25 18:00,76806707,https://hk.jobsdb.com/job/76806707
Trade & Supply Chain Application L2 support,Optimum Solutions (Hong Kong) Limited,5,FALSE,"Central, Central and Western District",Information & Communication Technology,,2024-06-26 18:00,76844310,https://hk.jobsdb.com/job/76844310
(Senior) Digital Strategy and Transformation Manager,Bank of China (Hong Kong) Limited,3,FALSE,Hong Kong,Banking & Financial Services,,2024-06-28 18:00,76904173,https://hk.jobsdb.com/job/76904173
Associate - Project Management (IT),FundPark Limited,1,FALSE,Kwun Tong District,Information & Communication Technology,,2024-06-25 18:00,76812097,https://hk.jobsdb.com/job/76812097
"Officer, OTC Bilateral, ETD/DC and Prime Brokerage Margining Settlement Analyst",Citibank (Hong Kong) Limited,2,FALSE,"Kowloon City, Kowloon City District",Call Centre & Customer Service,,2024-06-28 18:00,76890737,https://hk.jobsdb.com/job/76890737
Java System Analyst - Government Project,Morgan Half International (Hong Kong) Limited,5,FALSE,"Kwun Tong, Kwun Tong District",Information & Communication Technology,"$38,000 - $45,000 per month",2024-06-28 18:00,76887168,https://hk.jobsdb.com/job/76887168
Business Analyst - Trading system,Morgan Half International (Hong Kong) Limited,1,FALSE,Hong Kong,Information & Communication Technology,,2024-06-02 18:00,76304538,https://hk.jobsdb.com/job/76304538
QA Officer,Joint Electronic Teller Services Limited (“JETCO”),2,FALSE,"Ngau Tau Kok, Kwun Tong District",Science & Technology,,2024-06-26 18:00,76451225,https://hk.jobsdb.com/job/76451225
Assistant Project Manager/Project Manager/Senior Project Manager,Turner & Townsend Limited,1,FALSE,Hong Kong,Construction,,2024-06-28 18:00,76908511,https://hk.jobsdb.com/job/76908511
Digital Product Specialist,Plotio Financial Group Limited,2,FALSE,"Tsim Sha Tsui, Yau Tsim Mong District",Marketing & Communications,,2024-06-27 18:00,76445515,https://hk.jobsdb.com/job/76445515
Project Manager - Educational Services Department (Ref: PM/ESD/06-24),The Salvation Army,3,FALSE,"Yau Ma Tei, Yau Tsim Mong District",Education & Training,,2024-06-25 18:00,76806517,https://hk.jobsdb.com/job/76806517
Senior System Engineer/Assistant IT Manager,Forida Limited,5,FALSE,"Lai Chi Kok, Sham Shui Po District",Information & Communication Technology,,2024-06-28 18:00,76325626,https://hk.jobsdb.com/job/76325626
Project Coordinator / Assistant Project Manager,Infocast Limited,1,FALSE,"Hung Hom, Kowloon City District",Banking & Financial Services,,2024-06-24 18:00,76773067,https://hk.jobsdb.com/job/76773067
Regional Consumer Insight analysis Manager ( FMCG ),ConnectedGroup Limited,8,FALSE,Central and Western District,Marketing & Communications,,2024-06-27 18:00,76868033,https://hk.jobsdb.com/job/76868033
PL/SQL & Shell Script: ETL Data Warehouse SA / AP -  Major Bank,IT Solutions Ltd.,3,TRUE,Hong Kong,Information & Communication Technology,,2024-06-29 18:00,76928743,https://hk.jobsdb.com/job/76928743
Digital Transformation Manager (Banking),Peoplebank Hong Kong Limited,5,FALSE,"Sheung Wan, Central and Western District",Information & Communication Technology,60000,2024-06-25 18:00,76817371,https://hk.jobsdb.com/job/76817371
Project Manager,The Hong Kong Ballet Ltd,6,FALSE,"Causeway Bay, Wan Chai District",Construction,,2024-06-27 18:00,76859718,https://hk.jobsdb.com/job/76859718
Supply Chain Analyst,Premier Brands Group International Limited,3,FALSE,"Kwai Fong, Kwai Tsing District","Manufacturing, Transport & Logistics",,2024-06-24 18:00,76788191,https://hk.jobsdb.com/job/76788191
"Team Lead, IT Solutions",Hong Kong Air Cargo Terminals Ltd,8,TRUE,"Airport Area, Islands District",Information & Communication Technology,,2024-06-28 18:00,75734161,https://hk.jobsdb.com/job/75734161
Manager/ Senior Consultant/ Consultant - Organization Transformation - Hong Kong,Deloitte Touche Tohmatsu,,FALSE,Central and Western District,Consulting & Strategy,,2024-06-28 18:00,76903350,https://hk.jobsdb.com/job/76903350
Systems Operator Trainee,Bangkok Bank Public Co Ltd,,FALSE,"Central, Central and Western District",Information & Communication Technology,,2024-06-27 18:00,75705263,https://hk.jobsdb.com/job/75705263
"Assistant Vice President, Business Planning (Wholesale Banking Group)",OCBC Bank (Hong Kong) Limited,,FALSE,"Central, Central and Western District",Banking & Financial Services,,2024-06-25 18:00,76794635,https://hk.jobsdb.com/job/76794635
"Specialist, Digital Products",Hong Kong Express Airways Limited,3,FALSE,"Airport Area, Islands District",Information & Communication Technology,,2024-06-21 18:00,76745921,https://hk.jobsdb.com/job/76745921
Senior Project Manager - Treasury,Fishsteria Limited,8,FALSE,Hong Kong,Information & Communication Technology,,2024-06-25 18:00,76821696,https://hk.jobsdb.com/job/76821696
Manager,PCCW Global Limited,,TRUE,Hong Kong,Information & Communication Technology,,2024-06-18 18:00,76646981,https://hk.jobsdb.com/job/76646981
Business Analyst - Banking Projects (Five day work weeks),Excel Technology International (Hong Kong) Limited,,FALSE,Hong Kong,Banking & Financial Services,,2024-06-15 18:00,76595974,https://hk.jobsdb.com/job/76595974
"(Senior) Analyst, Investment Operations (fresh-graduates will be considered)",The Hong Kong Jockey Club,3,TRUE,"Causeway Bay, Wan Chai District",Banking & Financial Services,,2024-06-28 18:00,76912637,https://hk.jobsdb.com/job/76912637
"Project Manager (PMP, Gov't exp)",CL Technical Services Ltd.,8,FALSE,"Central, Central and Western District",Information & Communication Technology,"$70,000 - $80,000 per month",2024-06-24 18:00,76787677,https://hk.jobsdb.com/job/76787677
Senior Business Analyst (Sales HR),AXA Hong Kong,4,FALSE,Central and Western District,Information & Communication Technology,discretionary bonus,2024-06-15 18:00,76593458,https://hk.jobsdb.com/job/76593458
ESG Research Analyst,Connexe Search Limited,2,FALSE,"Central, Central and Western District",Banking & Financial Services,"$35,000 - $50,000 per month",2024-06-28 18:00,76441334,https://hk.jobsdb.com/job/76441334
"Analyst, OTC - Fixed Income, Business Operations",BOC International Holdings Ltd,1,FALSE,"Sheung Wan, Central and Western District",Banking & Financial Services,,2024-06-18 18:00,76655556,https://hk.jobsdb.com/job/76655556
"Assistant Manager, Business Development (Insurance Broker Business)",Shanghai Commercial Bank Ltd,3,FALSE,"Tsim Sha Tsui, Yau Tsim Mong District",Insurance & Superannuation,,2024-06-28 18:00,74638523,https://hk.jobsdb.com/job/74638523
"Senior Project Executive (Excellent in English, Up to 40K)",Manpower Services (Hong Kong) Limited,3,FALSE,"Admiralty, Central and Western District",Banking & Financial Services,,2024-06-28 18:00,76912255,https://hk.jobsdb.com/job/76912255
Senior IT Officer (Contract),Peoplebank Hong Kong Limited,3,TRUE,"Tung Chung, Islands District",Information & Communication Technology,$25k - $40k p.m. + Neg.,2024-06-26 18:00,76834401,https://hk.jobsdb.com/job/76834401
Contract Project Manager (50077),CLTS HK,2,FALSE,"Tsuen Wan, Tsuen Wan District",Information & Communication Technology,,2024-06-25 18:00,76811624,https://hk.jobsdb.com/job/76811624
高級客戶服務主任 (資訊科技部 - 業務分析) Sr. Customer Service Officer (IT - Business Analysis),Hong Kong Sheng Kung Hui Welfare Council Limited,,FALSE,"Sai Wan Ho, Eastern District",Information & Communication Technology,,2024-06-21 18:00,76736456,https://hk.jobsdb.com/job/76736456
(Assistant )BA-Operations Production Partner & Incident Management team($20-28k),Manpower Services (Hong Kong) Limited,1,FALSE,"Wong Chuk Hang, Southern District",Information & Communication Technology,,2024-06-18 18:00,76644992,https://hk.jobsdb.com/job/76644992
"Graduate Analyst, Retirement Consulting (Actuarial)",Willis Towers Watson,,FALSE,"Causeway Bay, Wan Chai District",Insurance & Superannuation,,2024-06-26 18:00,76819545,https://hk.jobsdb.com/job/76819545
Project Manager (Social Worker) (Youth Project),"Institute for Integrated Rural Development, Hong Kong",,FALSE,"Kwai Chung, Kwai Tsing District",Community Services & Development,,2024-06-26 18:00,76837531,https://hk.jobsdb.com/job/76837531
"Finance Analyst, Deal Support (Top PE Fund House)",Robert Half Hong Kong Limited,8,TRUE,"Central, Central and Western District",Banking & Financial Services,,2024-06-20 18:00,76706406,https://hk.jobsdb.com/job/76706406
Project Manager（IT）,Royal Real Estate Group Limited,,FALSE,Kwun Tong District,Information & Communication Technology,,2024-06-24 18:00,76792426,https://hk.jobsdb.com/job/76792426
Project Manager (IT Software Development) at APJ Software (HK) Company Ltd,Jobsdb - SmartHire,1,TRUE,"Kowloon Bay, Kwun Tong District",Information & Communication Technology,,2024-06-25 18:00,76569879,https://hk.jobsdb.com/job/76569879
IT Business Analyst,Zoftak,4,TRUE,"Kwai Chung, Kwai Tsing District",Information & Communication Technology,,2024-06-14 18:00,76591741,https://hk.jobsdb.com/job/76591741
System Analyst (Software Application | IoT | Gen AI),ADECCO Personnel Limited,2,FALSE,"Central, Central and Western District",Information & Communication Technology,,2024-06-27 18:00,76882960,https://hk.jobsdb.com/job/76882960
Application Consultant (Business Analyst),Tectura Hong Kong Ltd,,TRUE,"Tsim Sha Tsui, Yau Tsim Mong District",Information & Communication Technology,,2024-06-15 18:00,76595640,https://hk.jobsdb.com/job/76595640
System Analyst at Nanyang Brothers Tobacco Co Ltd,Jobsdb - SmartHire,,TRUE,"Tuen Mun, Tuen Mun District",Information & Communication Technology,,2024-06-25 18:00,76565786,https://hk.jobsdb.com/job/76565786
Quality Assurance / Tester (Banking)- (18-25k),Ambition,,FALSE,Central and Western District,Information & Communication Technology,,2024-06-27 18:00,76867313,https://hk.jobsdb.com/job/76867313
Brand and Project Management Officer / Executive,Shilla Travel Retail Hong Kong Limited,1,FALSE,"Airport Area, Islands District",Marketing & Communications,,2024-06-27 18:00,76858789,https://hk.jobsdb.com/job/76858789
Statistical Officer II (C/HQAS-SS/STO2/06/24-AP2),Company Confidential,,FALSE,"Pok Fu Lam, Southern District",Administration & Office Support,,2024-06-26 18:00,76825655,https://hk.jobsdb.com/job/76825655
Project Manager,Quam Securities Limited,5,TRUE,"Sheung Wan, Central and Western District",Information & Communication Technology,,2024-06-21 18:00,76734085,https://hk.jobsdb.com/job/76734085
"Senior Product Owner, Deposits & FX",Standard Chartered Bank,5,FALSE,"Quarry Bay, Eastern District",Information & Communication Technology,,2024-06-24 18:00,76768893,https://hk.jobsdb.com/job/76768893
"Manager, IT Application Development",Hong Kong Applied Science and Technology Research Institute Company Limited,6,FALSE,Sha Tin District,Information & Communication Technology,,2024-06-27 18:00,76861377,https://hk.jobsdb.com/job/76861377
Digital Ecommerce Officer,Supergo Company Limited,2,FALSE,"Kwun Tong, Kwun Tong District",Marketing & Communications,"$20,000 - $24,999 per month",2024-06-27 18:00,75960978,https://hk.jobsdb.com/job/75960978
Senior Officer - Business Development,The Tokio Marine and Fire Insurance Co (HK) Ltd,5,FALSE,"Admiralty, Central and Western District",Sales,,2024-06-14 18:00,76578775,https://hk.jobsdb.com/job/76578775
Assistant Data Analytics Manager,Jardine Restaurant Group,3,FALSE,"Hung Hom, Kowloon City District",Information & Communication Technology,,2024-06-25 18:00,76805794,https://hk.jobsdb.com/job/76805794
"Project Manager (PRC Based, 45 minutes from ShenZhen)",Honor Tone Limited,8,TRUE,Hong Kong,Engineering,,2024-06-28 18:00,76911912,https://hk.jobsdb.com/job/76911912
Systems Analyst,St. Teresa's Hospital,,FALSE,Hong Kong,Information & Communication Technology,,2024-06-19 18:00,76667716,https://hk.jobsdb.com/job/76667716
Analyst - Payment Investigation,DBS Bank (Hong Kong) Limited,5,FALSE,Kwun Tong District,Banking & Financial Services,,2024-06-21 18:00,76748523,https://hk.jobsdb.com/job/76748523
Assistant Digital Workplace Manager,Swire Properties Limited 太古地產有限公司,4,FALSE,Hong Kong,Information & Communication Technology,,2024-06-25 18:00,75157416,https://hk.jobsdb.com/job/75157416
Treasury Analyst | Up to 28K,Robert Walters (HK) Ltd,1,FALSE,Central and Western District,Accounting,,2024-06-24 18:00,76789298,https://hk.jobsdb.com/job/76789298
Financial Analyst / Senior Financial Analyst,Chiho Environmental Group Limited,3,FALSE,Hong Kong,Accounting,,2024-06-25 18:00,76793105,https://hk.jobsdb.com/job/76793105
"Senior Manager - IT, Asset Management Application Portfolio",Link Asset Management Limited,1,FALSE,"Kowloon Bay, Kwun Tong District",Information & Communication Technology,,2024-06-28 18:00,76909873,https://hk.jobsdb.com/job/76909873
Project Executive / Senior Project Executive,VICO Systems Limited,2,FALSE,"Kwun Tong, Kwun Tong District",Sales,,2024-06-27 18:00,76865073,https://hk.jobsdb.com/job/76865073
System Analyst (Private Banking Team),SIRIUS Partners Limited,,FALSE,Hong Kong,Information & Communication Technology,,2024-06-24 18:00,76794914,https://hk.jobsdb.com/job/76794914
Senior Officer/Assistant Manager - Project Analysis - Corporate Office,Langham Hotels International Ltd,1,FALSE,Wan Chai District,Hospitality & Tourism,,2024-06-27 18:00,76860555,https://hk.jobsdb.com/job/76860555
"IT Support Analyst, Financial Services",ConnectedGroup Limited,2,FALSE,Central and Western District,Information & Communication Technology,,2024-06-29 18:00,76921783,https://hk.jobsdb.com/job/76921783
System Analyst (AI company),Expert Systems Limited,,FALSE,"Kwun Tong, Kwun Tong District",Information & Communication Technology,,2024-06-24 18:00,76776010,https://hk.jobsdb.com/job/76776010
System Analyst,Automated Systems (HK) Ltd,4,FALSE,Hong Kong,Information & Communication Technology,,2024-06-24 18:00,74705314,https://hk.jobsdb.com/job/74705314
Data Assistant (Quality Assurance),AT Global Services Limited,1,FALSE,Wan Chai District,Information & Communication Technology,,2024-06-25 18:00,76818686,https://hk.jobsdb.com/job/76818686
ASSISTANT PROJECT MANAGER - PROPTECH (INTEGRATION AND SOLUTION IMPLEMENTATION),Henderson Land Development Company Limited,1,FALSE,"Central, Central and Western District",Information & Communication Technology,,2024-06-21 18:00,75273927,https://hk.jobsdb.com/job/75273927
Business Analysis Officer (CSF6),PCCW Global Limited,1,FALSE,Hong Kong,Accounting,,2024-06-18 18:00,76646911,https://hk.jobsdb.com/job/76646911
Technology Risk Officier / Senior Officier,OAC Group Limited,2,FALSE,Hong Kong Island,Information & Communication Technology,,2024-06-29 18:00,76927546,https://hk.jobsdb.com/job/76927546
IT Officer (Assistant Business Analyst),Methodist Centre,1,TRUE,Hong Kong Island,Information & Communication Technology,,2024-06-13 18:00,76558853,https://hk.jobsdb.com/job/76558853
"Assistant Product Manager (~43k, Cancer related)",Manpower Services (Hong Kong) Limited,5,FALSE,"Kwun Tong, Kwun Tong District",Marketing & Communications,,2024-06-27 18:00,76877168,https://hk.jobsdb.com/job/76877168
Contract Systems Analyst (49794),Company Confidential,1,FALSE,"Wan Chai, Wan Chai District",Information & Communication Technology,,2024-06-21 18:00,76752229,https://hk.jobsdb.com/job/76752229
Assistant Manager - E-Commerce & Digital,Kingstar International Trading Ltd,5,FALSE,"Tsim Sha Tsui, Yau Tsim Mong District",Marketing & Communications,,2024-06-28 18:00,74983918,https://hk.jobsdb.com/job/74983918
Project Manager (IT Software Development) at APJ Software (HK) Company Ltd,Jobsdb - SmartHire,1,TRUE,"Kowloon Bay, Kwun Tong District",Information & Communication Technology,,2024-06-24 18:00,76788293,https://hk.jobsdb.com/job/76788293
"Business Analyst Trainee  (5-day work, 15-20K) (IANG/Fresh Graduate Welcomed)",Fran & Wen Profit,,TRUE,"Kwun Tong, Kwun Tong District",Banking & Financial Services,,2024-06-14 18:00,76582923,https://hk.jobsdb.com/job/76582923
System Analyst - Life Insurance (Ref: SALI/HL),Crossings Executive Search,5,FALSE,"Kwun Tong, Kwun Tong District",Information & Communication Technology,,2024-06-17 18:00,76604226,https://hk.jobsdb.com/job/76604226
Project Executive / Project Manager,EY Mtel Solutions Limited,1,FALSE,"Kwun Tong, Kwun Tong District","Advertising, Arts & Media",,2024-06-21 18:00,76744371,https://hk.jobsdb.com/job/76744371
Product Manager,Data World Computer & Communication Ltd,,FALSE,"Kwai Hing, Kwai Tsing District",Sales,,2024-06-28 18:00,76903753,https://hk.jobsdb.com/job/76903753
Senior Treasury Analyst - Work Life Balance,Links international,5,FALSE,Central and Western District,Accounting,$30k - $35k p.m.,2024-06-24 18:00,76786214,https://hk.jobsdb.com/job/76786214
Officer - Special Projects Unit (Credit Department) (Ref: JD-SAUO),Public Bank (Hong Kong) Ltd,3,TRUE,Hong Kong,Banking & Financial Services,,2024-06-28 18:00,74481074,https://hk.jobsdb.com/job/74481074
Senior Business Analyst (Business Insight Analysis) - CSF7,HKT,3,FALSE,"Quarry Bay, Eastern District",Accounting,,2024-06-14 18:00,76586603,https://hk.jobsdb.com/job/76586603
Statistical Officer II,Vocational Training Council / VTC,,FALSE,Hong Kong,Information & Communication Technology,,2024-06-25 18:00,76818193,https://hk.jobsdb.com/job/76818193
Algo Trading Project: Business Analysts - Major Bank,IT Solutions Ltd.,,TRUE,"Central, Central and Western District",Information & Communication Technology,,2024-06-14 18:00,76572238,https://hk.jobsdb.com/job/76572238
Treasury Analyst,Global Payments Asia-Pacific Ltd,,FALSE,"Kowloon Bay, Kwun Tong District",Accounting,,2024-06-26 18:00,76839056,https://hk.jobsdb.com/job/76839056
(Senior) System Analyst - ERP Finance System,Swire Properties Limited 太古地產有限公司,5,TRUE,"Quarry Bay, Eastern District",Information & Communication Technology,,2024-06-19 18:00,74711266,https://hk.jobsdb.com/job/74711266
Senior Operations Expert,GfK Retail and Technology Hong Kong Limited,4,FALSE,"Kwun Tong, Kwun Tong District",Information & Communication Technology,,2024-06-28 18:00,76904083,https://hk.jobsdb.com/job/76904083
"Business Analyst (Junior 22k, Senior 35k) | MNC SI company",Billion Reach,2,FALSE,Kowloon,Information & Communication Technology,"$25,000 - $35,000 per month",2024-06-13 18:00,76571775,https://hk.jobsdb.com/job/76571775
Microsoft Power BI Developer,Formia Limited,,TRUE,"Whampoa Garden, Kowloon City District",Information & Communication Technology,,2024-06-25 18:00,76792670,https://hk.jobsdb.com/job/76792670
"Specialist, Business Management Support, Consumer Banking",DBS Bank (Hong Kong) Limited,5,FALSE,"San Tin, Yuen Long District",Banking & Financial Services,,2024-06-21 18:00,76753694,https://hk.jobsdb.com/job/76753694
"Specialist, Business Resilience",Hong Kong Express Airways Limited,3,TRUE,"Airport Area, Islands District",Hospitality & Tourism,,2024-06-24 18:00,76780580,https://hk.jobsdb.com/job/76780580
Auditor (審核員) / Project Manager  - IT/ Environmental / Sustainability /...,Hong Kong Quality Assurance Agency,4,FALSE,Hong Kong,"Manufacturing, Transport & Logistics",,2024-06-24 18:00,76789608,https://hk.jobsdb.com/job/76789608
Project Manager - Corporate/ Office projects,NES Fircroft Limited,8,FALSE,"Central, Central and Western District",Construction,,2024-06-26 18:00,76836014,https://hk.jobsdb.com/job/76836014
Data Analyst (24k-36k),Manpower Services (Hong Kong) Limited,1,TRUE,"Quarry Bay, Eastern District",Information & Communication Technology,,2024-06-19 18:00,76671556,https://hk.jobsdb.com/job/76671556
Officer to Assistant Manager (IT User / Helpdesk Support) - Agency Contractor,Chiyu Banking Corp Ltd,2,FALSE,"Central, Central and Western District",Information & Communication Technology,,2024-06-29 18:00,76913429,https://hk.jobsdb.com/job/76913429
Analyst Programmer (IT System Development),Shanghai Commercial Bank Ltd,3,FALSE,"Kwai Hing, Kwai Tsing District",Information & Communication Technology,,2024-06-28 18:00,74668364,https://hk.jobsdb.com/job/74668364
System Analyst (Java),Nexify Limited,5,TRUE,Kwun Tong District,Information & Communication Technology,,2024-06-28 18:00,76912051,https://hk.jobsdb.com/job/76912051
Senior Mainframe Specialist (COBOL),Company Confidential,6,FALSE,Hong Kong,Information & Communication Technology,,2024-06-25 18:00,76795667,https://hk.jobsdb.com/job/76795667
