Senior / Credit Analyst (Corporate Banking),Industrial and Commercial Bank of China (Asia) Limited,3,,"Central, Central and Western District",Banking & Financial Services,,2024-07-16 22:00:00,77319349,https://hk.jobsdb.com/job/77319349
Assistant Business Analyst (Ref: SSO/IT/ABA/JDB),Haven of Hope Christian Service,1,,"Tseung Kwan O, Sai Kung District",Information & Communication Technology,,2024-07-12 22:00:00,77234791,https://hk.jobsdb.com/job/77234791
Systems Analyst,Gammon Construction Ltd,5,,"Kwun Tong, Kwun Tong District",Information & Communication Technology,,2024-07-17 11:00:00,77336343,https://hk.jobsdb.com/job/77336343
Algo Trading Project: Business Analysts - Major Bank,IT Solutions Ltd.,,True,"Central, Central and Western District",Information & Communication Technology,,2024-07-13 22:00:00,77262511,https://hk.jobsdb.com/job/77262511
Project Manager,ACG (Able Communications Group),,,"Causeway Bay, Wan Chai District",Information & Communication Technology,,2024-07-09 22:00:00,77152936,https://hk.jobsdb.com/job/77152936
Application Architect (SAP CRM & Services),ASMPT Technology Hong Kong Limited,2,True,"Tsing Yi, Kwai Tsing District",Information & Communication Technology,,2024-07-12 22:00:00,77250487,https://hk.jobsdb.com/job/77250487
Associate/ Senior Associate  (Project Management),Jobsdb - SmartHire,1,True,"Central, Central and Western District",Sales,,2024-07-16 22:00:00,77045901,https://hk.jobsdb.com/job/77045901
"AVP, Business Performance Management",HKT Enterprise Solutions,8,,"Quarry Bay, Eastern District",Accounting,,2024-07-09 22:00:00,77152788,https://hk.jobsdb.com/job/77152788
Credit Analyst - Regional Corporate Bank,Morgan Mckinley Limited,5,,Central and Western District,Banking & Financial Services,$45k - $50k p.m.,2024-07-16 22:00:00,77310790,https://hk.jobsdb.com/job/77310790
IT Business Analyst – Agency Contractor,Chiyu Banking Corp Ltd,3,,"Central, Central and Western District",Information & Communication Technology,,2024-07-12 22:00:00,77252996,https://hk.jobsdb.com/job/77252996
Credit Analyst,ECG Digital Commerce Limited,2,,Hong Kong,Accounting,,2024-07-15 22:00:00,77285900,https://hk.jobsdb.com/job/77285900
Data Management Specialist,Global Sources,2,,Southern District,Information & Communication Technology,,2024-07-12 22:00:00,77243702,https://hk.jobsdb.com/job/77243702
"Supervisor, Solution Analyst",Hong Kong Airlines Limited,3,,"Airport Area, Islands District",Information & Communication Technology,,2024-07-16 22:00:00,77306751,https://hk.jobsdb.com/job/77306751
Technology – ERP/ CRM Business Analyst,Accenture Technology Solutions (HK) Ltd,2,,Kowloon,Information & Communication Technology,,2024-07-02 22:00:00,76970235,https://hk.jobsdb.com/job/76970235
"Senior Specialist, Business Development (Group Business)",Sun Life Hong Kong Ltd,,,"Hung Hom, Kowloon City District",Sales,,2024-07-15 22:00:00,77276268,https://hk.jobsdb.com/job/77276268
"Solution & Data Analyst, Service Transformation",Otis Elevator Co (HK) Limited,,,"Kowloon Bay, Kwun Tong District",Information & Communication Technology,,2024-07-16 22:00:00,77310438,https://hk.jobsdb.com/job/77310438
BUSINESS ANALYST (2 year contract),Cathay Pacific Airways Ltd,3,,"Tung Chung, Islands District",Accounting,,2024-07-11 22:00:00,77200023,https://hk.jobsdb.com/job/77200023
IT Project Manager (IANG & QMAS Candidates Welcome),Infocan Computer (Hong Kong) Ltd,3,,Kwun Tong District,Information & Communication Technology,,2024-07-17 16:00:00,77348809,https://hk.jobsdb.com/job/77348809
Non-financial Due Diligence Analyst and Investigator - Trainee,Total Credit Management Services Hong Kong Limited,,,"Ngau Tau Kok, Kwun Tong District",Banking & Financial Services,"$15,000 - $18,000 per month",2024-07-15 22:00:00,77287438,https://hk.jobsdb.com/job/77287438
IT Business Analyst,JFE Consulting Limited,,,"Central, Central and Western District",Information & Communication Technology,,2024-07-09 22:00:00,77154937,https://hk.jobsdb.com/job/77154937
"Senior Associate/Associate, Procurement Operations, Technology & Operations",DBS Bank (Hong Kong) Limited,2,True,Kwun Tong District,"Manufacturing, Transport & Logistics",,2024-07-12 22:00:00,77235612,https://hk.jobsdb.com/job/77235612
Senior Business Analyst - Shared Service Application,Maxim's Caterers Limited,3,True,"Lai Chi Kok, Sham Shui Po District",Information & Communication Technology,,2024-07-12 22:00:00,77245449,https://hk.jobsdb.com/job/77245449
Assurance - Technology Risk - Senior Consultant/Consultant - Hong Kong,EY,,,Hong Kong Island,Information & Communication Technology,,2024-07-17 16:00:00,77348650,https://hk.jobsdb.com/job/77348650
"Business Analyst, Business Planning & Strategy (Leading Logistic/ Supply Chain)",Nesta (Hong Kong) Limited,2,,"Mong Kok, Yau Tsim Mong District","Manufacturing, Transport & Logistics","$30,000 - $32,000 per month",2024-07-12 22:00:00,77252784,https://hk.jobsdb.com/job/77252784
Project Manager (Chemical) at TUV SUD Hong Kong Limited,Jobsdb - SmartHire,4,,Yuen Long District,Engineering,,2024-07-16 22:00:00,76864307,https://hk.jobsdb.com/job/76864307
IT Project Manager – ERP/CRM/CMS (30-40K),Swing Consulting Limited,5,,"Tsim Sha Tsui, Yau Tsim Mong District",Information & Communication Technology,"$30,000 - $40,000 per month",2024-07-17 16:00:00,77348607,https://hk.jobsdb.com/job/77348607
Senior / Systems Analyst,Bangkok Bank Public Co Ltd,5,,"Central, Central and Western District",Information & Communication Technology,,2024-07-17 12:00:00,75705204,https://hk.jobsdb.com/job/75705204
Assistant System Project Manager,The Well Leatherware Mfy Ltd,,,"Mong Kok, Yau Tsim Mong District",Information & Communication Technology,,2024-07-09 22:00:00,77137550,https://hk.jobsdb.com/job/77137550
System Analyst,HKT,2,,"Wan Chai, Wan Chai District",Information & Communication Technology,,2024-07-17 18:00:00,77352925,https://hk.jobsdb.com/job/77352925
Assistant Project Manager (IT Projects),OneAsia Network Limited,3,True,"Kowloon Bay, Kwun Tong District",Information & Communication Technology,,2024-07-08 22:00:00,77124625,https://hk.jobsdb.com/job/77124625
IT & Digital Lead HKTW,Reckitt Benckiser Hong Kong Limited,,,"Causeway Bay, Wan Chai District",Information & Communication Technology,,2024-07-16 22:00:00,77310432,https://hk.jobsdb.com/job/77310432
Business Analyst (MNC / Up to 50K),PERSOLKELLY Hong Kong Limited,3,,"Tsim Sha Tsui, Yau Tsim Mong District",Accounting,"$36,000 - $45,000 per month",2024-07-11 22:00:00,77210348,https://hk.jobsdb.com/job/77210348
"(HK$48-60K+ monthly) Senior Analyst, Researcher, Financial Services",TierONE Consultants,,,"Central, Central and Western District",Information & Communication Technology,"$45,000 - $60,000 per month",2024-07-16 22:00:00,77316476,https://hk.jobsdb.com/job/77316476
IT Project Manager / Assistant Manager / Supervisor,Tachibana Sales (H.K.) Ltd,2,,"Kowloon Bay, Kwun Tong District",Information & Communication Technology,,2024-07-16 22:00:00,76004128,https://hk.jobsdb.com/job/76004128
"Senior Business Analyst (6 months contract, Attractive Salary)",RecruitFirst Limited,5,,Hong Kong Island,Information & Communication Technology,,2024-07-12 22:00:00,77239951,https://hk.jobsdb.com/job/77239951
Business Analyst,AXA Hong Kong,2,,"Wong Chuk Hang, Southern District",Information & Communication Technology,work from home,2024-07-08 22:00:00,77124957,https://hk.jobsdb.com/job/77124957
Analyst,A. R. Medicom Inc. (Asia) Limited,3,,"North Point, Eastern District","Manufacturing, Transport & Logistics",,2024-07-16 22:00:00,77321234,https://hk.jobsdb.com/job/77321234
