"Manager, Vendor Management (3799)",Standard Chartered Bank,,False,Kwun Tong District,Banking & Financial Services,,2024-07-10 05:00:00,77139047,https://hk.jobsdb.com/job/77139047
Business Technology Analyst ( Open Platform ),Bank of China (Hong Kong) Limited,3,False,Hong Kong,Information & Communication Technology,,2024-06-26 05:00:00,76816632,https://hk.jobsdb.com/job/76816632
Group Own Brand Supply & Demand Planner,DFI Development (HK) Limited,3,False,"Quarry Bay, Eastern District","Manufacturing, Transport & Logistics",,2024-07-11 05:00:00,77179212,https://hk.jobsdb.com/job/77179212
Senior Business Planning Analyst,YesStyle.com Limited,3,False,"Kwai Hing, Kwai Tsing District",Marketing & Communications,,2024-07-09 05:00:00,76508685,https://hk.jobsdb.com/job/76508685
Financial Consultant/Financial Planning Manager (Welcome graduates),Kan & L Co,,True,"Ngau Tau Kok, Kwun Tong District",Banking & Financial Services,"$14,000 - $21,000 per month",2024-07-16 05:00:00,77282612,https://hk.jobsdb.com/job/77282612
"Deputy Manager - Manager, Corporate and Credit Audit - IAD",Industrial and Commercial Bank of China (Asia) Limited,6,False,Hong Kong,Banking & Financial Services,,2024-07-16 05:00:00,77281550,https://hk.jobsdb.com/job/77281550
"Project Manager - Health and Beauty, Accessories",Exceed Consulting Limited,5,False,"Hung Hom, Kowloon City District",Retail & Consumer Products,,2024-07-17 17:00:00,77350451,https://hk.jobsdb.com/job/77350451
営業※ビザサポート有り(SDG-108825),RGF HR Agent Hong Kong Limited,,False,Kowloon,Information & Communication Technology,"$23,000 - $28,000 per month",2024-07-12 05:00:00,77215202,https://hk.jobsdb.com/job/77215202
Senior Analyst,DFI Development (HK) Limited,2,False,"Quarry Bay, Eastern District",Consulting & Strategy,,2024-07-12 05:00:00,76256784,https://hk.jobsdb.com/job/76256784
Financial Analyst,Handao Technology Limited,,False,"Central, Central and Western District",Accounting,"$28,000 - $35,000 per month",2024-07-03 05:00:00,76989451,https://hk.jobsdb.com/job/76989451
Business Analyst - Telecommunications MNC - WFH,TEKsystems,,False,"Wan Chai, Wan Chai District",Information & Communication Technology,"$25,000 - $35,000 per month",2024-06-25 05:00:00,76792350,https://hk.jobsdb.com/job/76792350
"Specialist, Revenue Management",Hong Kong Express Airways Limited,2,True,"Airport Area, Islands District",Sales,,2024-07-17 16:00:00,77347927,https://hk.jobsdb.com/job/77347927
Business Analyst (Major Insurance Firm),Cornerstone Global Partners,2,False,"Central, Central and Western District",Information & Communication Technology,"$30,000 - $45,000 per month",2024-06-25 05:00:00,76776740,https://hk.jobsdb.com/job/76776740
IT Learning and Development Manager,Mayer Brown,,False,"Wong Chuk Hang, Southern District",Human Resources & Recruitment,,2024-07-12 05:00:00,77218522,https://hk.jobsdb.com/job/77218522
Consultant Internship/ Trainee/ Asset Management Consultant (Fresh Graduates...,AIA International Limited,1,True,"Causeway Bay, Wan Chai District",Banking & Financial Services,,2024-07-14 05:00:00,77263761,https://hk.jobsdb.com/job/77263761
Business Analyst - Business Solutions,B.S.C. Group Limited,,False,"Chai Wan, Eastern District",Information & Communication Technology,,2024-06-25 05:00:00,74758525,https://hk.jobsdb.com/job/74758525
Consumer and Market Insights Analyst,Meyer Manufacturing Co Ltd,2,False,Kwun Tong District,Marketing & Communications,,2024-07-16 05:00:00,77283541,https://hk.jobsdb.com/job/77283541
IT Specialist,Venchi HK Limited,3,False,"Wan Chai, Wan Chai District",Information & Communication Technology,,2024-07-13 05:00:00,77251852,https://hk.jobsdb.com/job/77251852
Systems Operator Trainee,Bangkok Bank Public Co Ltd,,False,"Central, Central and Western District",Information & Communication Technology,,2024-07-17 11:00:00,75705263,https://hk.jobsdb.com/job/75705263
Financial Graduate Trainee,Zillion Crew,2,True,"Quarry Bay, Eastern District",Banking & Financial Services,"$18,000 - $25,000 per month",2024-07-16 05:00:00,77279822,https://hk.jobsdb.com/job/77279822
Data Collection Executive (Grad Job),IPSOS,,True,"Hung Hom, Kowloon City District",Marketing & Communications,,2024-07-17 05:00:00,77309494,https://hk.jobsdb.com/job/77309494
Supervisor - Operations Department,Rentokil Initial Hong Kong Ltd,3,False,"Ngau Tau Kok, Kwun Tong District","Manufacturing, Transport & Logistics",,2024-07-13 05:00:00,77239651,https://hk.jobsdb.com/job/77239651
Analyst Programmer,Kintetsu World Express (HK) Limited,2,False,Kwun Tong District,Information & Communication Technology,,2024-07-13 05:00:00,77246949,https://hk.jobsdb.com/job/77246949
Senior Accounts Executive / Accounts Executive (Ecommerce),91App HK Limited,2,True,Kwun Tong District,"Advertising, Arts & Media",,2024-07-11 05:00:00,77177860,https://hk.jobsdb.com/job/77177860
宏利財富管理經理 Financial Services / Financial Consultant / ( 高才通 / 優才/ IANG ）,Manulife (International) Limited,,True,"Tsim Sha Tsui, Yau Tsim Mong District",Banking & Financial Services,"$30,000 - $45,000 per month",2024-07-15 05:00:00,77270494,https://hk.jobsdb.com/job/77270494
Associate Business Analyst (Software Development and Implementation),Million Tech Development Ltd,1,True,"Lai Chi Kok, Sham Shui Po District",Information & Communication Technology,,2024-06-25 05:00:00,76780956,https://hk.jobsdb.com/job/76780956
"Team Manager, Customer Care - Mox (5179)",Standard Chartered Bank,,True,"Quarry Bay, Eastern District",Banking & Financial Services,,2024-07-13 05:00:00,77248166,https://hk.jobsdb.com/job/77248166
Data Engineer,HG Innovation Limited,2,False,"Hung Hom, Kowloon City District",Information & Communication Technology,"$30,000 - $45,000 per month",2024-07-11 05:00:00,77168953,https://hk.jobsdb.com/job/77168953
(Senior) Merchandiser - Cleaning & Bathroom Products,Lidl & Kaufland Asia PTE. Limited,,False,"Kai Tak, Kowloon City District",Retail & Consumer Products,,2024-07-16 05:00:00,77293380,https://hk.jobsdb.com/job/77293380
"Manager, Cyber Security",Hong Kong Productivity Council,8,False,"Kowloon Tong, Kowloon City District",Information & Communication Technology,,2024-07-11 05:00:00,77172909,https://hk.jobsdb.com/job/77172909
Software Engineer I/II (Ref# IT/ft/24-04),HKU SPACE Po Leung Kuk Stanley Ho Community College,3,False,"Causeway Bay, Wan Chai District",Information & Communication Technology,,2024-07-16 05:00:00,77288146,https://hk.jobsdb.com/job/77288146
System Analyst,Hong Kong Baptist University,7,True,"Kowloon Tong, Kowloon City District",Information & Communication Technology,,2024-07-13 05:00:00,77249312,https://hk.jobsdb.com/job/77249312
Product Officer,Qupital Limited,1,False,"Lai Chi Kok, Sham Shui Po District",Banking & Financial Services,,2024-07-11 05:00:00,77180927,https://hk.jobsdb.com/job/77180927
Senior Analyst Programmer (AO-492-J),BOCI-Prudential Asset Management Ltd,5,True,Central and Western District,Information & Communication Technology,,2024-07-12 05:00:00,77200883,https://hk.jobsdb.com/job/77200883
Business Analyst/ Sales Operations Executive (Regional Exposure),Geek Plus International Company Limited,4,False,"Kwai Hing, Kwai Tsing District",Sales,,2024-07-07 05:00:00,77092980,https://hk.jobsdb.com/job/77092980
Data Analyst,Hong Kong Technology Venture Company Limited,0,True,"Tseung Kwan O, Sai Kung District",Information & Communication Technology,,2024-07-11 05:00:00,77170636,https://hk.jobsdb.com/job/77170636
Assistant Product Manager,HKT Consumer Business Group,5,True,"Quarry Bay, Eastern District",Information & Communication Technology,,2024-07-06 05:00:00,77075465,https://hk.jobsdb.com/job/77075465
"Analyst, Brand and Advertising",AXA Hong Kong,1,False,"Wong Chuk Hang, Southern District",Insurance & Superannuation,,2024-07-17 11:00:00,77336967,https://hk.jobsdb.com/job/77336967
Knowledge/Research Transformation Specialist,"Hong Kong Institute of Science & Innovation, Chinese Academy of Sciences Limited",,False,"Science Park, Tai Po District",Science & Technology,,2024-07-12 05:00:00,77215647,https://hk.jobsdb.com/job/77215647
Senior Product Specialist,HKT Consumer Business Group,3,False,"Quarry Bay, Eastern District",Information & Communication Technology,,2024-07-06 05:00:00,77075668,https://hk.jobsdb.com/job/77075668
"Assistant Manager, Life Business Solutions",Zurich Insurance (Hong Kong),5,False,"Quarry Bay, Eastern District",Information & Communication Technology,,2024-07-12 05:00:00,77218675,https://hk.jobsdb.com/job/77218675
Senior Product Specialist,HKT Consumer Business Group,3,False,"Quarry Bay, Eastern District",Information & Communication Technology,,2024-07-06 05:00:00,77075641,https://hk.jobsdb.com/job/77075641
Compliant Handling Officer - Mox (1910),Standard Chartered Bank,3,False,"Quarry Bay, Eastern District",Banking & Financial Services,,2024-07-11 05:00:00,77165767,https://hk.jobsdb.com/job/77165767
"Business analyst (Perm role, digital project, 25k-32k)",Linkers International Limited,2,False,"Kwun Tong, Kwun Tong District",Information & Communication Technology,"$20,000 - $30,000 per month",2024-07-05 05:00:00,77044413,https://hk.jobsdb.com/job/77044413
"Senior Manager, Underwriting at FuSure Reinsurance Company Limited",Jobsdb - SmartHire,8,False,"Tsim Sha Tsui, Yau Tsim Mong District",Insurance & Superannuation,,2024-07-12 05:00:00,77201015,https://hk.jobsdb.com/job/77201015
Business Analyst,HGC Global Communications Limited,2,False,"Tsing Yi, Kwai Tsing District",Information & Communication Technology,,2024-07-06 05:00:00,77067274,https://hk.jobsdb.com/job/77067274
Azure infra Analyst / IT Development Group / (WFH Policy),Yusen Logistics Global Management Limited,3,False,"Kwai Hing, Kwai Tsing District",Information & Communication Technology,,2024-07-17 18:00:00,76831058,https://hk.jobsdb.com/job/76831058
"Manager, Business Development – Smart Business Solutions",GS1 Hong Kong Limited,5,True,Wan Chai District,Sales,,2024-07-12 05:00:00,77217579,https://hk.jobsdb.com/job/77217579
"Assistant Manager, BUD Funding - One year Contract (Ref: TFD094/24, 9490)",Hong Kong Productivity Council,4,False,"Kowloon City, Kowloon City District",Banking & Financial Services,,2024-07-09 05:00:00,77121796,https://hk.jobsdb.com/job/77121796
Senior Research Analyst | Property,Trinity Search Limited,8,False,"Central, Central and Western District",Real Estate & Property,,2024-07-17 05:00:00,77315458,https://hk.jobsdb.com/job/77315458
金融分析崗,China Lounge Investments Ltd,,False,"Causeway Bay, Wan Chai District",Banking & Financial Services,,2024-07-09 05:00:00,77108719,https://hk.jobsdb.com/job/77108719
Innovation Business Specialist - New Acquisition,Hutchison Telecommunications (Hong Kong) Limited,3,False,"Tsing Yi, Kwai Tsing District",Marketing & Communications,,2024-07-06 05:00:00,77060381,https://hk.jobsdb.com/job/77060381
IT Project Manager,HGC Global Communications Limited,3,False,"Tsing Yi, Kwai Tsing District",Information & Communication Technology,,2024-07-12 05:00:00,74483721,https://hk.jobsdb.com/job/74483721
"Senior Business Analyst, Business Change & Re-engineering",Chubb Insurance Hong Kong Limited,4,False,"Quarry Bay, Eastern District",Information & Communication Technology,,2024-07-06 05:00:00,77077295,https://hk.jobsdb.com/job/77077295
Wealth Management Internship,AIA International Limited,,False,"Causeway Bay, Wan Chai District",Insurance & Superannuation,,2024-07-16 05:00:00,77289649,https://hk.jobsdb.com/job/77289649
Business Analyst (Finance Trading),JFE Consulting Limited,4,False,"Sheung Wan, Central and Western District",Banking & Financial Services,"$25,000 - $35,000 per month",2024-06-22 05:00:00,76734871,https://hk.jobsdb.com/job/76734871
"IT Project Manager - Data Migration Project - around HKD 70,000/ month",Techforce Group Limited,8,False,Central and Western District,Information & Communication Technology,"$60,000 - $75,000 per month",2024-07-16 05:00:00,77292479,https://hk.jobsdb.com/job/77292479
"Cargo Revenue Analyst, Planning, Analytics & Solutions",Cathay Pacific Airways Ltd,3,False,"Lantau Island, Islands District","Manufacturing, Transport & Logistics",,2024-07-12 05:00:00,77213948,https://hk.jobsdb.com/job/77213948
POS Technical Analyst – International Retailer – HKD30k - 40k/month + Bonus,David James Recruitment  China Limited,3,False,Central and Western District,Information & Communication Technology,"$30,000 - $40,000 per month",2024-07-13 05:00:00,77246114,https://hk.jobsdb.com/job/77246114
"Agency Strategy, Consultant",AIA Hong Kong,6,False,"Quarry Bay, Eastern District",Consulting & Strategy,,2024-07-04 05:00:00,77022148,https://hk.jobsdb.com/job/77022148
"Associate, Client Services, Private Banking",Standard Chartered Bank,,False,Central and Western District,Banking & Financial Services,,2024-07-13 05:00:00,77246450,https://hk.jobsdb.com/job/77246450
Digital Transformation Trainee,Ricoh Hong Kong Limited,,True,"Kowloon Bay, Kwun Tong District",Information & Communication Technology,,2024-07-14 05:00:00,77266543,https://hk.jobsdb.com/job/77266543
System Analyst (Core Banking),Chong Hing Bank Ltd,4,False,"Kowloon Bay, Kwun Tong District",Information & Communication Technology,,2024-07-13 05:00:00,77246451,https://hk.jobsdb.com/job/77246451
E-Commerce Officer,World-Link Logistics (Asia) Holding Limited,2,False,"Kowloon Bay, Kwun Tong District",Marketing & Communications,,2024-07-10 05:00:00,77143993,https://hk.jobsdb.com/job/77143993
Application Support Analyst,Excellent Management Limited,1,False,"Quarry Bay, Eastern District",Information & Communication Technology,,2024-07-16 05:00:00,77282655,https://hk.jobsdb.com/job/77282655
Scrum Master - Leading Insurance Company,TEKsystems,5,False,"Kwun Tong, Kwun Tong District",Information & Communication Technology,,2024-07-15 05:00:00,77268909,https://hk.jobsdb.com/job/77268909
(Senior) Credit Card Business Manager (Product Management),Bank of China (Hong Kong) Limited,3,False,"Sheung Wan, Central and Western District",Sales,,2024-07-11 05:00:00,77169165,https://hk.jobsdb.com/job/77169165
Technology - Business Analyst,Accenture Technology Solutions (HK) Ltd,2,False,Central and Western District,Information & Communication Technology,,2024-06-22 05:00:00,76746686,https://hk.jobsdb.com/job/76746686
Marine Claims Assistant/Executive at Andrew Liu & Co Ltd,Jobsdb - SmartHire,,False,"Wong Chuk Hang, Southern District",Insurance & Superannuation,,2024-07-13 05:00:00,77234795,https://hk.jobsdb.com/job/77234795
Associate Business Analyst - Multiple headcount (with WFH),TEKsystems,1,False,"Central, Central and Western District",Information & Communication Technology,"$20,000 - $30,000 per month",2024-06-22 05:00:00,76752637,https://hk.jobsdb.com/job/76752637
"Senior Manager, Product Management (Chemicals)",Goldfinity Company Limited,8,True,Hong Kong Island,Engineering,"$80,000 - $90,000 per month",2024-07-09 05:00:00,77110233,https://hk.jobsdb.com/job/77110233
Project Analyst,iFAST Financial (HK) Limited,1,False,"Tsim Sha Tsui, Yau Tsim Mong District",Information & Communication Technology,,2024-06-27 05:00:00,76842110,https://hk.jobsdb.com/job/76842110
Programmer/ Senior Programmer,Armitage Technologies Ltd,1,False,"Kwun Tong, Kwun Tong District",Information & Communication Technology,,2024-07-13 05:00:00,77252979,https://hk.jobsdb.com/job/77252979
Senior Business Analyst / Assistant Business Analyst,Hung Hing Printing Group Ltd,5,False,Sha Tin District,Information & Communication Technology,,2024-06-22 05:00:00,76747003,https://hk.jobsdb.com/job/76747003
IT Business Analyst – Agency Contractor,Chiyu Banking Corp Ltd,3,False,"Central, Central and Western District",Information & Communication Technology,,2024-07-06 05:00:00,77079762,https://hk.jobsdb.com/job/77079762
"Project Manager - Infrastructure ($60-70K), Fluent in English",Don Nelson Recruitment Limited,1,True,"Happy Valley, Wan Chai District",Information & Communication Technology,"$60,000 - $70,000 per month",2024-07-17 16:00:00,77348112,https://hk.jobsdb.com/job/77348112
"Senior Analyst, CDD Operations - Mox (4450)",Standard Chartered Bank,2,False,"Quarry Bay, Eastern District",Banking & Financial Services,,2024-07-03 05:00:00,76983978,https://hk.jobsdb.com/job/76983978
Consultant Trainee / Asset Management Consultant (Welcome Fresh Graduates),**Private,5,False,"Causeway Bay, Wan Chai District",Insurance & Superannuation,"$29,999 - $44,999 per month",2024-07-10 05:00:00,77143222,https://hk.jobsdb.com/job/77143222
Economics Analyst / Senior Economics Analyst (Hong Kong Market),Bank of China (Hong Kong) Limited,5,False,"Central, Central and Western District",Consulting & Strategy,,2024-07-14 05:00:00,77262239,https://hk.jobsdb.com/job/77262239
"Senior Analyst, Stakeholder Engagement",TransUnion Limited,1,False,"Tsim Sha Tsui, Yau Tsim Mong District",Administration & Office Support,,2024-07-04 05:00:00,77012599,https://hk.jobsdb.com/job/77012599
Senior Product Manager,Medico Group Limited,2,False,"Lai Chi Kok, Sham Shui Po District",Sales,,2024-07-10 05:00:00,77130940,https://hk.jobsdb.com/job/77130940
Economics Analyst / Senior Economics Analyst (Hong Kong Market),Bank of China (Hong Kong) Limited,5,False,"Central, Central and Western District",Banking & Financial Services,,2024-07-14 05:00:00,77262237,https://hk.jobsdb.com/job/77262237
Product Manager,Dextra Pacific Ltd,5,False,Wan Chai District,Sales,,2024-07-10 05:00:00,77133400,https://hk.jobsdb.com/job/77133400
"Associate Director, Portfolio Analytics & Monitoring",Standard Chartered Bank,,False,Central and Western District,Banking & Financial Services,,2024-07-05 05:00:00,77040237,https://hk.jobsdb.com/job/77040237
ETL Specialist / Senior Data Analyst,Excel Technology International (Hong Kong) Limited,,False,Hong Kong,Information & Communication Technology,,2024-07-16 05:00:00,77295653,https://hk.jobsdb.com/job/77295653
"Manager, Infrastructure & ServiceDesk, APAC",Vantage Data Centers Hong Kong Limited,4,True,"Hung Hom, Kowloon City District",Information & Communication Technology,,2024-07-12 05:00:00,77205609,https://hk.jobsdb.com/job/77205609
Sales Consultant / Business Development Executive,Infinity Technology Corporation Limited,,False,"Science Park, Tai Po District",Sales,,2024-07-13 05:00:00,77247702,https://hk.jobsdb.com/job/77247702
Business Analyst (APAC),Odoo HK Limited,1,True,"Sai Ying Pun, Central and Western District",Information & Communication Technology,"$25,000 - $34,999 per month",2024-07-06 05:00:00,76448811,https://hk.jobsdb.com/job/76448811
Analyst Programmer,Million Tech Development Ltd,,False,"Lai Chi Kok, Sham Shui Po District",Information & Communication Technology,,2024-07-13 05:00:00,77252673,https://hk.jobsdb.com/job/77252673
Assistant Cloud Product Manager,Asher Career Limited,5,False,Hong Kong Island,Information & Communication Technology,,2024-07-07 05:00:00,77096262,https://hk.jobsdb.com/job/77096262
Financial Analyst (FP&A) | MNC,Morgan Half International (Hong Kong) Limited,2,False,"Hung Hom, Kowloon City District",Accounting,"$35,000 - $40,000 per month",2024-07-14 05:00:00,77266477,https://hk.jobsdb.com/job/77266477
Deputy Project Manager – Digital Transformation (Ref: JD-DPM),Public Bank (Hong Kong) Ltd,7,True,Hong Kong,Banking & Financial Services,,2024-07-13 05:00:00,74481265,https://hk.jobsdb.com/job/74481265
Legal Counsel,Hypebeast Hong Kong Limited,3,False,"Sheung Wan, Central and Western District",Legal,,2024-07-12 05:00:00,77214132,https://hk.jobsdb.com/job/77214132
"Manager, Business Analytics",Bank of China (Hong Kong) Limited,5,False,Hong Kong,Information & Communication Technology,,2024-07-13 05:00:00,77239264,https://hk.jobsdb.com/job/77239264
(Senior) System Analyst - ERP Finance System,Swire Properties Limited 太古地產有限公司,5,True,"Quarry Bay, Eastern District",Information & Communication Technology,,2024-07-11 05:00:00,74711266,https://hk.jobsdb.com/job/74711266
Assistant Financial Planning and Analysis Manager (Retail/ FMCG),LG H&H HK Limited,4,False,"Causeway Bay, Wan Chai District",Accounting,,2024-07-09 05:00:00,77122505,https://hk.jobsdb.com/job/77122505
Senior Customer Intelligence Specialist (Permanent/ 2-Year Contract),CLP Power Hong Kong Limited 中華電力有限公司,5,False,"Sham Shui Po, Sham Shui Po District",Consulting & Strategy,,2024-07-16 05:00:00,77273829,https://hk.jobsdb.com/job/77273829
"Assistant Manager - SAP SD/MM, Information and Technology Transformation",Shiseido Hong Kong Limited,3,False,"Kowloon Bay, Kwun Tong District",Information & Communication Technology,,2024-07-17 05:00:00,77314656,https://hk.jobsdb.com/job/77314656
"Manager, Digital Solutions",METRO Sourcing International Limited,2,False,"Kowloon Bay, Kwun Tong District",Information & Communication Technology,,2024-07-09 05:00:00,77111978,https://hk.jobsdb.com/job/77111978
"Manager, Distribution-Property & Casualty",Liberty International Insurance Limited,8,False,"Quarry Bay, Eastern District",Insurance & Superannuation,,2024-07-12 05:00:00,77199695,https://hk.jobsdb.com/job/77199695
Project Coordinator / Admin ($25-28K),Don Nelson Recruitment Limited,3,False,"Happy Valley, Wan Chai District",Administration & Office Support,"$22,000 - $28,000 per month",2024-07-17 18:00:00,77352955,https://hk.jobsdb.com/job/77352955
Graduate Trainee 專才發展計劃 ( Mainland graduates entilted to IANG),AIA International Limited,,True,"Fortress Hill, Eastern District",Banking & Financial Services,,2024-07-09 05:00:00,77123712,https://hk.jobsdb.com/job/77123712
Business Analyst,m-FINANCE Limited,4,False,Wan Chai District,Information & Communication Technology,,2024-06-21 05:00:00,76717243,https://hk.jobsdb.com/job/76717243
Business Development Manager,Zhiyuan International Business Limited,1,False,Central and Western District,Sales,"$35,000 - $45,000 per month",2024-07-12 05:00:00,77052212,https://hk.jobsdb.com/job/77052212
"AIA Business Management Intern, Financial Planning (畢業生優先 /無相關經驗要求)",AIA International Limited,,False,"Causeway Bay, Wan Chai District",Banking & Financial Services,"$39,999 - $59,999 per month",2024-07-09 05:00:00,77109026,https://hk.jobsdb.com/job/77109026
Senior Financial Analyst,Hang Lung Properties Limited,,False,"Central, Central and Western District",Accounting,,2024-07-13 05:00:00,72762416,https://hk.jobsdb.com/job/72762416
Technical Support (IT Department),Kintetsu World Express (HK) Limited,1,True,Kwai Tsing District,Information & Communication Technology,,2024-07-13 05:00:00,77247368,https://hk.jobsdb.com/job/77247368
.Net System Analyst,Automated Systems (HK) Ltd,4,False,Sha Tin District,Information & Communication Technology,,2024-07-17 05:00:00,75426214,https://hk.jobsdb.com/job/75426214
AVP - Financial Planning & Analysis (FP&A) - Corporate Banking,BDO Financial Services Limited,5,False,"Quarry Bay, Eastern District",Accounting,"$55,000 - $65,000 per month",2024-07-17 05:00:00,77313261,https://hk.jobsdb.com/job/77313261
Project Manager/Assistant Project Manager (Workplace Project) (Expanding team),CBRE Limited,5,False,"Mong Kok, Yau Tsim Mong District",Engineering,,2024-07-05 05:00:00,77045064,https://hk.jobsdb.com/job/77045064
Data Engineer (Informatica),CXC Global Hong Kong Limited,3,False,Hong Kong Island,Information & Communication Technology,,2024-07-11 05:00:00,77183920,https://hk.jobsdb.com/job/77183920
Economics Analyst / Senior Economics Analyst (Hong Kong Market),Bank of China (Hong Kong) Limited,5,False,"Central, Central and Western District",Consulting & Strategy,,2024-07-14 05:00:00,77262238,https://hk.jobsdb.com/job/77262238
Project Manager - IT Project,Nexify Limited,8,False,Kwun Tong District,Information & Communication Technology,,2024-07-13 05:00:00,77240832,https://hk.jobsdb.com/job/77240832
Business Analyst / IT Development Group / (WFH Policy) Ref: SPDD,Yusen Logistics Global Management Limited,3,False,"Kwai Hing, Kwai Tsing District",Information & Communication Technology,,2024-06-21 05:00:00,76055473,https://hk.jobsdb.com/job/76055473
Consultant Internship/ Trainee/ Asset Management Consultant (Fresh Graduates...,AIA International Limited,1,True,"Causeway Bay, Wan Chai District",Banking & Financial Services,,2024-07-11 05:00:00,77184002,https://hk.jobsdb.com/job/77184002
Business Analyst- Banking Industry- 20-28k,Ambition,,False,Central and Western District,Information & Communication Technology,,2024-07-05 05:00:00,77045541,https://hk.jobsdb.com/job/77045541
Assistant Business Analyst / IT Development Group / (WFH Policy) (Ref: GISS),Yusen Logistics Global Management Limited,1,False,"Kwai Hing, Kwai Tsing District",Information & Communication Technology,,2024-06-21 05:00:00,76058768,https://hk.jobsdb.com/job/76058768
Assistant Merchandise Planning Analyst,G2000 (Apparel) Ltd,1,True,"Kwai Fong, Kwai Tsing District",Retail & Consumer Products,,2024-07-13 05:00:00,77250153,https://hk.jobsdb.com/job/77250153
Business Development Associate,CLO Virtual Fashion HK Limited,,False,Hong Kong Island,Sales,,2024-07-06 05:00:00,77068997,https://hk.jobsdb.com/job/77068997
Business Analyst / Senior Business Analyst / Project Manager,Quam Securities Limited,2,True,"Sheung Wan, Central and Western District",Information & Communication Technology,,2024-07-06 05:00:00,77062658,https://hk.jobsdb.com/job/77062658
Assistant Project Manager (Microsoft Power Platform),Uni-China (Business) Management Limited,5,True,"Tsim Sha Tsui, Yau Tsim Mong District",Information & Communication Technology,,2024-06-28 05:00:00,76860609,https://hk.jobsdb.com/job/76860609
IT Business Analyst,SmarTone Telecommunications Limited,4,False,"Kwun Tong, Kwun Tong District",Information & Communication Technology,,2024-07-05 05:00:00,77037138,https://hk.jobsdb.com/job/77037138
SEM Specialist,Perfect Health Clinic Limited,2,False,"Mong Kok, Yau Tsim Mong District","Advertising, Arts & Media",,2024-07-11 05:00:00,77171391,https://hk.jobsdb.com/job/77171391
