Business Analyst and Problem Solver (Cantonese not required),Linjer Limited,,True,Hong Kong Island,Consulting & Strategy,"$20,000 - $30,000 per month",2024-07-11 04:00:00,77173898,https://hk.jobsdb.com/job/77173898
Electronic Trading – Application Support,Jobsdb - SmartHire,1,False,"Central, Central and Western District",Information & Communication Technology,,2024-07-17 04:00:00,76949317,https://hk.jobsdb.com/job/76949317
Assistant / Manager - Data Core Network,Hutchison Telecommunications (Hong Kong) Limited,1,True,"Tsing Yi, Kwai Tsing District",Information & Communication Technology,,2024-07-05 04:00:00,77043162,https://hk.jobsdb.com/job/77043162
MULTI-ASSET ANALYST,Recruitment Intelligence Consultants Ltd,,False,Central and Western District,Banking & Financial Services,,2024-07-17 04:00:00,76218926,https://hk.jobsdb.com/job/76218926
"Analyst, Business Intelligence",United Asia Finance Limited,,False,"Wan Chai, Wan Chai District",Information & Communication Technology,,2024-07-04 04:00:00,77005531,https://hk.jobsdb.com/job/77005531
Application Architect (SAP CRM & Services),ASMPT Technology Hong Kong Limited,2,True,"Tsing Yi, Kwai Tsing District",Information & Communication Technology,,2024-07-13 04:00:00,77250487,https://hk.jobsdb.com/job/77250487
CRM Manager,Wai Yuen Tong Medicine Co Ltd,8,False,"Kowloon Bay, Kwun Tong District",Marketing & Communications,,2024-07-10 04:00:00,77133417,https://hk.jobsdb.com/job/77133417
Head - Risk Management & Business Intelligence (2M+),Pure Search International Limited,1,False,Kowloon,Accounting,,2024-07-17 14:00:00,77343898,https://hk.jobsdb.com/job/77343898
System Developer (IT) at Dealer Send Logistics Limited,Jobsdb - SmartHire,,True,Tsuen Wan District,Information & Communication Technology,,2024-07-17 04:00:00,76860828,https://hk.jobsdb.com/job/76860828
Business Support Executive (Native Korean Speaker),Cashing Pro Limited,3,False,"Tsim Sha Tsui, Yau Tsim Mong District",Administration & Office Support,,2024-07-16 04:00:00,77293710,https://hk.jobsdb.com/job/77293710
Product Analyst – Wealth Research,"Guosen Securities (HK) Financial Holdings Company, Limited",1,True,"Admiralty, Central and Western District",Banking & Financial Services,,2024-07-16 04:00:00,77291520,https://hk.jobsdb.com/job/77291520
Marketing Officer / Senior Marketing Officer,Ballyhoo Limited,3,False,"Fo Tan, Sha Tin District",Marketing & Communications,,2024-07-16 04:00:00,77292050,https://hk.jobsdb.com/job/77292050
Junior Business Analyst - Business Solutions,B.S.C. Group Limited,1,False,"Chai Wan, Eastern District",Information & Communication Technology,,2024-07-12 04:00:00,77142653,https://hk.jobsdb.com/job/77142653
Associate/ Senior Associate  (Project Management),Jobsdb - SmartHire,1,True,"Central, Central and Western District",Sales,,2024-07-17 04:00:00,77045901,https://hk.jobsdb.com/job/77045901
"Senior Analyst, Cyber Security",Hong Kong Productivity Council,2,False,"Kowloon Tong, Kowloon City District",Information & Communication Technology,,2024-07-12 04:00:00,77213696,https://hk.jobsdb.com/job/77213696
Business Analyst,Total Ticketing Limited,,False,"Sheung Wan, Central and Western District",Information & Communication Technology,,2024-07-13 04:00:00,77250074,https://hk.jobsdb.com/job/77250074
Data Scientist (Computer Science or Equivalent) (Level 2-5) (Good Bonus),Risksis Technology Limited,,False,Hong Kong,Information & Communication Technology,,2024-06-30 04:00:00,76927720,https://hk.jobsdb.com/job/76927720
Senior Analyst,DFI Development (HK) Limited,2,False,"Quarry Bay, Eastern District",Consulting & Strategy,,2024-07-12 04:00:00,76256784,https://hk.jobsdb.com/job/76256784
Financial Analyst Consultant  (Welcome Fresh graduates/IANG),**Private,,True,Eastern District,Consulting & Strategy,,2024-07-06 04:00:00,77075819,https://hk.jobsdb.com/job/77075819
Knowledge/Research Transformation Specialist,"Hong Kong Institute of Science & Innovation, Chinese Academy of Sciences Limited",,False,"Science Park, Tai Po District",Science & Technology,,2024-07-12 04:00:00,77215647,https://hk.jobsdb.com/job/77215647
"Insurance Business Analyst (AM/M, User Side - Policy Administration)",Cornerstone Global Partners,,False,Hong Kong Island,Information & Communication Technology,"$40,000 - $60,000 per month",2024-07-05 04:00:00,77040638,https://hk.jobsdb.com/job/77040638
"Senior Data Analyst, FinTech",Zero Finance Hong Kong Limited,,False,"Sheung Wan, Central and Western District",Banking & Financial Services,,2024-07-05 04:00:00,77035578,https://hk.jobsdb.com/job/77035578
金融分析崗實習生,China Lounge Investments Ltd,,False,"Causeway Bay, Wan Chai District",Trades & Services,,2024-07-09 04:00:00,77108663,https://hk.jobsdb.com/job/77108663
Business System Analyst / IT Development Group / (WFH Policy),Yusen Logistics Global Management Limited,5,False,"Kwai Hing, Kwai Tsing District",Information & Communication Technology,,2024-07-17 19:00:00,76900059,https://hk.jobsdb.com/job/76900059
Analyst Programmer / Programmer (Web/ Mobile) at A&A Limited,Jobsdb - SmartHire,3,False,"Kwun Tong, Kwun Tong District",Information & Communication Technology,,2024-07-17 04:00:00,77007763,https://hk.jobsdb.com/job/77007763
"Manager, Business Analytics",Bank of China (Hong Kong) Limited,5,False,Hong Kong,Information & Communication Technology,,2024-07-13 04:00:00,77239264,https://hk.jobsdb.com/job/77239264
Business Analyst,Shiji Information Technology (Hong Kong) Limited,2,False,"Kwun Tong, Kwun Tong District",Information & Communication Technology,,2024-07-13 04:00:00,77243662,https://hk.jobsdb.com/job/77243662
Senior / Marketing Executive (Retention Team - Consumer Marketing),Hutchison Telecommunications (Hong Kong) Limited,3,True,"Tsing Yi, Kwai Tsing District",Marketing & Communications,,2024-07-06 04:00:00,77060551,https://hk.jobsdb.com/job/77060551
Financial Consultant (Welcome graduates/experienced),Prudential Hong Kong Limited,,False,"Tsim Sha Tsui, Yau Tsim Mong District",Banking & Financial Services,"$40,000 - $60,000 per month",2024-07-15 04:00:00,77270858,https://hk.jobsdb.com/job/77270858
Senior Scientist,"Innorna (HK) Co., Limited",,False,Tai Po District,Science & Technology,"$35,000 - $45,000 per month",2024-07-17 15:00:00,77309068,https://hk.jobsdb.com/job/77309068
Group Own Brand Supply & Demand Planner,DFI Development (HK) Limited,3,False,"Quarry Bay, Eastern District","Manufacturing, Transport & Logistics",,2024-07-11 04:00:00,77179212,https://hk.jobsdb.com/job/77179212
Non-financial Due Diligence Analyst and Investigator - Trainee,Total Credit Management Services Hong Kong Limited,,False,"Ngau Tau Kok, Kwun Tong District",Banking & Financial Services,"$15,000 - $18,000 per month",2024-07-09 04:00:00,77114178,https://hk.jobsdb.com/job/77114178
Business Analyst,HGC Global Communications Limited,5,False,"Tsing Yi, Kwai Tsing District",Information & Communication Technology,,2024-07-13 04:00:00,76434235,https://hk.jobsdb.com/job/76434235
"Senior Officer, Business Development",Sun Life Hong Kong Ltd,2,False,"Hung Hom, Kowloon City District",Sales,,2024-07-16 04:00:00,77286864,https://hk.jobsdb.com/job/77286864
"Associate Director, Portfolio Analytics & Monitoring",Standard Chartered Bank,,False,Central and Western District,Banking & Financial Services,,2024-07-05 04:00:00,77040237,https://hk.jobsdb.com/job/77040237
Insurer - Broker Channel Operation AM | Visio | Privot | Data Analysis,Cornerstone Global Partners,,False,"Quarry Bay, Eastern District",Insurance & Superannuation,"$36,000 - $45,000 per month",2024-07-10 04:00:00,77155033,https://hk.jobsdb.com/job/77155033
APS Global Prime Finance Incident Manager,Jobsdb - SmartHire,5,False,"Central, Central and Western District",Information & Communication Technology,,2024-07-17 04:00:00,76948665,https://hk.jobsdb.com/job/76948665
"Fixed Income Analyst(Senior Officer to Assistant Manager), Global Markets",Industrial and Commercial Bank of China (Asia) Limited,5,False,"Central, Central and Western District",Banking & Financial Services,,2024-07-10 04:00:00,77136482,https://hk.jobsdb.com/job/77136482
Data Analyst (CRM & Marketing) (exp in adobe & google analytics),Manpower Services (Hong Kong) Limited,2,False,"Tseung Kwan O, Sai Kung District",Information & Communication Technology,,2024-06-29 04:00:00,76909034,https://hk.jobsdb.com/job/76909034
"Policy Analyst – Policy, Registration and Oversight",Accounting and Financial Reporting Council,5,False,"Quarry Bay, Eastern District",Accounting,,2024-07-17 04:00:00,77318794,https://hk.jobsdb.com/job/77318794
AI Speech Recognition Engineer (Computer Science or Equivalent),Risksis Technology Limited,,False,Hong Kong,Information & Communication Technology,,2024-07-06 04:00:00,77086586,https://hk.jobsdb.com/job/77086586
System Analyst (Mobile),Green Tomato Limited,6,False,"Kowloon Bay, Kwun Tong District",Information & Communication Technology,,2024-07-10 04:00:00,77150920,https://hk.jobsdb.com/job/77150920
DATA ANALYST,Sun Hung Kai Properties Ltd,4,False,"Wan Chai, Wan Chai District",Marketing & Communications,,2024-06-29 04:00:00,76912712,https://hk.jobsdb.com/job/76912712
Business Analyst - Banking Projects (Five day work weeks),Excel Technology International (Hong Kong) Limited,,False,Hong Kong,Banking & Financial Services,,2024-07-16 04:00:00,77295414,https://hk.jobsdb.com/job/77295414
"Data Analyst (BI, Data Modelling) - HK Listed MNC",Charterhouse Limited,1,False,Central and Western District,Science & Technology,,2024-06-29 04:00:00,76895833,https://hk.jobsdb.com/job/76895833
Tax - APTC - Tax Technology and Transformation (AI & Data) - Senior/Manager - HK,EY,,False,"Quarry Bay, Eastern District",Accounting,,2024-06-29 04:00:00,76895816,https://hk.jobsdb.com/job/76895816
"Assistant Manager, Commercial Strategy - Sales Data & Analysis",CHOW TAI FOOK JEWELLERY CO LTD,3,False,Kwai Tsing District,Retail & Consumer Products,,2024-07-10 04:00:00,77138896,https://hk.jobsdb.com/job/77138896
Technology – ERP/ CRM Business Analyst,Accenture Technology Solutions (HK) Ltd,2,False,Kowloon,Information & Communication Technology,,2024-07-03 04:00:00,76970235,https://hk.jobsdb.com/job/76970235
"Manager, Deposit & Mrtg Performance Mgt (2341)",Standard Chartered Bank,,False,Kwun Tong District,Banking & Financial Services,,2024-07-12 04:00:00,77202411,https://hk.jobsdb.com/job/77202411
Associate Data Consultant,Kepro Solutions Limited,1,False,"Kwun Tong, Kwun Tong District",Information & Communication Technology,,2024-07-13 04:00:00,77248928,https://hk.jobsdb.com/job/77248928
Business Intelligence Engineer,Taste of Asia Group Limited,1,False,"Diamond Hill, Wong Tai Sin District",Information & Communication Technology,,2024-07-05 04:00:00,77036945,https://hk.jobsdb.com/job/77036945
"Head of Data, Director- Financial Services",Captar Partners Limited,1,False,Hong Kong Island,Information & Communication Technology,HKD 1800000 - 2200000 per annum,2024-07-17 12:00:00,77338283,https://hk.jobsdb.com/job/77338283
Consulting - Financial Services - Finance - Senior Consultant/Manager,EY,5,False,Hong Kong Island,Accounting,,2024-07-13 04:00:00,77252589,https://hk.jobsdb.com/job/77252589
Assistant Business Analyst / Business Analyst,AAStocks.com Limited,1,False,"Kwun Tong, Kwun Tong District",Information & Communication Technology,,2024-07-13 04:00:00,77252515,https://hk.jobsdb.com/job/77252515
Fixed Income Analyst,iFAST Financial (HK) Limited,1,True,"Tsim Sha Tsui, Yau Tsim Mong District",Banking & Financial Services,,2024-07-17 04:00:00,76801673,https://hk.jobsdb.com/job/76801673
"Finance Analyst/ Accounting Officer (20-26K, 5-day work)",Nesta (Hong Kong) Limited,1,False,"Central, Central and Western District",Accounting,,2024-07-17 17:00:00,77349397,https://hk.jobsdb.com/job/77349397
Associate Director - Quantitative Risk Management (Top tier FI),Michael Page International (HK) Ltd,6,False,Central and Western District,Banking & Financial Services,$600k - $840k p.a. + gratuity bonus,2024-07-17 19:00:00,77353054,https://hk.jobsdb.com/job/77353054
Business Analyst,ParaDM Company Limited,2,False,Kwun Tong District,Information & Communication Technology,,2024-07-12 04:00:00,75548439,https://hk.jobsdb.com/job/75548439
"Data Architect , In house + Listed company",CKC Solutions Limited,5,False,Tsuen Wan District,Information & Communication Technology,,2024-07-16 04:00:00,77285776,https://hk.jobsdb.com/job/77285776
Graduate Trainees (multiple headcounts),CatoMind Limited,,False,Kwun Tong District,Information & Communication Technology,,2024-07-07 04:00:00,77096323,https://hk.jobsdb.com/job/77096323
"(HK$48-60K+ monthly) Senior Analyst, Researcher, Financial Services",TierONE Consultants,,False,"Central, Central and Western District",Information & Communication Technology,"$45,000 - $60,000 per month",2024-07-17 04:00:00,77316476,https://hk.jobsdb.com/job/77316476
Data Scientist (GenAI) - Fintech,Michael Page International (HK) Ltd,,False,Central and Western District,Information & Communication Technology,*12 + b,2024-07-13 04:00:00,77249624,https://hk.jobsdb.com/job/77249624
"SEO Expert / SEO Architect / Head of SEO / SEO Manager(5-Days Work, Bonus)",Magic Compass Securities Limited,5,False,"Wan Chai, Wan Chai District",Marketing & Communications,,2024-07-10 04:00:00,77137056,https://hk.jobsdb.com/job/77137056
"Business Analyst, Application System Team (5 days)",Delken Group Limited,5,True,"Kwun Tong, Kwun Tong District",Information & Communication Technology,,2024-06-28 04:00:00,76864431,https://hk.jobsdb.com/job/76864431
"Senior Consultant / Consultant, Data Engineer, Technology Enablement (MJ003358)",KPMG,1,False,"Wong Chuk Hang, Southern District",Information & Communication Technology,,2024-07-13 04:00:00,74521875,https://hk.jobsdb.com/job/74521875
"Specialist, Data Analytics",Hong Kong Express Airways Limited,2,False,"Airport Area, Islands District",Information & Communication Technology,,2024-07-03 04:00:00,76971406,https://hk.jobsdb.com/job/76971406
"Manager to SM, SME Business (Marketing)",Industrial and Commercial Bank of China (Asia) Limited,3,False,"Kwun Tong, Kwun Tong District",Banking & Financial Services,,2024-07-16 04:00:00,77283647,https://hk.jobsdb.com/job/77283647
Data Architect (Big Data&Azure Cloud) ~60K,KOS International Limited,4,False,Kwai Tsing District,Information & Communication Technology,Discretionary Bonus,2024-07-16 04:00:00,77278630,https://hk.jobsdb.com/job/77278630
Facility Manager / Assistant Facility Manager (Data Centre),OneAsia Network Limited,5,False,"Kowloon Bay, Kwun Tong District",Engineering,,2024-07-17 16:00:00,76883345,https://hk.jobsdb.com/job/76883345
"IT Project Manager - Data Migration Project - around HKD 70,000/ month",Techforce Group Limited,8,False,Central and Western District,Information & Communication Technology,"$60,000 - $75,000 per month",2024-07-16 04:00:00,77292479,https://hk.jobsdb.com/job/77292479
"Event Manager (Fintech Firm, Event Marketing, 50K, PERM)",Recruit Logic Limited,6,True,"Wan Chai, Wan Chai District",Marketing & Communications,,2024-07-16 04:00:00,77276213,https://hk.jobsdb.com/job/77276213
Business Analyst - Insurance,Captar Partners Limited,3,False,Central and Western District,Information & Communication Technology,HKD 550000 - 700000 per annum,2024-07-17 04:00:00,77310187,https://hk.jobsdb.com/job/77310187
Sales and Marketing Executive (Premium Gifts Specialist & Event Management),Reliable Partner Company Limited,,False,Kwun Tong District,Sales,"$220,000 - $330,000 per year",2024-07-16 04:00:00,77277943,https://hk.jobsdb.com/job/77277943
"Senior Consultant, Intelligent Manufacturing",Hong Kong Productivity Council,1,True,"Kowloon Tong, Kowloon City District",Engineering,,2024-07-04 04:00:00,77007424,https://hk.jobsdb.com/job/77007424
"Manager, Programme Management (Funding Scheme Branch)",Hong Kong Productivity Council,5,False,Hong Kong,Government & Defence,,2024-07-09 04:00:00,77120430,https://hk.jobsdb.com/job/77120430
"Data Analyst (Operation), Double Pay, MNC, Reporting",Manpower Services (Hong Kong) Limited,3,False,"Tsing Yi, Kwai Tsing District",Information & Communication Technology,,2024-06-28 04:00:00,76879769,https://hk.jobsdb.com/job/76879769
"AI Growth/AI Application Expert/AI Scientist/AI Programmer(5-Days Work, Bonus)",Magic Compass Securities Limited,3,False,"Wan Chai, Wan Chai District",Information & Communication Technology,,2024-07-04 04:00:00,77006056,https://hk.jobsdb.com/job/77006056
(UP to 50K) Senior Business Analyst / UAT Officer (Banking and Insurance),Seamatch Asia Limited,3,True,"Central, Central and Western District",Information & Communication Technology,,2024-07-17 04:00:00,77304224,https://hk.jobsdb.com/job/77304224
Internal Audit Manager,Coper Pioneers Technology Limited,3,False,New Territories,Accounting,,2024-07-16 04:00:00,77292416,https://hk.jobsdb.com/job/77292416
ESG - Analyst/Senior Analyst/Assistant Manager,PAL ADVISORY LIMITED,1,False,"Tsim Sha Tsui, Yau Tsim Mong District",Information & Communication Technology,,2024-07-17 04:00:00,77319179,https://hk.jobsdb.com/job/77319179
"Senior Manager, Marketing and CRM",Hong Kong Productivity Council,,True,"Kowloon Tong, Kowloon City District",Marketing & Communications,,2024-07-11 04:00:00,77180375,https://hk.jobsdb.com/job/77180375
Ecommerce Specialist,OHLA! Luxury,,False,"Tsim Sha Tsui, Yau Tsim Mong District",Retail & Consumer Products,,2024-07-13 04:00:00,77242405,https://hk.jobsdb.com/job/77242405
Financial Analyst,Citistore (Hong Kong) Limited,4,False,Tsuen Wan District,Accounting,,2024-07-17 04:00:00,77309303,https://hk.jobsdb.com/job/77309303
Data Center Senior Electricity Engineer,China Comservice (Hong Kong) Limited,3,False,"Tsim Sha Tsui, Yau Tsim Mong District",Engineering,,2024-07-13 04:00:00,77250044,https://hk.jobsdb.com/job/77250044
Senior Data Analyst,Michael Page International (HK) Ltd,5,False,Central and Western District,Information & Communication Technology,*13 +b,2024-07-04 04:00:00,77019637,https://hk.jobsdb.com/job/77019637
"AVP, MRPA - Planning and Reporting",OCBC Bank (Hong Kong) Limited,5,True,"Central, Central and Western District",Banking & Financial Services,,2024-07-17 04:00:00,77316573,https://hk.jobsdb.com/job/77316573
Innovation Business Specialist - New Acquisition,Hutchison Telecommunications (Hong Kong) Limited,3,False,"Tsing Yi, Kwai Tsing District",Marketing & Communications,,2024-07-06 04:00:00,77060381,https://hk.jobsdb.com/job/77060381
"Manager/AVP, Data Management",China Construction Bank (Asia) Corporation Limited,3,False,"Kowloon Bay, Kwun Tong District",Banking & Financial Services,,2024-07-13 04:00:00,77240048,https://hk.jobsdb.com/job/77240048
Senior Analyst Programmer (AO-492-J),BOCI-Prudential Asset Management Ltd,5,True,Central and Western District,Information & Communication Technology,,2024-07-12 04:00:00,77200883,https://hk.jobsdb.com/job/77200883
Economics Analyst / Senior Economics Analyst (Hong Kong Market),Bank of China (Hong Kong) Limited,5,False,"Central, Central and Western District",Banking & Financial Services,,2024-07-14 04:00:00,77262237,https://hk.jobsdb.com/job/77262237
"Marketing Manager (OTT & PayTV Business, Retention Sales & Digital Marketing)",HKT Consumer Business Group,5,False,"Quarry Bay, Eastern District",Marketing & Communications,,2024-07-10 04:00:00,77137929,https://hk.jobsdb.com/job/77137929
Management Associate - Enforcement (Data Analytics - Strategy and Technology),Securities and Futures Commission,,False,"Quarry Bay, Eastern District",Banking & Financial Services,,2024-07-03 04:00:00,76984267,https://hk.jobsdb.com/job/76984267
Power BI Developer,Staff Management Consultancy Limited,,True,Kowloon,Information & Communication Technology,,2024-07-12 04:00:00,77212922,https://hk.jobsdb.com/job/77212922
CBS - Finance - Financial Management - Senior Associate - Hong Kong,EY,2,False,"Quarry Bay, Eastern District",Accounting,,2024-07-09 04:00:00,77116137,https://hk.jobsdb.com/job/77116137
Economics Analyst / Senior Economics Analyst (Hong Kong Market),Bank of China (Hong Kong) Limited,5,False,"Central, Central and Western District",Consulting & Strategy,,2024-07-14 04:00:00,77262239,https://hk.jobsdb.com/job/77262239
Data Center Operator,Orient Overseas Container Line Ltd (OOCL),1,True,"Science Park, Tai Po District",Information & Communication Technology,,2024-07-17 09:00:00,75660785,https://hk.jobsdb.com/job/75660785
"AVP/ Associate, Remittance - Approver/ Checker",Morgan Mckinley Limited,7,False,Central and Western District,Banking & Financial Services,,2024-07-13 04:00:00,77233570,https://hk.jobsdb.com/job/77233570
Business Analyst - Cargo Distribution (5-Day Work),Global Logistics System (HK) Co Ltd,,False,"Airport Area, Islands District",Information & Communication Technology,,2024-07-13 04:00:00,77240423,https://hk.jobsdb.com/job/77240423
Database Administrator ( RDBMS + Big data ),Expert Systems Limited,7,False,"Kwun Tong, Kwun Tong District",Information & Communication Technology,,2024-07-09 04:00:00,77123418,https://hk.jobsdb.com/job/77123418
System Analyst,Solution Expert Technology Limited,,False,"Kwai Hing, Kwai Tsing District",Information & Communication Technology,,2024-07-17 04:00:00,77305164,https://hk.jobsdb.com/job/77305164
Actuarial Analyst - HSBC Life,HSBC,,False,Central and Western District,Insurance & Superannuation,,2024-07-04 04:00:00,77008765,https://hk.jobsdb.com/job/77008765
Risk Manager (Risk Portfolio Analytics) - Risk Analytics & Governance,"The Bank of East Asia, Limited",,False,"Kwun Tong, Kwun Tong District",Banking & Financial Services,,2024-07-17 04:00:00,77306521,https://hk.jobsdb.com/job/77306521
AIA Wealth Management Manager  (Local/ IANG...,King Fung & Co.,3,False,"Tsim Sha Tsui, Yau Tsim Mong District",Banking & Financial Services,"$25,000 - $34,999 per month",2024-07-10 04:00:00,77151950,https://hk.jobsdb.com/job/77151950
Senior Logistics Executive (1-year contract),Pernod Ricard Hong Kong Ltd,5,False,"Tsim Sha Tsui, Yau Tsim Mong District","Manufacturing, Transport & Logistics",,2024-07-03 04:00:00,76978803,https://hk.jobsdb.com/job/76978803
Economics Analyst / Senior Economics Analyst (Hong Kong Market),Bank of China (Hong Kong) Limited,5,False,"Central, Central and Western District",Consulting & Strategy,,2024-07-14 04:00:00,77262238,https://hk.jobsdb.com/job/77262238
"Director, Project Keystone, V & V (3564)",Standard Chartered Bank,,False,Kwun Tong District,Banking & Financial Services,,2024-07-12 04:00:00,77203358,https://hk.jobsdb.com/job/77203358
AI Developer (M/BDO4-PU),Robert Bosch Co Ltd,3,False,Hong Kong Island,Information & Communication Technology,,2024-07-17 16:00:00,77348417,https://hk.jobsdb.com/job/77348417
Derivatives Trading – Analyst/Associate,XJCP Limited,2,False,"Causeway Bay, Wan Chai District",Banking & Financial Services,,2024-07-17 04:00:00,77316334,https://hk.jobsdb.com/job/77316334
Technical Representative-Life Insurance Brokerage,水滴金融服务（香港）有限公司,,False,"Tsim Sha Tsui, Yau Tsim Mong District",Insurance & Superannuation,,2024-07-13 04:00:00,77251227,https://hk.jobsdb.com/job/77251227
"Senior Consultant, Energy Management",Hong Kong Productivity Council,5,False,"Kowloon Tong, Kowloon City District",Consulting & Strategy,,2024-07-11 04:00:00,77166999,https://hk.jobsdb.com/job/77166999
Head of Operations,**Private,1,False,"Tsim Sha Tsui, Yau Tsim Mong District",Hospitality & Tourism,,2024-07-16 04:00:00,77292428,https://hk.jobsdb.com/job/77292428
"Assistant Statistical Analyst, HHB (contract-based; Up to 38K monthly)",Hitech Personnel Agency Co Ltd,,False,"Kwun Tong, Kwun Tong District",Government & Defence,,2024-07-12 04:00:00,77208299,https://hk.jobsdb.com/job/77208299
Senior Marketing Officer at Canmake Tokyo,Jobsdb - SmartHire,5,True,"Kwai Hing, Kwai Tsing District",Marketing & Communications,,2024-07-13 04:00:00,77239840,https://hk.jobsdb.com/job/77239840
Senior Analyst (Stocks/Futures/Forex) 高级分析师 (股票/期货/外汇),H&W Technology Service Limited,3,False,"Hung Hom, Kowloon City District",Banking & Financial Services,,2024-07-16 04:00:00,77283797,https://hk.jobsdb.com/job/77283797
Data Entry Clerk (SAP),Close to Clothes (Asia Pacific) Limited,,False,"Kwai Chung, Kwai Tsing District",Administration & Office Support,"$14,000 - $16,000 per month",2024-07-03 04:00:00,76982177,https://hk.jobsdb.com/job/76982177
Engineer- Incident & Change management  (Ref: JDB- QM),NTT Com Asia Limited,8,False,"Tseung Kwan O, Sai Kung District",Information & Communication Technology,,2024-07-12 04:00:00,77201318,https://hk.jobsdb.com/job/77201318
Customer Support Specialist at Brand ID (HK) Ltd,Jobsdb - SmartHire,,False,"Kwai Chung, Kwai Tsing District",Call Centre & Customer Service,,2024-07-11 04:00:00,77167509,https://hk.jobsdb.com/job/77167509
Assistant Business Analyst,BBMSL Limited,,True,Tsuen Wan District,Consulting & Strategy,,2024-07-12 04:00:00,77213263,https://hk.jobsdb.com/job/77213263
Digital Performance Specialist | Media Agency (Fresh Graduate Welcome),Fabcom Limited,,False,"Kowloon Bay, Kwun Tong District","Advertising, Arts & Media",,2024-07-09 04:00:00,77107624,https://hk.jobsdb.com/job/77107624
Research Assistant (Ref: DECS/RA/JDB),Haven of Hope Christian Service,,False,Hong Kong,Science & Technology,,2024-07-13 04:00:00,77234822,https://hk.jobsdb.com/job/77234822
Senior PMO,TEKsystems,5,False,Central and Western District,Information & Communication Technology,,2024-07-13 04:00:00,77249481,https://hk.jobsdb.com/job/77249481
Sr Digital Marketing Executive (Cross Border) (FMCG) – Welcome Guangdong Talents,Frieslandcampina (Hong Kong) Limited,3,False,"Mong Kok, Yau Tsim Mong District",Marketing & Communications,,2024-07-12 04:00:00,77205497,https://hk.jobsdb.com/job/77205497
金融分析崗,China Lounge Investments Ltd,,False,"Causeway Bay, Wan Chai District",Banking & Financial Services,,2024-07-09 04:00:00,77108719,https://hk.jobsdb.com/job/77108719
