System Analyst,Job-Hunter Employment Agency,5,False,"Tsim Sha Tsui, Yau Tsim Mong District",Information & Communication Technology,"$40,000 - $42,000 per month",2024-07-10 08:00:00,77154510,https://hk.jobsdb.com/job/77154510
"Research Associate Director, Economics",ConnectedGroup Limited,1,False,"Sheung Wan, Central and Western District",Consulting & Strategy,,2024-07-16 08:00:00,77284249,https://hk.jobsdb.com/job/77284249
Human Resources Manager (Recruitment),S.F. Express (Hong Kong) Ltd,8,False,"Tsing Yi, Kwai Tsing District",Human Resources & Recruitment,,2024-07-17 13:00:00,77342079,https://hk.jobsdb.com/job/77342079
"Business Analyst (Max 30K, fresh graduate welcomed)",Andrew Found Limited,1,True,Hong Kong,Information & Communication Technology,,2024-07-06 08:00:00,77075925,https://hk.jobsdb.com/job/77075925
"Senior Manager, Membership Intelligence & Analysis",The Hong Kong Jockey Club,1,True,"Causeway Bay, Wan Chai District",Consulting & Strategy,,2024-07-05 08:00:00,77048723,https://hk.jobsdb.com/job/77048723
Application Support Specialist,Shiji Information Technology (Hong Kong) Limited,3,False,"Kwun Tong, Kwun Tong District",Information & Communication Technology,,2024-07-13 08:00:00,77243438,https://hk.jobsdb.com/job/77243438
Consultant (Accident & Emergency),Hospital Authority,,False,"Kowloon City, Kowloon City District",Healthcare & Medical,,2024-07-17 20:00:00,77358912,https://hk.jobsdb.com/job/77358912
Research Assistant (Ref: CNRM2024-013),Center for Neuromusculoskeletal Restorative Medicine Limited,,False,Sha Tin District,Education & Training,,2024-07-17 08:00:00,77305899,https://hk.jobsdb.com/job/77305899
System Analyst / Analyst Programmer,Besway Asia Limited,2,False,"North Point, Eastern District",Information & Communication Technology,"$35,000 - $50,000 per month",2024-07-17 20:00:00,77354119,https://hk.jobsdb.com/job/77354119
Senior Manager / AVP - MIS and Reporting [Retail Bank Perm Job],Conners Consulting Limited,8,False,"North Point, Eastern District",Banking & Financial Services,,2024-07-12 08:00:00,77221993,https://hk.jobsdb.com/job/77221993
Cantonese Text-To-Speech (TTS) Intern,SenseTime Group Limited,,False,Sha Tin District,Healthcare & Medical,,2024-07-13 08:00:00,77252525,https://hk.jobsdb.com/job/77252525
"Manager, Credit Control (Insurance)",Hays Hong Kong Limited,4,False,"Quarry Bay, Eastern District",Accounting,Attractive Compensation & Benefits,2024-07-17 11:00:00,77336556,https://hk.jobsdb.com/job/77336556
System Analyst (IT Solutions),FUJIFILM BI,2,False,"Ngau Tau Kok, Kwun Tong District",Information & Communication Technology,,2024-07-11 08:00:00,77167249,https://hk.jobsdb.com/job/77167249
Engineer (Perm/2-Year Contract) (Power Systems/TSD/Systems Engineering Branch),CLP Power Hong Kong Limited 中華電力有限公司,3,False,"Sham Shui Po, Sham Shui Po District",Engineering,,2024-07-17 10:00:00,77336005,https://hk.jobsdb.com/job/77336005
System Analyst - Banking (45-65k; Permanent),Ambition,5,False,Islands District,Information & Communication Technology,$45k - $65k p.a.,2024-07-11 08:00:00,77184176,https://hk.jobsdb.com/job/77184176
"Senior Business Analyst, Business Change & Re-engineering",Chubb Insurance Hong Kong Limited,4,False,"Quarry Bay, Eastern District",Information & Communication Technology,,2024-07-06 08:00:00,77077295,https://hk.jobsdb.com/job/77077295
Business Analyst - Web & Apps,AS Watson Retail (HK) Limited,,True,"Whampoa Garden, Kowloon City District",Information & Communication Technology,,2024-07-06 08:00:00,76792908,https://hk.jobsdb.com/job/76792908
Trader (Delta One Trading),Haitong International Management Services Company Limited,,False,"Central, Central and Western District",Banking & Financial Services,,2024-07-11 08:00:00,77182797,https://hk.jobsdb.com/job/77182797
"Analyst/Assistant Vice President, Accounting Section (Finacial Reporting)","MUFG Bank, Ltd.",,False,"Kai Tak, Kowloon City District",Accounting,,2024-07-17 11:00:00,77338419,https://hk.jobsdb.com/job/77338419
Research Intern (Digital Product Team),LFX Services Limited,,False,"Lai Chi Kok, Sham Shui Po District",Marketing & Communications,,2024-07-09 08:00:00,77124664,https://hk.jobsdb.com/job/77124664
Strategy Associate,Crypto.com,1,True,"Admiralty, Central and Western District",Consulting & Strategy,,2024-07-11 08:00:00,77172812,https://hk.jobsdb.com/job/77172812
Assistant Manager – Compensation & Benefits (1 year contract),Maxim's Caterers Limited,6,False,"Lai Chi Kok, Sham Shui Po District",Human Resources & Recruitment,,2024-07-13 08:00:00,77246933,https://hk.jobsdb.com/job/77246933
Data Entry Clerk (Contractor/Part-time),Siemens Healthcare Limited,,False,"Kwun Tong, Kwun Tong District",Administration & Office Support,,2024-07-17 08:00:00,77312618,https://hk.jobsdb.com/job/77312618
Business Analyst,Mattex Asia Development Limited,2,False,"Lai Chi Kok, Sham Shui Po District",Information & Communication Technology,,2024-07-04 08:00:00,77016605,https://hk.jobsdb.com/job/77016605
Business Development/Operations Specialist - Fin-tech & Financial Services,Up Way China Bullion Limited,2,False,Tsuen Wan District,Banking & Financial Services,,2024-07-10 08:00:00,77142546,https://hk.jobsdb.com/job/77142546
Financial Analyst,Carlsberg Brewery H K Ltd,2,False,"Hung Hom, Kowloon City District",Accounting,,2024-07-05 08:00:00,77049448,https://hk.jobsdb.com/job/77049448
"Assistant Vice President, Business Analysis",China Everbright Securities International Company Limited,5,False,"Wan Chai, Wan Chai District",Information & Communication Technology,,2024-07-10 08:00:00,77139628,https://hk.jobsdb.com/job/77139628
Senior Strategist (ESG),Bank of China (Hong Kong) Limited,5,False,Central and Western District,Consulting & Strategy,,2024-07-14 08:00:00,77262272,https://hk.jobsdb.com/job/77262272
Analyst Programmer,HGC Global Communications Limited,3,True,"Tsing Yi, Kwai Tsing District",Information & Communication Technology,,2024-07-13 08:00:00,75409495,https://hk.jobsdb.com/job/75409495
Financial Planning & Analysis Manager,ConnectedGroup Limited,7,False,Central and Western District,Accounting,,2024-07-17 16:00:00,77349043,https://hk.jobsdb.com/job/77349043
Private Wealth Management Internship/Trainee/Wealth Management Manager,Mvp Professional Financial Consultancy Company,3,True,"Causeway Bay, Wan Chai District",Banking & Financial Services,,2024-07-17 08:00:00,77307517,https://hk.jobsdb.com/job/77307517
"Data Managment Officer (Banking, data quality)",PERSOLKELLY Hong Kong Limited,3,False,"Central, Central and Western District",Banking & Financial Services,,2024-07-06 08:00:00,77063379,https://hk.jobsdb.com/job/77063379
"Senior Consultant, Finance Transformation, Finance Consulting (MJ004373)",KPMG,2,False,"Wong Chuk Hang, Southern District",Consulting & Strategy,,2024-07-13 08:00:00,74519565,https://hk.jobsdb.com/job/74519565
ESG Reporting Manager – HK listed,Lauris Walton International Limited,5,False,Central and Western District,Consulting & Strategy,,2024-07-17 16:00:00,77348328,https://hk.jobsdb.com/job/77348328
Business Analyst (Supply Chain Solutions),Tradelink Electronic Commerce Ltd,,False,Kwai Tsing District,Information & Communication Technology,,2024-07-04 08:00:00,77016154,https://hk.jobsdb.com/job/77016154
AVP / Manager - Credit Risk Modeling & Analytics,Chong Hing Bank Ltd,5,False,"Kowloon Bay, Kwun Tong District",Banking & Financial Services,,2024-07-10 08:00:00,77139961,https://hk.jobsdb.com/job/77139961
QA Engineer at ASMPT Technology Hong Kong Limited,Jobsdb - SmartHire,,False,"Tsing Yi, Kwai Tsing District","Manufacturing, Transport & Logistics",,2024-07-17 08:00:00,76739726,https://hk.jobsdb.com/job/76739726
Senior Environment Officer,Kerry Properties Limited,4,False,"Quarry Bay, Eastern District",Construction,,2024-07-17 11:00:00,77338029,https://hk.jobsdb.com/job/77338029
Analyst Programmer / Programmer /System Analyst,Leadership Solutions Limited,,False,Hong Kong,Information & Communication Technology,,2024-07-17 08:00:00,77309620,https://hk.jobsdb.com/job/77309620
Senior Cyber Security Analyst (Up to 70k/monthly),Randstad Hong Kong Limited,4,False,Central and Western District,Information & Communication Technology,$50k - $70k p.m. + guarantee bonus,2024-07-17 08:00:00,77322776,https://hk.jobsdb.com/job/77322776
Systems Analyst / Senior Systems Analyst,Wafer Systems (Asia) Limited,5,False,Hong Kong,Information & Communication Technology,,2024-07-13 08:00:00,77235670,https://hk.jobsdb.com/job/77235670
Senior Manager - Infrastructure  (Ref# SMI20240715J),Hong Kong Cyberport Management Co Ltd,1,True,"Cyberport, Southern District",Information & Communication Technology,,2024-07-16 08:00:00,77291301,https://hk.jobsdb.com/job/77291301
Project manager (DEV)/ System Analyst/Analyst Programmer(c#.net/Java)),Mtel Career Consulting,4,True,"Kowloon Bay, Kwun Tong District",Information & Communication Technology,,2024-07-13 08:00:00,77251889,https://hk.jobsdb.com/job/77251889
Senior Strategist (ESG),Bank of China (Hong Kong) Limited,5,False,Central and Western District,Consulting & Strategy,,2024-07-14 08:00:00,77262270,https://hk.jobsdb.com/job/77262270
"Assistant Manager, Business Analysis (MNC, FMCG, Retail, Consumer goods)",Hoper Limited,6,False,Hong Kong,Information & Communication Technology,,2024-07-03 08:00:00,76982154,https://hk.jobsdb.com/job/76982154
Assistant Manager - Property,Chow Sang Sang Holdings International Limited,8,True,"Cheung Sha Wan, Sham Shui Po District",Real Estate & Property,,2024-07-13 08:00:00,77252020,https://hk.jobsdb.com/job/77252020
Cargo Digital Specialist,Cathay Pacific Airways Ltd,2,False,"Lantau Island, Islands District","Manufacturing, Transport & Logistics",,2024-07-17 08:00:00,77305341,https://hk.jobsdb.com/job/77305341
Assistant Vice President – Performance Management,YF Life Insurance International Limited,1,False,Wan Chai District,Human Resources & Recruitment,,2024-07-17 23:00:00,77355897,https://hk.jobsdb.com/job/77355897
"Assistant Vice President, Business Planning (Wholesale Banking Group)",OCBC Bank (Hong Kong) Limited,,False,"Central, Central and Western District",Banking & Financial Services,,2024-07-10 08:00:00,76794635,https://hk.jobsdb.com/job/76794635
Systems Analyst (ERP),CK Hutchison Holdings Limited,,False,"Hung Hom, Kowloon City District",Information & Communication Technology,,2024-07-11 08:00:00,77179266,https://hk.jobsdb.com/job/77179266
System Development Manager - Assistant Vice President - Group Risk Management,Hong Kong Exchanges & Clearing Ltd,7,False,Hong Kong,Information & Communication Technology,,2024-07-17 08:00:00,77325737,https://hk.jobsdb.com/job/77325737
"Assistant Manager, Customer Acquisition and Retention",Chubb Life Insurance Hong Kong Limited,5,False,"Causeway Bay, Wan Chai District",Marketing & Communications,,2024-07-12 08:00:00,77207882,https://hk.jobsdb.com/job/77207882
"IT Solution Specialist, Application",Hong Kong Business Aviation Centre Ltd,1,False,"Airport Area, Islands District",Information & Communication Technology,,2024-07-10 08:00:00,77149894,https://hk.jobsdb.com/job/77149894
"Business Analyst Trainee  (5-day work, 15-20K) (IANG/Fresh Graduate Welcomed)",Fran & Wen Profit,,True,"Kwun Tong, Kwun Tong District",Banking & Financial Services,,2024-07-05 08:00:00,77046913,https://hk.jobsdb.com/job/77046913
Project Officer (Digital Transformation) Entry level,HKT,3,False,"Wan Chai, Wan Chai District",Information & Communication Technology,,2024-07-17 19:00:00,77353285,https://hk.jobsdb.com/job/77353285
Assistant Digital Marketing Manager (Media/ Agency background) (up to 40K!),JFE Consulting Limited,,False,"Hung Hom, Kowloon City District",Marketing & Communications,,2024-07-18 00:00:00,77356458,https://hk.jobsdb.com/job/77356458
Social & Elderly Wellness Manager,Hong Kong Housing Society,5,False,"Quarry Bay, Eastern District",Community Services & Development,,2024-07-13 08:00:00,77261782,https://hk.jobsdb.com/job/77261782
Assistant Logistics Officer,S.F. Express (Hong Kong) Limited,2,False,"Tsing Yi, Kwai Tsing District","Manufacturing, Transport & Logistics",,2024-07-17 14:00:00,77345063,https://hk.jobsdb.com/job/77345063
Dealer Trainee / Assistant Dealer (Foreign Futures / FOREX),Phillip Securities (HK) Ltd,,False,"Admiralty, Central and Western District",Banking & Financial Services,,2024-07-17 11:00:00,76835855,https://hk.jobsdb.com/job/76835855
PORTFOLIO INVESTMENT ANALYST (PORTFOLIO ANALYSIS) - AVP or above,Recruitment Intelligence Consultants Ltd,,True,"Central, Central and Western District",Banking & Financial Services,,2024-07-12 08:00:00,77199525,https://hk.jobsdb.com/job/77199525
Business Control - Assistant Manager/ Manager,Uni-China (Business) Management Limited,,False,"Tsim Sha Tsui, Yau Tsim Mong District",Accounting,,2024-07-17 18:00:00,77352399,https://hk.jobsdb.com/job/77352399
Mobile/E-Banking: Junior IT Business Analysts (Major Bank),IT Solutions Ltd.,,True,Hong Kong,Information & Communication Technology,,2024-07-09 08:00:00,77112433,https://hk.jobsdb.com/job/77112433
CRM Business Analyst (E-commerce project),Captar Partners Limited,4,True,Central and Western District,Information & Communication Technology,HKD 500000 - 800000 per annum,2024-07-03 08:00:00,76984065,https://hk.jobsdb.com/job/76984065
Programmer,Moore Associates Limited,,False,"Tsim Sha Tsui, Yau Tsim Mong District",Information & Communication Technology,,2024-07-13 08:00:00,77237455,https://hk.jobsdb.com/job/77237455
System Analyst (VTE346/J20),VTECH Corporate Services Ltd,2,False,Tai Po District,Information & Communication Technology,,2024-07-12 08:00:00,77204926,https://hk.jobsdb.com/job/77204926
Assistant Marketing Officer (CRM),Luk Fook Holdings Company Limited,,False,Sha Tin District,Marketing & Communications,,2024-07-13 08:00:00,77251789,https://hk.jobsdb.com/job/77251789
System Analyst,Active Learning Solutions Limited,,False,"Lai Chi Kok, Sham Shui Po District",Information & Communication Technology,,2024-07-09 08:00:00,77123560,https://hk.jobsdb.com/job/77123560
System Analyst,Ocean Blue Supply Chain Management Co. Limited,4,False,Sha Tin District,Information & Communication Technology,,2024-07-10 08:00:00,77117413,https://hk.jobsdb.com/job/77117413
Senior Security Analyst | HKD 55K,Leapin Hong Kong,6,False,Eastern District,Information & Communication Technology,"$45,000 - $55,000 per month",2024-07-17 08:00:00,77323029,https://hk.jobsdb.com/job/77323029
Researcher/Senior Researcher  (Position ID: 202407P1),Ninenovo Technology (Hong Kong) Limited,,False,"Science Park, Tai Po District",Science & Technology,"$25,000 - $35,000 per month",2024-07-11 08:00:00,77078466,https://hk.jobsdb.com/job/77078466
"Credit Analyst, Fintech, 40k",Michael Page International (HK) Ltd,3,False,Central and Western District,Banking & Financial Services,$30k - $40k p.m.,2024-07-10 08:00:00,77137457,https://hk.jobsdb.com/job/77137457
Data Engineer/Data Trainee (New Media Business),Sing Tao Management Services Limited,2,True,"Tseung Kwan O, Sai Kung District",Information & Communication Technology,,2024-07-05 08:00:00,77035104,https://hk.jobsdb.com/job/77035104
Regional HR and Systems Specialist - Asia,Egis Asia Pacific Holding Limited,5,False,"Wan Chai, Wan Chai District",Human Resources & Recruitment,,2024-07-16 08:00:00,76717614,https://hk.jobsdb.com/job/76717614
Business Solution Assistant,DKSH Hong Kong Limited,,False,Southern District,Information & Communication Technology,,2024-07-12 08:00:00,77214112,https://hk.jobsdb.com/job/77214112
UI/UX Designer,BlueOnion Limited,,True,"Tai Koo, Eastern District",Information & Communication Technology,"$25,333 - $38,000 per month",2024-07-13 08:00:00,77248563,https://hk.jobsdb.com/job/77248563
IT Business Analyst – Agency Contractor,Chiyu Banking Corp Ltd,3,False,"Central, Central and Western District",Information & Communication Technology,,2024-07-06 08:00:00,77079762,https://hk.jobsdb.com/job/77079762
Marketing Manager (CRM),Yata Limited,6,False,Sha Tin District,Marketing & Communications,,2024-07-12 08:00:00,77211880,https://hk.jobsdb.com/job/77211880
Senior Business Analyst - ERP (Finance module),ConnectedGroup Limited,2,False,Central and Western District,Information & Communication Technology,,2024-07-09 08:00:00,77118797,https://hk.jobsdb.com/job/77118797
"Manager, Business Management – Treasury & Markets",Chong Hing Bank Ltd,2,False,"Central, Central and Western District",Banking & Financial Services,,2024-07-10 08:00:00,77152073,https://hk.jobsdb.com/job/77152073
Sales Operations Associate,Shopline Limited,2,False,"Causeway Bay, Wan Chai District",Administration & Office Support,,2024-07-17 08:00:00,77322439,https://hk.jobsdb.com/job/77322439
System Analyst | PERM | Health Care | Career Growth,ADECCO Personnel Limited,5,False,"Central, Central and Western District",Information & Communication Technology,"$40,000 - $55,000 per month",2024-07-10 08:00:00,77155317,https://hk.jobsdb.com/job/77155317
Systems Analyst (ALTO) (Ref: 24001GZ),Hong Kong Metropolitan University,2,False,"Ngau Tau Kok, Kwun Tong District",Information & Communication Technology,,2024-07-09 08:00:00,77108345,https://hk.jobsdb.com/job/77108345
Senior Credit Analyst (Ref: JD-SCA),Public Bank (Hong Kong) Ltd,5,True,Hong Kong,Banking & Financial Services,,2024-07-13 08:00:00,74480589,https://hk.jobsdb.com/job/74480589
"Business Strategy Manager, Commercial Banking",Bank of China (Hong Kong) Limited,4,False,"Central, Central and Western District",Banking & Financial Services,,2024-07-16 08:00:00,77286222,https://hk.jobsdb.com/job/77286222
"SAP FICO Specialist (up to HK$62,000)",Headshot Recruitment Limited,5,False,Hong Kong,Information & Communication Technology,,2024-07-17 08:00:00,77309412,https://hk.jobsdb.com/job/77309412
Analyst Programmer (GETS Solution Development),Tradelink Electronic Commerce Ltd,2,False,Kwai Tsing District,Information & Communication Technology,,2024-07-16 08:00:00,77279139,https://hk.jobsdb.com/job/77279139
Senior IT Analyst (Application Development),Hong Kong Air Cargo Terminals Ltd,2,True,"Airport Area, Islands District",Information & Communication Technology,,2024-07-13 08:00:00,74478586,https://hk.jobsdb.com/job/74478586
General Ledger Accountant,China Telecom Global Limited,3,False,Wan Chai District,Accounting,,2024-07-13 08:00:00,77251632,https://hk.jobsdb.com/job/77251632
Assistant Digital Platform Manager – Digital Onboarding,Hang Seng Bank Ltd,,False,Hong Kong,Banking & Financial Services,,2024-07-16 08:00:00,77287389,https://hk.jobsdb.com/job/77287389
Senior Project Officer,HKT,1,True,Sham Shui Po District,Engineering,,2024-07-17 17:00:00,77350310,https://hk.jobsdb.com/job/77350310
Project Executive (Business Planning),Hong Kong Trade Development Council,2,False,"Wan Chai, Wan Chai District",Marketing & Communications,,2024-07-17 17:00:00,76508004,https://hk.jobsdb.com/job/76508004
Database Administrator,Lenovo PCCW Solutions,4,False,"Tai Kok Tsui, Yau Tsim Mong District",Information & Communication Technology,,2024-07-17 08:00:00,77322955,https://hk.jobsdb.com/job/77322955
Senior Strategist (ESG),Bank of China (Hong Kong) Limited,5,False,Central and Western District,Banking & Financial Services,,2024-07-14 08:00:00,77262271,https://hk.jobsdb.com/job/77262271
Programmer ( Fresh graduate welcomed),Computer Recruitment Consultants Ltd,,False,"Wan Chai, Wan Chai District",Information & Communication Technology,,2024-07-16 08:00:00,77293590,https://hk.jobsdb.com/job/77293590
Associate Data Scientist,JFE Consulting Limited,3,False,"Central, Central and Western District",Information & Communication Technology,,2024-07-01 08:00:00,76937633,https://hk.jobsdb.com/job/76937633
Analyst Programmer,LW Consulting Limited,,False,"Happy Valley, Wan Chai District",Information & Communication Technology,,2024-07-16 08:00:00,77288931,https://hk.jobsdb.com/job/77288931
Financial Analyst FP&A – Leading Food & Beverage FMCG Company,The Edge Partnership Holdings Limited,6,False,Central and Western District,Accounting,,2024-07-13 08:00:00,77246846,https://hk.jobsdb.com/job/77246846
Computational Biologist (at the rank of Senior Technical Officer),The University of Hong Kong,4,False,"Pok Fu Lam, Southern District",Information & Communication Technology,,2024-07-12 08:00:00,77205943,https://hk.jobsdb.com/job/77205943
"Assistant Section Manager - System, IT Department",MUJI (Hong Kong) Company Limited,2,True,"Tsim Sha Tsui, Yau Tsim Mong District",Information & Communication Technology,,2024-07-17 08:00:00,77018582,https://hk.jobsdb.com/job/77018582
"AVP, Specialist, Platform and Projects, Consumer Banking",DBS Bank (Hong Kong) Limited,5,False,Kwun Tong District,Information & Communication Technology,,2024-07-13 08:00:00,77247860,https://hk.jobsdb.com/job/77247860
Senior Research Scientist (TCM Team Lead) I New Headcount,Vita Green Health Products Company Limited,3,False,"Tai Po, Tai Po District",Science & Technology,,2024-07-17 08:00:00,77318198,https://hk.jobsdb.com/job/77318198
(Up to 55K-75K) System Analyst/ Analyst Programmer / Business Analyst,Seamatch Asia Limited,2,True,"Central, Central and Western District",Information & Communication Technology,"$55,000 - $75,000 per month",2024-07-09 08:00:00,77107966,https://hk.jobsdb.com/job/77107966
Junior Operations Analysts,"Yuanta Futures (HK) Co., Limited",1,False,"Admiralty, Central and Western District",Banking & Financial Services,,2024-07-13 08:00:00,77248681,https://hk.jobsdb.com/job/77248681
Assistant Manager,The Hong Kong Mortgage Corporation Limited,2,False,Kwun Tong District,Banking & Financial Services,,2024-07-17 08:00:00,77322606,https://hk.jobsdb.com/job/77322606
Project Engineer/ Research Engineer (Hybrid Strategies for AI-based...,CENTRE FOR ADVANCES IN RELIABILITY AND SAFETY LIMITED,,False,Sha Tin District,Engineering,,2024-07-11 08:00:00,77167857,https://hk.jobsdb.com/job/77167857
Project Engineer/ Research Engineer (Hybrid Strategies for AI-based...,CENTRE FOR ADVANCES IN RELIABILITY AND SAFETY LIMITED,,False,Sha Tin District,Engineering,,2024-07-11 08:00:00,77168040,https://hk.jobsdb.com/job/77168040
Replenishment Solutions Executive,TAL Apparel Limited,3,False,"Tsim Sha Tsui, Yau Tsim Mong District",Retail & Consumer Products,,2024-07-12 08:00:00,77221682,https://hk.jobsdb.com/job/77221682
Senior Student Affairs Officer (Post Ref.: 24/270),Lingnan University,3,False,Tuen Mun District,Education & Training,,2024-07-17 16:00:00,77349172,https://hk.jobsdb.com/job/77349172
Investor Relations Analyst/ Associate (Fund/ Private Equity),Trinity Search Limited,,False,Hong Kong Island,Banking & Financial Services,,2024-07-16 08:00:00,77288419,https://hk.jobsdb.com/job/77288419
"Product Manager - IT Hardware (OPEN BUDGET, double pay and up to 3 months bonus)",HR Plus (Talent) Limited,4,True,Central and Western District,Information & Communication Technology,"$33,333 - $50,000 per month",2024-07-17 11:00:00,75234342,https://hk.jobsdb.com/job/75234342
"Technical Claims Analyst (Insurance, Perm 25k -35k)",Lloyd Karson International Limited,2,False,"Central, Central and Western District",Insurance & Superannuation,"$25,000 - $35,000 per month",2024-07-05 08:00:00,77049005,https://hk.jobsdb.com/job/77049005
Database Consultant / DBA up to 70k,Pathsight Limited,6,False,Hong Kong,Information & Communication Technology,,2024-07-15 08:00:00,77268945,https://hk.jobsdb.com/job/77268945
IT Business Analyst,YesStyle.com Limited,3,False,Kwai Tsing District,Information & Communication Technology,,2024-07-05 08:00:00,76703236,https://hk.jobsdb.com/job/76703236
System Analyst [Backend],United Asia Finance Limited,5,False,"Wan Chai, Wan Chai District",Information & Communication Technology,,2024-07-12 08:00:00,76659036,https://hk.jobsdb.com/job/76659036
"Assistant Manager / Senior Executive, Account Servicing (Retainer and Agency)",Maxlytics Limited,3,False,"Causeway Bay, Wan Chai District","Advertising, Arts & Media",,2024-07-17 13:00:00,77342614,https://hk.jobsdb.com/job/77342614
Programmer (5-Day Work) at Advance Label Limited,Jobsdb - SmartHire,4,False,"Kwun Tong, Kwun Tong District",Information & Communication Technology,,2024-07-17 08:00:00,76655444,https://hk.jobsdb.com/job/76655444
"Business analyst (Perm role, digital project, 25k-32k)",Linkers International Limited,2,False,"Kwun Tong, Kwun Tong District",Information & Communication Technology,"$20,000 - $30,000 per month",2024-07-05 08:00:00,77044413,https://hk.jobsdb.com/job/77044413
Senior Data Engineer,Automated Systems (HK) Ltd,,False,Central and Western District,Information & Communication Technology,,2024-07-04 08:00:00,77008461,https://hk.jobsdb.com/job/77008461
Contract Analyst Programmer (CAP)/ Contract Programmer (CP) (Multiple openings),EDPS Systems Limited,2,False,Hong Kong,Information & Communication Technology,,2024-07-17 08:00:00,77325306,https://hk.jobsdb.com/job/77325306
"Manager, Museum Business and Research, M+ Museum (Ref: R5432)",West Kowloon Cultural District Authority,8,False,"Yau Ma Tei, Yau Tsim Mong District",Administration & Office Support,,2024-07-13 08:00:00,77252974,https://hk.jobsdb.com/job/77252974
System Analyst (Ref: JDB/DS/SA),Computer And Technologies Solutions Limited,3,False,"Wong Chuk Hang, Southern District",Information & Communication Technology,,2024-07-09 08:00:00,77118279,https://hk.jobsdb.com/job/77118279
Manager (Career Development) (Post Ref.: 24/268),Lingnan University,1,False,Tuen Mun District,Marketing & Communications,,2024-07-17 16:00:00,77349301,https://hk.jobsdb.com/job/77349301
Distribution Channel Marketing Manager – FSI (1-year Contract) (HKD40k – 55k),Lloyd Karson International Limited,8,False,Eastern District,Marketing & Communications,"$45,000 - $55,000 per month",2024-07-17 20:00:00,77354775,https://hk.jobsdb.com/job/77354775
